[
    {
        "question": "A 21-year-old male presents to his primary care provider for fatigue. He reports that he graduated from college last month and returned 3 days ago from a 2 week vacation to Vietnam and Cambodia. For the past 2 days, he has developed a worsening headache, malaise, and pain in his hands and wrists. The patient has a past medical history of asthma managed with albuterol as needed. He is sexually active with both men and women, and he uses condoms \u201cmost of the time.\u201d On physical exam, the patient\u2019s temperature is 102.5\u00b0F (39.2\u00b0C), blood pressure is 112/66 mmHg, pulse is 105/min, respirations are 12/min, and oxygen saturation is 98% on room air. He has tenderness to palpation over his bilateral metacarpophalangeal joints and a maculopapular rash on his trunk and upper thighs. Tourniquet test is negative. Laboratory results are as follows:\n\nHemoglobin: 14 g/dL\nHematocrit: 44%\nLeukocyte count: 3,200/mm^3\nPlatelet count: 112,000/mm^3\n\nSerum:\nNa+: 142 mEq/L\nCl-: 104 mEq/L\nK+: 4.6 mEq/L\nHCO3-: 24 mEq/L\nBUN: 18 mg/dL\nGlucose: 87 mg/dL\nCreatinine: 0.9 mg/dL\nAST: 106 U/L\nALT: 112 U/L\nBilirubin (total): 0.8 mg/dL\nBilirubin (conjugated): 0.3 mg/dL\n\nWhich of the following is the most likely diagnosis in this patient? Options: (D) Hepatitis A (A) Chikungunya (C) Epstein-Barr virus (B) Dengue fever (E) Typhoid fever",
        "label": "A",
        "answer": "Chikungunya",
        "options": {
            "A": "Chikungunya",
            "B": "Dengue fever",
            "C": "Epstein-Barr virus",
            "D": "Hepatitis A",
            "E": "Typhoid fever"
        },
        "response": {
            "0.0": "Let's analyze the case step by step.\n\n1. **Travel History**: The patient recently returned from a trip to Vietnam and Cambodia, which are regions where certain viral infections are endemic.\n\n2. **Symptoms**: The patient presents with:\n   - Fatigue\n   - Worsening headache\n   - Malaise\n   - Pain in hands and wrists (suggestive of arthralgia)\n   - Fever (102.5\u00b0F)\n   - Maculopapular rash\n   - Tenderness over bilateral metacarpophalangeal joints\n\n3. **Laboratory Findings**:\n   - Leukopenia (low white blood cell count: 3,200/mm\u00b3)\n   - Thrombocytopenia (low platelet count: 112,000/mm\u00b3)\n   - Elevated liver enzymes (AST: 106 U/L, ALT: 112 U/L)\n\n4. **Differential Diagnosis**:\n   - **Dengue Fever**: Common in Southeast Asia, presents with fever, headache, arthralgia, rash, leukopenia, and thrombocytopenia. The elevated liver enzymes also fit with dengue.\n   - **Chikungunya**: Also presents with fever and severe joint pain, but typically has a more pronounced arthralgia component and may not always show significant liver enzyme elevation.\n   - **Hepatitis A**: Would typically present with more prominent liver symptoms and jaundice, and the travel history fits, but the joint pain is less characteristic.\n   - **Epstein-Barr Virus**: Typically presents with fatigue, fever, and lymphadenopathy, not primarily with joint pain and thrombocytopenia.\n   - **Typhoid Fever**: Would present with prolonged fever, abdominal symptoms, and possibly rose spots, but not typically with joint pain and the specific lab findings seen here.\n\nGiven the travel history, symptoms, and laboratory findings, the most likely diagnosis is:\n\n**Answer: (B) Dengue fever**"
        }
    },
    {
        "question": "A 56-year-old man with a history of hypertension presents to his physician with progressive fatigue and new onset muscle cramps. He has had no recent changes to his medication regimen, which includes hydrochlorothiazide, lisinopril, and amlodipine. His temperature is 98.0\u00b0F (36.7\u00b0C), blood pressure is 174/111 mmHg, pulse is 70/min, respirations are 12/min, and oxygen saturation is 98% on room air. The patient's cardiopulmonary and abdominal exams are unremarkable. Laboratory values are ordered as seen below.\n\nSerum:\nNa+: 138 mEq/L\nCl-: 100 mEq/L\nK+: 3.3 mEq/L\nHCO3-: 33 mEq/L\nBUN: 20 mg/dL\nGlucose: 129 mg/dL\n\nWhat is the most likely underlying etiology of this patient's hypertension? Options: (B) Catecholamine-secreting mass (C) Cortisol excess (D) Impaired kidney perfusion (A) Aldosterone excess (E) Increased peripheral vascular resistance",
        "label": "A",
        "answer": "Aldosterone excess",
        "options": {
            "A": "Aldosterone excess",
            "B": "Catecholamine-secreting mass",
            "C": "Cortisol excess",
            "D": "Impaired kidney perfusion",
            "E": "Increased peripheral vascular resistance"
        },
        "response": {
            "0.0": "Let's analyze the information step by step.\n\n1. **Patient Profile**: The patient is a 56-year-old man with a history of hypertension, presenting with progressive fatigue and muscle cramps. He is on hydrochlorothiazide, which is a diuretic, and has new onset muscle cramps, which can be indicative of electrolyte imbalances.\n\n2. **Laboratory Values**:\n   - Sodium (Na+): 138 mEq/L (normal)\n   - Chloride (Cl-): 100 mEq/L (normal)\n   - Potassium (K+): 3.3 mEq/L (low, indicating hypokalemia)\n   - Bicarbonate (HCO3-): 33 mEq/L (elevated, indicating metabolic alkalosis)\n   - BUN: 20 mg/dL (slightly elevated)\n   - Glucose: 129 mg/dL (elevated, indicating possible glucose intolerance or diabetes)\n\n3. **Interpretation of Findings**:\n   - The patient has hypokalemia (low potassium) and metabolic alkalosis (high bicarbonate). These findings are often associated with conditions that cause excess aldosterone, such as primary hyperaldosteronism (Conn's syndrome).\n   - Hydrochlorothiazide can cause hypokalemia, but the degree of hypokalemia and the metabolic alkalosis suggest that there may be an underlying condition causing excess aldosterone production.\n\n4. **Options Analysis**:\n   - (B) Catecholamine-secreting mass: This would typically cause episodic hypertension and not necessarily hypokalemia and metabolic alkalosis.\n   - (C) Cortisol excess: This could cause hypertension (Cushing's syndrome) but would typically not present with hypokalemia and metabolic alkalosis.\n   - (D) Impaired kidney perfusion: This could lead to secondary hypertension but would not typically cause hypokalemia and metabolic alkalosis.\n   - (A) Aldosterone excess: This is consistent with the findings of hypokalemia and metabolic alkalosis, suggesting primary hyperaldosteronism.\n   - (E) Increased peripheral vascular resistance: This is a common cause of hypertension but does not explain the electrolyte abnormalities.\n\nGiven the analysis, the most likely underlying etiology of this patient's hypertension is:\n\n**Answer: (A) Aldosterone excess**"
        }
    },
    {
        "question": "A 47-year-old woman seeks evaluation at your office because she has had postcoital vaginal bleeding for the past 8 months with occasional intermenstrual watery, blood-tinged vaginal discharge. Her family history is negative for malignancies and inherited disorders. She is the result of a pregnancy complicated by numerous miscarriages in the 1960s, for which her mother received diethylstilbestrol. During a pelvic examination, you notice a polypoid mass on the anterior wall of the vagina. The bimanual examination is negative for adnexal masses. You suspect the presence of carcinoma and, therefore, send tissue samples to pathology, which confirmed the presence of malignant cells. Which of the following is the most likely malignant tumor in this patient? Options: (D) Verrucous carcinoma (B) Melanoma (E) Squamous cell carcinoma (SCC) (C) Botryoid sarcoma (A) Clear cell adenocarcinoma",
        "label": "A",
        "answer": "Clear cell adenocarcinoma",
        "options": {
            "A": "Clear cell adenocarcinoma",
            "B": "Melanoma",
            "C": "Botryoid sarcoma",
            "D": "Verrucous carcinoma",
            "E": "Squamous cell carcinoma (SCC)"
        },
        "response": {
            "0.0": "Let's think step by step. The patient's history is significant for postcoital vaginal bleeding, intermenstrual watery, blood-tinged vaginal discharge, and a polypoid mass on the anterior wall of the vagina. Additionally, she has a history of maternal exposure to diethylstilbestrol (DES), which is known to be associated with certain types of vaginal and cervical cancers.\n\nGiven these factors, the most likely malignant tumor in this patient is **Clear cell adenocarcinoma (A)**. This type of cancer is associated with DES exposure and can present with similar symptoms as described in the vignette. \n\nAnswer: (A) Clear cell adenocarcinoma"
        }
    },
    {
        "question": "A 36-year-old man undergoes open reduction and internal fixation of a left femur fracture sustained after a motor vehicle collision. Three days after the surgery, he develops fever and redness around the surgical site. His temperature is 39.5\u00b0C (103.1\u00b0F). Physical examination shows purulent discharge from the wound with erythema of the surrounding skin. Wound culture of the purulent discharge shows gram-positive cocci in clusters. Treatment with oral dicloxacillin is initiated. Four days later, the patient continues to have high-grade fever, pain, and purulent discharge. Which of the following characteristics of the infecting organism best explains the failure to improve with antibiotic therapy? Options: (A) Secretion of a pyrogenic toxin (E) Adaptation in binding proteins (D) Development of efflux pumps (C) Ability to cleave \u03b2-lactam rings (B) Presence of an impenetrable outer membrane",
        "label": "E",
        "answer": "Adaptation in binding proteins",
        "options": {
            "A": "Secretion of a pyrogenic toxin",
            "B": "Presence of an impenetrable outer membrane",
            "C": "Ability to cleave \u03b2-lactam rings",
            "D": "Development of efflux pumps",
            "E": "Adaptation in binding proteins"
        },
        "response": {
            "0.0": "Let's analyze the situation step by step.\n\nThe patient has developed a postoperative infection characterized by fever, purulent discharge, and the presence of gram-positive cocci in clusters. The organism is likely Staphylococcus aureus, which is known to cause such infections. The treatment with oral dicloxacillin, a penicillinase-resistant penicillin, is appropriate for treating infections caused by Staphylococcus aureus.\n\nHowever, the patient continues to have high-grade fever and purulent discharge despite this treatment, indicating that the antibiotic is not effective against the organism. \n\nNow, let's evaluate the options:\n\n(A) **Secretion of a pyrogenic toxin** - While some bacteria can secrete toxins that cause fever, this does not explain the failure of the antibiotic treatment.\n\n(B) **Presence of an impenetrable outer membrane** - This is characteristic of gram-negative bacteria, not gram-positive cocci, so it does not apply here.\n\n(C) **Ability to cleave \u03b2-lactam rings** - This refers to the production of \u03b2-lactamase enzymes, which can inactivate \u03b2-lactam antibiotics like penicillins. Staphylococcus aureus can produce such enzymes, leading to resistance against \u03b2-lactam antibiotics.\n\n(D) **Development of efflux pumps** - This mechanism is more commonly associated with gram-negative bacteria and is not a primary resistance mechanism for Staphylococcus aureus.\n\n(E) **Adaptation in binding proteins** - This could refer to changes in penicillin-binding proteins (PBPs) that confer resistance, but it is less common than \u03b2-lactamase production in Staphylococcus aureus.\n\nGiven the context of the infection and the antibiotic treatment, the most likely explanation for the failure to improve with dicloxacillin is:\n\n**Answer: (C) Ability to cleave \u03b2-lactam rings.** \n\nThis indicates that the organism is producing \u03b2-lactamase, which inactivates the antibiotic, leading to treatment failure."
        }
    },
    {
        "question": "A 59-year-old man is brought to the emergency department with a history of black, tarry stools but denies vomiting of blood or abdominal pain. His family has noticed progressive confusion. History is significant for liver cirrhosis and alcoholism. His heart rate is 112/min, temperature is 37.1\u00b0C (98.7\u00b0F), and blood pressure is 110/70 mm Hg. On examination, he is jaundiced, lethargic, is oriented to person and place but not date, and has moderate ascites. Neurological examination reveals asterixis, and his stool is guaiac-positive. Liver function test are shown below:\nTotal albumin 2 g/dL\nProthrombin time 9 seconds\nTotal bilirubin 5 mg/dL\nAlanine aminotransferase (ALT) 100 U/L\nAspartate aminotransferase (AST) 220 U/L\nWhich of the following is a feature of this patient condition? Options: (A) It carries a good prognosis (B) Ammonia level is the best initial test to confirm the diagnosis (E) Electroencephalography (EEG) usually shows focal localising abnormality (D) It only occurs in patients with cirrhosis (C) It is a diagnosis of exclusion",
        "label": "C",
        "answer": "It is a diagnosis of exclusion",
        "options": {
            "A": "It carries a good prognosis",
            "B": "Ammonia level is the best initial test to confirm the diagnosis",
            "C": "It is a diagnosis of exclusion",
            "D": "It only occurs in patients with cirrhosis",
            "E": "Electroencephalography (EEG) usually shows focal localising abnormality"
        },
        "response": {
            "0.0": "Let's analyze the case step by step.\n\nThe patient is a 59-year-old man with a history of liver cirrhosis and alcoholism, presenting with confusion, asterixis, jaundice, and guaiac-positive stools (indicating gastrointestinal bleeding). His liver function tests show elevated AST and ALT, low albumin, and elevated bilirubin, which are consistent with liver dysfunction.\n\nGiven these findings, the patient is likely experiencing hepatic encephalopathy, a condition that can occur in patients with liver cirrhosis due to the accumulation of toxins (such as ammonia) that the liver can no longer adequately process.\n\nNow, let's evaluate the options:\n\n(A) It carries a good prognosis - This is incorrect. Hepatic encephalopathy can indicate significant liver dysfunction and carries a poor prognosis, especially in the context of cirrhosis.\n\n(B) Ammonia level is the best initial test to confirm the diagnosis - This is somewhat misleading. While elevated ammonia levels can support the diagnosis of hepatic encephalopathy, they are not always elevated in all cases, and the diagnosis is often made clinically based on symptoms.\n\n(C) It is a diagnosis of exclusion - This is true. Hepatic encephalopathy is often diagnosed after ruling out other potential causes of altered mental status.\n\n(D) It only occurs in patients with cirrhosis - This is not entirely accurate. While it is most commonly associated with cirrhosis, hepatic encephalopathy can also occur in other liver diseases or acute liver failure.\n\n(E) Electroencephalography (EEG) usually shows focal localizing abnormality - This is incorrect. EEG changes in hepatic encephalopathy typically show generalized slowing rather than focal abnormalities.\n\nBased on this analysis, the best answer is:\n\n**Answer: (C) It is a diagnosis of exclusion.**"
        }
    },
    {
        "question": "A 30-year-old man presents to his primary care physician with complaints of excessive fatigue and weakness for the last several weeks. He also complains of abdominal pain and constipation for the same duration. On further questioning, he reports that he has lost 8 pounds in the last 2 weeks. Past medical history and family history are insignificant. His temperature is 37.3\u00b0 C (99.2\u00b0 F), respirations are 21/min, pulse is 63/min, and blood pressure is 99/70 mm Hg. On physical examination, he is a tired-appearing, thin male. He has a bronze discoloration to his skin, but he denies being outside in the sun or any history of laying in tanning beds. What is the next best step in the management of this patient? Options: (B) Administer intravenous fludrocortisone (C) Start him on androgen replacement treatment (E) Order an ACTH stimulation test (D) Start him on both hydrocortisone and fludrocortisone therapy (A) Administer intravenous hydrocortisone",
        "label": "D",
        "answer": "Start him on both hydrocortisone and fludrocortisone therapy",
        "options": {
            "A": "Administer intravenous hydrocortisone",
            "B": "Administer intravenous fludrocortisone",
            "C": "Start him on androgen replacement treatment",
            "D": "Start him on both hydrocortisone and fludrocortisone therapy",
            "E": "Order an ACTH stimulation test"
        },
        "response": {
            "0.0": "Let's think step by step. \n\nThe patient presents with symptoms that are suggestive of adrenal insufficiency, including fatigue, weakness, abdominal pain, constipation, weight loss, and notably, the bronze discoloration of the skin. The low blood pressure and bradycardia (pulse of 63/min) further support the possibility of adrenal insufficiency, particularly primary adrenal insufficiency (Addison's disease).\n\nIn cases of suspected adrenal crisis or significant adrenal insufficiency, the immediate management involves administering glucocorticoids to address the deficiency and prevent further complications. \n\nGiven the options provided, the most appropriate next step in management for this patient, who likely has adrenal insufficiency, is:\n\n**(A) Administer intravenous hydrocortisone.**\n\nThis choice is critical to stabilize the patient and address the acute adrenal insufficiency. After stabilization, further testing (such as an ACTH stimulation test) can be performed to confirm the diagnosis and determine the underlying cause."
        }
    },
    {
        "question": "A 58-year-old white man with hypertension and type 2 diabetes mellitus comes to the physician because of a 3-month history of a painless lesion on his lower lip. He has smoked one pack of cigarettes daily for 20 years. He has worked as a fruit picker for the past 25 years. His current medications include captopril and metformin. Examination of the oral cavity shows a single ulcer near the vermillion border. Which of the following is the most likely diagnosis? Options: (E) Traumatic ulcer (D) Actinic keratosis (C) Aphthous stomatitis (A) Squamous cell carcinoma (B) Herpes labialis",
        "label": "A",
        "answer": "Squamous cell carcinoma",
        "options": {
            "A": "Squamous cell carcinoma",
            "B": "Herpes labialis",
            "C": "Aphthous stomatitis",
            "D": "Actinic keratosis",
            "E": "Traumatic ulcer"
        },
        "response": {
            "0.0": "Let's think step by step. \n\n1. **Patient Profile**: The patient is a 58-year-old white man with a history of smoking, hypertension, and type 2 diabetes mellitus. He has worked as a fruit picker, which may suggest sun exposure.\n\n2. **Lesion Characteristics**: The lesion is described as a painless ulcer on the lower lip near the vermillion border that has been present for 3 months.\n\n3. **Risk Factors**: The patient's smoking history and sun exposure from his occupation are significant risk factors for oral cancers, particularly squamous cell carcinoma (SCC).\n\n4. **Differential Diagnosis**:\n   - **Traumatic ulcer (E)**: Typically painful and associated with a history of trauma.\n   - **Actinic keratosis (D)**: Usually presents as a scaly patch rather than an ulcer and is more common on sun-exposed areas.\n   - **Aphthous stomatitis (C)**: Usually painful and presents as shallow ulcers, often recurring.\n   - **Squamous cell carcinoma (A)**: Commonly presents as a non-healing ulcer, especially in smokers and those with sun exposure.\n   - **Herpes labialis (B)**: Typically presents as vesicles that rupture and crust over, not as a chronic ulcer.\n\n5. **Conclusion**: Given the characteristics of the lesion (painless, chronic, located on the lip, and the patient's risk factors), the most likely diagnosis is **(A) Squamous cell carcinoma**.\n\nAnswer: (A) Squamous cell carcinoma."
        }
    },
    {
        "question": "A 46-year-old woman comes to the physician because of severe muscle and joint pain for 5 months. The pain varies in location and intensity. She also has joint stiffness in the morning and reports fatigue throughout the day that she attributes to not sleeping well. She reports a tingling sensation in her lower limbs. Her bowel habits are unchanged but she often feels bloated. She has primary hypertension and occasional migraine headaches. She does not smoke or consume alcohol. Her medications include propranolol and sumatriptan. She appears healthy. Examination shows symmetric muscular tenderness at the base of the neck, over the shoulders, and in the lumbosacral area. Strength and deep tendon reflexes are normal. Laboratory studies show:\nHemoglobin 14.3 g/dL\nLeukocyte count 9300/mm3\nPlatelet count 230,000/mm3\nMean corpuscular volume 85 \u03bcm3\nErythrocyte sedimentation rate 12 mm/h\nSerum\nGlucose 92 mg/dL\nCreatinine 0.6 mg/dL\nTSH 3.1 \u03bcU/mL\nUrinalysis is within normal limits. Which of the following is the most appropriate therapy for this patient?\" Options: (B) Temazepam (D) Amitriptyline (E) Methotrexate\n\" (A) Bupropion (C) Vitamin B12",
        "label": "D",
        "answer": "Amitriptyline",
        "options": {
            "A": "Bupropion",
            "B": "Temazepam",
            "C": "Vitamin B12",
            "D": "Amitriptyline",
            "E": "Methotrexate\n\""
        },
        "response": {
            "0.0": "Let's analyze the case step by step.\n\nThe patient is a 46-year-old woman presenting with severe muscle and joint pain, joint stiffness, fatigue, and tingling sensations in her lower limbs. The examination reveals symmetric muscular tenderness, but strength and deep tendon reflexes are normal. Laboratory studies show normal blood counts, normal thyroid function, and a low erythrocyte sedimentation rate (ESR), which suggests that there is no significant inflammatory process occurring.\n\nGiven her symptoms and the normal laboratory findings, this presentation is suggestive of fibromyalgia, a condition characterized by widespread musculoskeletal pain, fatigue, and often associated with sleep disturbances and mood disorders. \n\nIn terms of treatment options for fibromyalgia, the most appropriate therapies include:\n\n- **Amitriptyline**: This is a tricyclic antidepressant that is often used to help manage fibromyalgia symptoms, particularly pain and sleep disturbances.\n\nThe other options:\n- **Temazepam** is a benzodiazepine that may help with sleep but is not a first-line treatment for fibromyalgia.\n- **Methotrexate** is used for inflammatory conditions like rheumatoid arthritis but is not indicated for fibromyalgia.\n- **Bupropion** is an antidepressant that is not typically used for fibromyalgia.\n- **Vitamin B12** supplementation is not indicated unless there is a deficiency.\n\nBased on this analysis, the most appropriate therapy for this patient is:\n\n**Answer: (D) Amitriptyline**."
        }
    },
    {
        "question": "A 40-year-old businessman who was previously well is brought into the emergency department by his assistant with a complaint of left-sided weakness after a chiropractic neck manipulation. He has never felt like this before. Past medical history is insignificant. His blood pressure is 125/75 mm Hg, pulse 86/min, respiratory rate 13/min, temperature 36.8\u00b0C (98.2\u00b0F). A T2-weighted MRI shows a left C5 hemicord lesion. The patient is treated with cervical immobilization, a course of steroids, and physical therapy. What other finding will most likely be seen in this patient? Options: (C) Contralateral corticospinal tract involvement (A) Spastic paralysis at the level of lesion (D) Right-sided analgesia (B) Right-sided Horner's syndrome (E) Contralateral loss of vibration and proprioception",
        "label": "D",
        "answer": "Right-sided analgesia",
        "options": {
            "A": "Spastic paralysis at the level of lesion",
            "B": "Right-sided Horner's syndrome",
            "C": "Contralateral corticospinal tract involvement",
            "D": "Right-sided analgesia",
            "E": "Contralateral loss of vibration and proprioception"
        },
        "response": {
            "0.0": "Let's analyze the situation step by step.\n\nThe patient has a left C5 hemicord lesion, which suggests that there is damage to the left side of the spinal cord at the C5 level. This type of injury can lead to specific neurological deficits based on the anatomy of the spinal cord and the pathways involved.\n\n1. **Corticospinal Tract**: The corticospinal tract carries motor signals from the brain to the body. Damage to the left side of the spinal cord would typically result in weakness or paralysis on the same side (left side) at and below the level of the lesion. Therefore, we would expect spastic paralysis on the left side.\n\n2. **Sensory Pathways**: The spinothalamic tract carries pain and temperature sensations and crosses over to the opposite side of the body. Therefore, a left hemicord lesion would lead to a loss of pain and temperature sensation on the right side of the body (contralateral).\n\n3. **Dorsal Columns**: The dorsal columns carry vibration and proprioception sensations and do not cross until they reach the medulla. Therefore, a left hemicord lesion would not affect the right side's vibration and proprioception sensations.\n\n4. **Horner's Syndrome**: This syndrome is caused by damage to the sympathetic pathways, which can occur with lesions in the cervical region. However, it is not directly related to a hemicord lesion at C5.\n\nGiven this analysis, the most likely additional finding in this patient with a left C5 hemicord lesion would be:\n\n- **Right-sided analgesia** (loss of pain and temperature sensation on the right side due to contralateral spinothalamic tract involvement).\n\nThus, the correct answer is:\n\n**(D) Right-sided analgesia**."
        }
    },
    {
        "question": "A 29-year-old man is brought to the emergency department by a concerned neighbor. The patient appears disheveled, has a flat affect, and appears to be having auditory hallucinations. He is alert and oriented to time, person, and place and has an intact long-term and short-term memory. His neighbor says that he never really knew the patient that well and that he mostly kept to himself. They have been neighbors for the past 3 years at an apartment close to the hospital. What worried the neighbor was a sudden change in the patient's behavior which started last week. He suddenly seemed interested in attending all the local council meetings and social gatherings. He is very talkative at these events and boasts highly of himself and starts suggesting changes that the committee could make with his help. He gets very agitated when they deny accepting his suggestions. Which of the following is a predictor of good prognosis for this patient's condition? Options: (C) Being single (E) Negative symptoms (A) Affective symptoms (B) Slow onset (D) Male sex",
        "label": "A",
        "answer": "Affective symptoms",
        "options": {
            "A": "Affective symptoms",
            "B": "Slow onset",
            "C": "Being single",
            "D": "Male sex",
            "E": "Negative symptoms"
        },
        "response": {
            "0.0": "Let's analyze the situation step by step. The patient is exhibiting signs consistent with a manic episode, possibly indicative of bipolar disorder, given the sudden change in behavior, increased talkativeness, grandiosity, and agitation when his suggestions are not accepted. \n\nIn terms of predictors of good prognosis in mood disorders, particularly bipolar disorder, the following factors are generally considered:\n\n- **Affective symptoms** (A): The presence of affective symptoms, such as depressive episodes, can indicate a more typical course of bipolar disorder and may suggest a better prognosis.\n- **Slow onset** (B): A slow onset of symptoms is often associated with a better prognosis compared to a rapid onset.\n- **Being single** (C): Being single is generally not considered a predictor of good prognosis.\n- **Negative symptoms** (E): Negative symptoms are typically associated with worse outcomes, especially in schizophrenia.\n- **Male sex** (D): While there are differences in the prevalence of mood disorders between sexes, male sex alone is not a strong predictor of prognosis.\n\nGiven this analysis, the best answer that aligns with predictors of good prognosis in this context is:\n\n**Answer: (A) Affective symptoms**"
        }
    },
    {
        "question": "A 26-year-old man with no significant past medical history presents to the ED following a motor vehicle accident. Vital signs on presentation are T 99.0 F, BP 100/60 mmHg, HR 125 bpm, RR 16/min, SpO2 98% on room air. He complains of extreme abdominal pain worse in the left upper quadrant which has worsened over the past 30 minutes. Exam demonstrates abdominal wall rigidity, involuntary guarding, and tenderness on light percussion. Bedside sonography shows evidence for hemoperitoneum. Despite administering more intravenous fluids, repeat vitals are T 98.9 F, BP 82/50 mm hg, HR 180 bpm, RR 20/min, SpO2 97% on room air. Which of the following is the best next step? Options: (E) Exploratory laparotomy (D) Abdominal plain film (A) Normal saline bolus and re-evaluation of hemodynamics after infusion (C) Morphine (B) CT abdomen and pelvis",
        "label": "E",
        "answer": "Exploratory laparotomy",
        "options": {
            "A": "Normal saline bolus and re-evaluation of hemodynamics after infusion",
            "B": "CT abdomen and pelvis",
            "C": "Morphine",
            "D": "Abdominal plain film",
            "E": "Exploratory laparotomy"
        },
        "response": {
            "0.0": "Let's analyze the situation step by step.\n\n1. **Patient Presentation**: The 26-year-old man has been involved in a motor vehicle accident and presents with extreme abdominal pain, particularly in the left upper quadrant. His vital signs indicate hypotension (BP 82/50 mmHg) and tachycardia (HR 180 bpm), which are concerning for shock.\n\n2. **Physical Exam Findings**: The exam shows abdominal wall rigidity, involuntary guarding, and tenderness, which suggest peritonitis, likely due to internal bleeding (hemoperitoneum) as indicated by the bedside sonography.\n\n3. **Current Management**: Despite administering intravenous fluids, the patient remains hypotensive and tachycardic, indicating that he is likely in hypovolemic shock, possibly due to internal bleeding.\n\n4. **Next Steps in Management**: Given the evidence of hemoperitoneum and the patient's unstable vital signs, the best next step is to address the source of bleeding and stabilize the patient. \n\nConsidering all of this, the most appropriate next step in management is:\n\n**(E) Exploratory laparotomy** \n\nThis is necessary to identify and control the source of bleeding, especially given the signs of significant abdominal injury and the patient's hemodynamic instability."
        }
    },
    {
        "question": "A 56-year-old man presents to the clinic complaining of subacute back pain for the past month. The pain is described as a dull, constant ache that is worse at night. He could not recall any precipitating event except for an amateur weight-lifting competition that he participated in 2 months ago. Past medical history is significant for non-small cell lung cancer that was diagnosed and successfully treated. A PET scan 1 year ago demonstrated no recurrence. Physical exam was unremarkable except for some point tenderness along the lumbosacral area. What is the most likely imaging finding in this patient? Options: (C) Lytic lesions of the lumbar spine (D) Narrowing of the lumbar disc space (B) Bulging disc impinging on lumbar spinal nerve (E) Sacroilitis and fusion of the lumbar spine (A) Blastic lesions of the lumbar spine",
        "label": "C",
        "answer": "Lytic lesions of the lumbar spine",
        "options": {
            "A": "Blastic lesions of the lumbar spine",
            "B": "Bulging disc impinging on lumbar spinal nerve",
            "C": "Lytic lesions of the lumbar spine",
            "D": "Narrowing of the lumbar disc space",
            "E": "Sacroilitis and fusion of the lumbar spine"
        },
        "response": {
            "0.0": "Let's analyze the case step by step.\n\n1. **Patient Profile**: The patient is a 56-year-old man with a history of non-small cell lung cancer, which is significant because certain cancers can metastasize to the bone.\n\n2. **Symptoms**: He presents with subacute back pain that is worse at night, which raises suspicion for a possible malignancy or metastasis, especially given his cancer history.\n\n3. **Physical Exam**: The exam shows point tenderness in the lumbosacral area but is otherwise unremarkable.\n\n4. **Imaging Findings**: In patients with a history of cancer, back pain that is persistent and worse at night can indicate metastatic disease. Non-small cell lung cancer is known to metastasize to the bones, and when it does, it typically causes lytic lesions rather than blastic lesions.\n\n5. **Options Analysis**:\n   - (A) Blastic lesions of the lumbar spine: These are more commonly associated with prostate cancer or other conditions, not typically with lung cancer.\n   - (B) Bulging disc impinging on lumbar spinal nerve: This is less likely given the patient's cancer history and the nature of his pain.\n   - (C) Lytic lesions of the lumbar spine: This is consistent with metastatic disease from lung cancer.\n   - (D) Narrowing of the lumbar disc space: This is more indicative of degenerative disc disease rather than cancer.\n   - (E) Sacroilitis and fusion of the lumbar spine: This is associated with inflammatory conditions like ankylosing spondylitis, not cancer.\n\nBased on the above reasoning, the most likely imaging finding in this patient is:\n\n**Answer: (C) Lytic lesions of the lumbar spine.**"
        }
    },
    {
        "question": "A 22-year-old female college student is treated with metronidazole after presenting to student health services with itching, discharge, and pain in her vagina. At a party shortly afterward she experiences facial flushing, nausea, tachycardia, dyspnea, headache, and abdominal cramps after consuming alcohol. Serum levels of which of the following are likely elevated in this patient following alcohol consumption: Options: (E) Amylase (C) Cytochrome P-450 enzymes (B) Uric acid (D) Triglycerides (A) Acetaldehyde",
        "label": "A",
        "answer": "Acetaldehyde",
        "options": {
            "A": "Acetaldehyde",
            "B": "Uric acid",
            "C": "Cytochrome P-450 enzymes",
            "D": "Triglycerides",
            "E": "Amylase"
        },
        "response": {
            "0.0": "Let's think step by step. The patient is experiencing a reaction after consuming alcohol while being treated with metronidazole. This reaction is consistent with disulfiram-like effects, which occur when alcohol is consumed in conjunction with certain medications, including metronidazole. \n\nWhen alcohol is consumed, it is metabolized to acetaldehyde, which is then further metabolized to acetic acid. However, in the presence of metronidazole, the metabolism of acetaldehyde is inhibited, leading to an accumulation of acetaldehyde in the body. This accumulation is responsible for the symptoms of flushing, nausea, tachycardia, dyspnea, headache, and abdominal cramps.\n\nTherefore, the serum levels of acetaldehyde are likely elevated in this patient following alcohol consumption.\n\nAnswer: (A) Acetaldehyde"
        }
    },
    {
        "question": "A stillborn infant is delivered at 38 weeks' gestation to a 32-year-old woman. The mother had no prenatal care. Examination of the stillborn shows a small pelvis, shallow intergluteal cleft, and club feet. An x-ray shows the absence of the sacrum and lumbar vertebrae. Which of the following is the strongest predisposing factor for this patient's condition? Options: (D) Maternal diabetes (C) Chromosome 13 trisomy (B) Intrauterine alcohol exposure (A) Maternal oligohydramnios (E) Chromosome 18 trisomy",
        "label": "D",
        "answer": "Maternal diabetes",
        "options": {
            "A": "Maternal oligohydramnios",
            "B": "Intrauterine alcohol exposure",
            "C": "Chromosome 13 trisomy",
            "D": "Maternal diabetes",
            "E": "Chromosome 18 trisomy"
        },
        "response": {
            "0.0": "Let's analyze the details provided in the question step by step.\n\nThe stillborn infant exhibits several significant findings:\n- Small pelvis\n- Shallow intergluteal cleft\n- Club feet\n- Absence of the sacrum and lumbar vertebrae on X-ray\n\nThese findings are suggestive of a condition known as caudal regression syndrome or sacral agenesis, which is often associated with maternal factors.\n\nNow, let's evaluate the options provided:\n\n(A) Maternal oligohydramnios: Oligohydramnios (low amniotic fluid) can lead to various fetal deformities, including limb deformities and facial deformities, but it is not the strongest predisposing factor for the specific findings described.\n\n(B) Intrauterine alcohol exposure: Alcohol exposure during pregnancy can lead to fetal alcohol syndrome, which can cause a range of developmental issues, but it does not specifically correlate with the findings of sacral agenesis.\n\n(C) Chromosome 13 trisomy: This is associated with Patau syndrome, which has its own set of anomalies but does not specifically correlate with the findings described.\n\n(D) Maternal diabetes: Maternal diabetes is known to be associated with various fetal anomalies, including caudal regression syndrome, but it is not the strongest association.\n\n(E) Chromosome 18 trisomy: This is associated with Edwards syndrome, which has its own set of anomalies but does not specifically correlate with the findings described.\n\nGiven the findings of sacral agenesis and the associated risk factors, the strongest predisposing factor for this patient's condition is (D) Maternal diabetes. \n\nAnswer: (D) Maternal diabetes"
        }
    },
    {
        "question": "A 52-year-old man is brought to the emergency department for recurrent vomiting that began 5 hours ago. He describes the vomitus as bloody and containing black specks. He drinks 10\u201312 beers daily and has not seen a physician in 15 years. He appears pale. His temperature is 36.7\u00b0C (98.1\u00b0F), pulse is 122/min, and blood pressure is 85/59 mm Hg. Physical examination shows decreased radial pulses, delayed capillary refill, multiple spider angiomata, and a distended abdomen. He is oriented to person but not to place or time. Which of the following is most likely decreased in this patient in response to his current condition compared to a healthy adult? Options: (B) Fractional tissue oxygen extraction (C) Carotid baroreceptor firing activity (E) Cardiac inotropy (D) Pulmonary vascular resistance (A) Systemic vascular resistance",
        "label": "C",
        "answer": "Carotid baroreceptor firing activity",
        "options": {
            "A": "Systemic vascular resistance",
            "B": "Fractional tissue oxygen extraction",
            "C": "Carotid baroreceptor firing activity",
            "D": "Pulmonary vascular resistance",
            "E": "Cardiac inotropy"
        },
        "response": {
            "0.0": "Let's analyze the situation step by step.\n\nThe patient is a 52-year-old man with a history of heavy alcohol use, presenting with signs of significant volume depletion (evidenced by hypotension, tachycardia, and pallor) and possible liver disease (indicated by spider angiomata and abdominal distension). He is also experiencing recurrent vomiting with bloody vomitus, which suggests possible upper gastrointestinal bleeding.\n\nGiven these clinical findings, we need to determine which of the options is most likely decreased in this patient compared to a healthy adult.\n\n1. **Fractional tissue oxygen extraction (B)**: This refers to the amount of oxygen extracted by tissues from the blood. In a state of shock or low perfusion, tissues may extract more oxygen, so this is unlikely to be decreased.\n\n2. **Carotid baroreceptor firing activity (C)**: In response to hypotension, baroreceptors would decrease their firing rate, which would lead to compensatory mechanisms to increase blood pressure. Therefore, this is likely decreased.\n\n3. **Pulmonary vascular resistance (D)**: This is generally not directly affected by the patient's current condition of hypovolemia and hypotension.\n\n4. **Cardiac inotropy (E)**: This refers to the strength of heart muscle contraction. In a state of shock, the body typically tries to increase cardiac output, so inotropy may not be decreased.\n\n5. **Systemic vascular resistance (A)**: In response to hypotension, systemic vascular resistance typically increases as the body attempts to maintain blood pressure.\n\nGiven the context of the patient's condition, the most likely option that is decreased in response to his current state of hypotension and shock is:\n\n**Answer: (C) Carotid baroreceptor firing activity**. \n\nThis is because the baroreceptors would sense the low blood pressure and decrease their firing rate, leading to compensatory mechanisms to try to restore blood pressure."
        }
    },
    {
        "question": "A 14-year-old boy presents with right upper quadrant abdominal pain and is found on ultrasound to have a gallstone. Based on clinical suspicion, a CBC, a Coombs test, and a bilirubin panel are obtained to determine the etiology of the gallstone. These tests reveal a mild normocytic anemia with associated reticulocytosis as well as an increased RDW. In addition there is an indirect hyperbilirubinemia and the Coombs test results are negative. To confirm the diagnosis, an osmotic fragility test is performed which shows increased fragility in hypotonic solution. In this patient, what findings would most likely be anticipated if a blood smear were obtained? Options: (E) Dacrocytes (C) Sideroblasts (D) Spherocytes (A) Hypersegmented neutrophils (B) Schistocytes",
        "label": "D",
        "answer": "Spherocytes",
        "options": {
            "A": "Hypersegmented neutrophils",
            "B": "Schistocytes",
            "C": "Sideroblasts",
            "D": "Spherocytes",
            "E": "Dacrocytes"
        },
        "response": {
            "0.0": "Let's analyze the information step by step.\n\nThe patient is a 14-year-old boy with right upper quadrant abdominal pain and gallstones. The laboratory findings indicate:\n\n- Mild normocytic anemia with reticulocytosis\n- Increased RDW (red cell distribution width)\n- Indirect hyperbilirubinemia\n- Negative Coombs test\n- Increased fragility in the osmotic fragility test\n\nThe combination of these findings suggests a diagnosis of hereditary spherocytosis, a condition characterized by the presence of spherocytes (abnormally shaped red blood cells) due to a defect in the red blood cell membrane. The increased osmotic fragility test indicates that the red blood cells are more susceptible to lysis in hypotonic solutions, which is consistent with spherocytes.\n\nGiven this information, if a blood smear were obtained, the most likely finding would be:\n\n**Answer: (D) Spherocytes**"
        }
    },
    {
        "question": "A 34-year-old woman presents to the plastic surgery office 3 months following a rhinoplasty procedure. The patient has been recovering well. However, she has noticed a small whistling noise when she respires through her nose, which you appreciate on physical exam. Which of the following is the most likely cause of this phenomenon? Options: (D) Excessive columellar show resulting in increased nasal airflow (C) A deviated septum that is now straight, resulting in altered nasal airflow (B) A septal hematoma causing a perforation (E) A fracture of the bony septum (A) Post-operative swelling",
        "label": "B",
        "answer": "A septal hematoma causing a perforation",
        "options": {
            "A": "Post-operative swelling",
            "B": "A septal hematoma causing a perforation",
            "C": "A deviated septum that is now straight, resulting in altered nasal airflow",
            "D": "Excessive columellar show resulting in increased nasal airflow",
            "E": "A fracture of the bony septum"
        },
        "response": {
            "0.0": "Let's analyze the situation step by step.\n\nThe patient is 3 months post-rhinoplasty and is experiencing a whistling noise when breathing through her nose. This symptom suggests that there is an abnormal airflow pattern in the nasal passages.\n\n1. **Post-operative swelling (A)**: While swelling can occur after surgery, it typically resolves within a few weeks, and it is unlikely to cause a whistling noise after 3 months.\n\n2. **Excessive columellar show resulting in increased nasal airflow (D)**: This option refers to the visibility of the columella (the tissue that separates the nostrils). While excessive columellar show can affect aesthetics, it is not typically associated with a whistling noise.\n\n3. **A deviated septum that is now straight, resulting in altered nasal airflow (C)**: If the septum was previously deviated and is now straightened, it could potentially change airflow dynamics, but it is less likely to cause a whistling noise.\n\n4. **A septal hematoma causing a perforation (B)**: A septal hematoma can lead to a perforation of the nasal septum, which can create abnormal airflow and result in a whistling sound when breathing.\n\n5. **A fracture of the bony septum (E)**: A fracture could cause structural changes, but it is less likely to be the direct cause of a whistling noise compared to a perforation.\n\nGiven the options and the context of the patient's symptoms, the most likely cause of the whistling noise is:\n\n**Answer: (B) A septal hematoma causing a perforation.**"
        }
    },
    {
        "question": "Background:\nSome patients with severe asthma have frequent exacerbations associated with persistent eosinophilic inflammation despite continuous treatment with high-dose inhaled glucocorticoids with or without oral glucocorticoids.\nMethods:\nIn this randomized, double-blind clinical trial we assigned 576 patients with recurrent asthma exacerbations and evidence of eosinophilic inflammation despite high doses of inhaled glucocorticoids to one of three study groups. Patients were assigned to receive mepolizumab, a humanized monoclonal antibody against interleukin-5, which was administered as either a 75-mg intravenous dose or a 100-mg subcutaneous dose or placebo every 4 weeks for 32 weeks. The primary outcome was the rate of exacerbations. Other outcomes included the forced expiratory volume in 1 second (FEV1) and scores on the St. George\u2019s Respiratory Questionnaire (SGRQ) and the 5-item Asthma Control Questionnaire (ACQ-5).\nResults:\nThe rate of exacerbations was reduced by 47% (95% confidence interval [CI], 29 to 61) among patients receiving intravenous mepolizumab and by 53% (95% CI, 37 to 65) among those receiving subcutaneous mepolizumab, as compared with those receiving placebo (p<0.001 for both comparisons). Exacerbations necessitating an emergency department visit or hospitalization were reduced by 32% in the group receiving intravenous mepolizumab and by 61% in the group receiving subcutaneous mepolizumab. At week 32, the mean increase from baseline in FEV1 was 100 ml greater in patients receiving intravenous mepolizumab than in those receiving placebo (p=0.02) and 98 ml greater in patients receiving subcutaneous mepolizumab than in those receiving placebo (p=0.03). The improvement from baseline in the SGRQ score was 6.4 points and 7.0 points greater in the intravenous and subcutaneous mepolizumab groups, respectively than in the placebo group, and the improvement in the ACQ-5 score was 0.42 points and 0.44 points greater in the two mepolizumab groups, respectively than in the placebo group (p<0.001 for all comparisons).\nConclusions:\nMepolizumab administered either intravenously or subcutaneously significantly reduced asthma exacerbations and was associated with improvements in markers of asthma control.\nGiven the original research abstract above, which of the following would be true if the authors had inadvertently encountered a type 1 error? Options: (B) A type 1 error occurs when the null hypothesis is true but is rejected in error. (E) A type 1 error is dependent on the confidence interval of a study. (A) A type 1 error means the study is not significantly powered to detect a true difference between study groups. (D) A type 1 error is a beta (\u03b2) error and is usually 0.1 or 0.2. (C) A type 1 error occurs when the null hypothesis is false, yet is accepted in error.",
        "label": "B",
        "answer": "A type 1 error occurs when the null hypothesis is true but is rejected in error.",
        "options": {
            "A": "A type 1 error means the study is not significantly powered to detect a true difference between study groups.",
            "B": "A type 1 error occurs when the null hypothesis is true but is rejected in error.",
            "C": "A type 1 error occurs when the null hypothesis is false, yet is accepted in error.",
            "D": "A type 1 error is a beta (\u03b2) error and is usually 0.1 or 0.2.",
            "E": "A type 1 error is dependent on the confidence interval of a study."
        },
        "response": {
            "0.0": "Let's think step by step. \n\nA type 1 error, also known as a false positive, occurs when the null hypothesis is true, but the researchers incorrectly reject it, concluding that there is a significant effect or difference when there is none. \n\nNow, let's evaluate the options:\n\n- (A) A type 1 error means the study is not significantly powered to detect a true difference between study groups. \n  - This statement is incorrect. A type 1 error is not related to the power of the study; it is about incorrectly rejecting a true null hypothesis.\n\n- (B) A type 1 error occurs when the null hypothesis is true but is rejected in error. \n  - This statement is correct. It accurately describes a type 1 error.\n\n- (C) A type 1 error occurs when the null hypothesis is false, yet is accepted in error. \n  - This statement describes a type 2 error, not a type 1 error.\n\n- (D) A type 1 error is a beta (\u03b2) error and is usually 0.1 or 0.2. \n  - This statement is incorrect. A type 1 error is denoted by alpha (\u03b1), not beta (\u03b2). Beta errors refer to type 2 errors.\n\n- (E) A type 1 error is dependent on the confidence interval of a study. \n  - This statement is somewhat misleading. While the confidence interval is related to the significance level (alpha), a type 1 error itself is not directly dependent on the confidence interval.\n\nBased on this analysis, the correct answer is:\n\n**Answer: (B) A type 1 error occurs when the null hypothesis is true but is rejected in error.**"
        }
    },
    {
        "question": "A 61-year-old man with schizophrenia in a locked inpatient psychiatry unit was observed making an unusual smacking motion with his lips, pursing his mouth, and blinking excessively. These symptoms started slowly about 2 weeks ago and have become more pronounced, but they do not seem to bother the patient. He resides in an inpatient psychiatric facility where he has been successfully treated with haloperidol for the past several months. His physical exam and vitals are within normal limits. Which of the following accurately describes his symptoms? Options: (B) Tardive dyskinesia (E) Palsy (A) Akathisia (C) Acute dystonia (D) Pseudoparkinsonism",
        "label": "B",
        "answer": "Tardive dyskinesia",
        "options": {
            "A": "Akathisia",
            "B": "Tardive dyskinesia",
            "C": "Acute dystonia",
            "D": "Pseudoparkinsonism",
            "E": "Palsy"
        },
        "response": {
            "0.0": "Let's analyze the symptoms presented in the question step by step.\n\nThe patient is exhibiting:\n- Unusual smacking motion with his lips\n- Pursing of the mouth\n- Excessive blinking\n- Symptoms started slowly about 2 weeks ago and have become more pronounced\n- The symptoms do not seem to bother the patient\n\nThese symptoms are characteristic of **tardive dyskinesia**, which is a movement disorder that can occur after long-term use of antipsychotic medications, such as haloperidol. Tardive dyskinesia is characterized by involuntary, repetitive movements, often involving the face, lips, and tongue.\n\nNow, let's evaluate the other options:\n- (A) Akathisia: This is characterized by a feeling of inner restlessness and an uncontrollable need to be in constant motion, which does not match the symptoms described.\n- (C) Acute dystonia: This involves sustained muscle contractions and abnormal postures, typically occurring shortly after starting or increasing the dose of antipsychotic medication, which does not fit the timeline here.\n- (D) Pseudoparkinsonism: This includes symptoms like tremors, rigidity, and bradykinesia, which are not described in this case.\n- (E) Palsy: This is a general term for paralysis or weakness, which does not apply here.\n\nGiven the symptoms and the context of long-term haloperidol use, the most accurate description of the patient's symptoms is:\n\n**Answer: (B) Tardive dyskinesia**"
        }
    },
    {
        "question": "A 21-month-old boy is brought to the physician for a well-child examination. His mother noticed deformities in both of his legs since he started walking independently. He has been healthy apart from an upper respiratory tract infection 6 months ago. He was delivered at 38 weeks' gestation. His 6-year-old sister was treated for developmental dysplasia of the hip. He can kick a ball and say a 2-word phrase. He plays well with other children at his day care. His immunizations are up-to-date. He is at the 40th percentile for height and 50th percentile for weight. Vital signs are within normal limits. Examination shows closed anterior and posterior fontanelles. The knees do not stay together when both the feet and ankles are placed together. The gait is unremarkable. The mother is concerned that he has a growth disorder. Which of the following is the most appropriate next step in management? Options: (A) Vitamin D supplementation (D) Bracing of the lower extremities (B) Reassurance and follow-up (E) Tibial osteotomy (C) X-ray of the lower extremities",
        "label": "B",
        "answer": "Reassurance and follow-up",
        "options": {
            "A": "Vitamin D supplementation",
            "B": "Reassurance and follow-up",
            "C": "X-ray of the lower extremities",
            "D": "Bracing of the lower extremities",
            "E": "Tibial osteotomy"
        },
        "response": {
            "0.0": "Let's think step by step. \n\nThe 21-month-old boy is presenting with deformities in both legs since he started walking, which raises concerns about potential developmental or structural issues. The examination findings, particularly the observation that the knees do not stay together when the feet and ankles are placed together, suggest a possible condition such as genu varum (bowlegs), which is common in toddlers as they begin to walk.\n\nGiven that he is otherwise healthy, has normal developmental milestones, and his growth parameters are within normal limits, the most appropriate next step in management would be to assess the underlying cause of the leg deformities. \n\nIn this case, an X-ray of the lower extremities (Option C) would be the most appropriate next step. This imaging can help evaluate the alignment of the bones and rule out any underlying skeletal abnormalities or conditions such as rickets or Blount's disease.\n\nTherefore, the answer is:\n**(C) X-ray of the lower extremities.**"
        }
    },
    {
        "question": "A 60-year-old female patient with a history of hypertension presents to an outpatient office for regular check-up and is found to have hypertriglyceridemia. Her physician prescribes high-dose niacin and recommends taking the medication along with aspirin. The side effect the physician is trying to avoid is thought to be mediated by what mechanism? Options: (B) Immune complex formation (D) Mast cell degranulation (A) Bile deposition in the dermis (C) Release of prostaglandins (E) T cell activation",
        "label": "C",
        "answer": "Release of prostaglandins",
        "options": {
            "A": "Bile deposition in the dermis",
            "B": "Immune complex formation",
            "C": "Release of prostaglandins",
            "D": "Mast cell degranulation",
            "E": "T cell activation"
        },
        "response": {
            "0.0": "Let's think step by step. \n\nNiacin (vitamin B3) is known to cause flushing, which is a common side effect. This flushing is primarily due to the release of prostaglandins, which are mediators that cause vasodilation and increased blood flow to the skin, leading to the characteristic flushing sensation.\n\nTo mitigate this side effect, physicians often recommend taking aspirin before niacin, as aspirin can inhibit the cyclooxygenase (COX) enzymes that are responsible for the production of prostaglandins.\n\nGiven this information, the correct answer to the question regarding the mechanism of the side effect that the physician is trying to avoid is:\n\n**(C) Release of prostaglandins.**"
        }
    },
    {
        "question": "A 58-year-old male presents with an acutely elevated blood pressure of 220/140 mmHg. The patient complains of a headache and chest pain, and he has been vomiting for the last several hours. Physical exam demonstrates papilledema and a depressed level of consciousness. To treat this patient's hypertensive emergency, he is started on an IV medication commonly used in this situation. The agent exerts its effect by releasing nitric oxide as a metabolite, which subsequently activates guanylate cyclase and increases production of cGMP in vascular smooth muscle. Which of the following clinical effects would be expected from administration of this medication? Options: (C) Decreased stroke volume (E) Increased systemic vascular resistance (D) Decreased pulmonary capillary wedge pressure (B) Increased left ventricular end-diastolic pressure (A) Decreased cardiac contractility",
        "label": "D",
        "answer": "Decreased pulmonary capillary wedge pressure",
        "options": {
            "A": "Decreased cardiac contractility",
            "B": "Increased left ventricular end-diastolic pressure",
            "C": "Decreased stroke volume",
            "D": "Decreased pulmonary capillary wedge pressure",
            "E": "Increased systemic vascular resistance"
        },
        "response": {
            "0.0": "Let's analyze the question step by step.\n\nThe patient is experiencing a hypertensive emergency, characterized by severely elevated blood pressure (220/140 mmHg), headache, chest pain, vomiting, papilledema, and altered consciousness. The treatment involves an intravenous medication that releases nitric oxide, which activates guanylate cyclase and increases cGMP in vascular smooth muscle, leading to vasodilation.\n\nThe key effects of this medication would include:\n\n1. **Vasodilation**: The release of nitric oxide leads to relaxation of vascular smooth muscle, which decreases systemic vascular resistance (SVR) and lowers blood pressure.\n\n2. **Decreased Preload**: As systemic vascular resistance decreases, there is a reduction in the return of blood to the heart (preload), which can lead to a decrease in left ventricular end-diastolic pressure (LVEDP).\n\n3. **Decreased Pulmonary Capillary Wedge Pressure (PCWP)**: This is a reflection of left atrial pressure and is often used as an estimate of left ventricular filling pressure. With decreased preload and systemic vascular resistance, PCWP would also decrease.\n\nGiven these effects, the most appropriate answer from the options provided is:\n\n**(D) Decreased pulmonary capillary wedge pressure.**\n\nThis is because the medication's vasodilatory effects would lead to a reduction in pressures associated with the heart's filling, including the pulmonary capillary wedge pressure."
        }
    },
    {
        "question": "A 63-year-old man is aiming to improve his health by eating a well balanced diet, walking daily, and quitting smoking following a 45-year smoking history. While on his daily walks he notices a strong cramping pain in his calves that consistently appears after a mile of walking. He sees his physician and a diagnosis of peripheral artery disease with intermittent claudication is made. To improve his symptoms, cilostazol is prescribed. What is the mechanism of action of this medication? Options: (D) Adenosine diphosphate receptor inhibitor (A) Irreversible cyclooxygenase inhibitor (C) Thromboxane synthase inhibitor (B) Glycoprotein IIB/IIIA inhibitor (E) Phosphodiesterase inhibitor",
        "label": "E",
        "answer": "Phosphodiesterase inhibitor",
        "options": {
            "A": "Irreversible cyclooxygenase inhibitor",
            "B": "Glycoprotein IIB/IIIA inhibitor",
            "C": "Thromboxane synthase inhibitor",
            "D": "Adenosine diphosphate receptor inhibitor",
            "E": "Phosphodiesterase inhibitor"
        },
        "response": {
            "0.0": "Let's think step by step. Cilostazol is a medication commonly used to treat intermittent claudication associated with peripheral artery disease. Its primary mechanism of action is as a phosphodiesterase inhibitor. By inhibiting phosphodiesterase type 3 (PDE3), cilostazol increases the levels of cyclic adenosine monophosphate (cAMP) in platelets and vascular smooth muscle cells, leading to vasodilation and inhibition of platelet aggregation.\n\nTherefore, the correct answer is:\n\n**Answer: (E) Phosphodiesterase inhibitor**"
        }
    },
    {
        "question": "A 69-year-old man presents to his primary care physician with hip and back pain. The patient states that this weekend he had a barbecue. When he was lifting a heavy object he suddenly felt pain in his lower back. He describes the pain as in his buttocks but states that at times it travels down his leg. The patient states that it feels, \"electrical.\" The patient has a past medical history of obesity, diabetes, depression, anxiety, diverticulosis, constipation, and a surgical repair of his anterior cruciate ligament. His current medications include metformin, insulin, lisinopril, fluoxetine, and sodium docusate. Which of the following is most likely to help confirm the diagnosis? Options: (B) Flexion, abduction, and external rotation of the thigh (A) Palpating the paraspinus muscle (C) Straight leg raise (D) Internal rotation of the extended hip (E) Radiography",
        "label": "C",
        "answer": "Straight leg raise",
        "options": {
            "A": "Palpating the paraspinus muscle",
            "B": "Flexion, abduction, and external rotation of the thigh",
            "C": "Straight leg raise",
            "D": "Internal rotation of the extended hip",
            "E": "Radiography"
        },
        "response": {
            "0.0": "Let's think step by step. The patient's symptoms of hip and back pain, particularly the description of pain that travels down his leg and feels \"electrical,\" suggest a possible radiculopathy, which is often associated with nerve root compression, commonly seen in conditions like herniated discs or spinal stenosis.\n\nTo confirm the diagnosis of radiculopathy, the **straight leg raise test (C)** is a common and effective physical examination maneuver. This test helps to assess for nerve root irritation or compression, particularly of the L4-S1 nerve roots, which can cause pain that radiates down the leg.\n\nTherefore, the most likely option to help confirm the diagnosis is:\n\n**Answer: (C) Straight leg raise**"
        }
    },
    {
        "question": "A 35-year-old woman comes to the physician for genetic counseling prior to conception. Her younger brother has mild developmental delay, pale complexion, and has to limit his dietary intake of phenylalanine. She has no similar symptoms and is in good health. Her parents are healthy. Which of the following is the most appropriate assessment of her carrier status for the disease affecting her brother? Options: (A) 67% (C) 100% (D) 75% (E) 50% (B) 33%",
        "label": "A",
        "answer": "67%",
        "options": {
            "A": "67%",
            "B": "33%",
            "C": "100%",
            "D": "75%",
            "E": "50%"
        },
        "response": {
            "0.0": "To determine the most appropriate assessment of the woman's carrier status for the disease affecting her brother, we need to consider the inheritance pattern of the condition described. The symptoms of mild developmental delay and the need to limit dietary intake of phenylalanine suggest that her brother may have phenylketonuria (PKU), which is an autosomal recessive disorder.\n\nIn autosomal recessive inheritance:\n- Both parents must be carriers (heterozygous) for their child to be affected.\n- If the brother is affected, both parents must be carriers of the gene mutation.\n\nSince the woman is healthy and has no symptoms, we need to assess her carrier status. The probability that she is a carrier depends on the carrier status of her parents. If both parents are carriers, the probability that she is a carrier is 2/3 (since she cannot be affected and has a 1/4 chance of being affected if both parents are carriers).\n\nThus, the most appropriate assessment of her carrier status is:\n\n**Answer: (A) 67%**"
        }
    },
    {
        "question": "A 25-year-old man is brought to the emergency department after being found unconscious. He was at a college party exhibiting belligerent behavior when he suddenly passed out and fell to the ground. His past medical history is not known. His temperature is 100\u00b0F (37.8\u00b0C), blood pressure is 107/48 mmHg, pulse is 125/min, respirations are 19/min, and oxygen saturation is 99% on room air. The patient is covered with emesis and responds incoherently to questions. As the patient begins to wake up he continues vomiting. The patient is started on IV fluids, analgesics, and anti-emetics and begins to feel better. Thirty minutes later the patient presents with muscle rigidity and is no longer responding coherently to questions. His temperature is 103\u00b0F (39.4\u00b0C), blood pressure is 127/68 mmHg, pulse is 125/min, respirations are 18/min, and oxygen saturation is 98% on room air. The patient's basic laboratory studies are drawn and he is started on IV fluids, given lorazepam, and placed under a cooling blanket. Despite these initial measures, his symptoms persist. Which of the following is the best next step in management? Options: (D) Intubation (A) Acetaminophen (C) Diazepam (E) Supportive therapy (B) Dantrolene",
        "label": "B",
        "answer": "Dantrolene",
        "options": {
            "A": "Acetaminophen",
            "B": "Dantrolene",
            "C": "Diazepam",
            "D": "Intubation",
            "E": "Supportive therapy"
        },
        "response": {
            "0.0": "Let's think step by step. \n\nThe patient presents with signs of altered mental status, muscle rigidity, hyperthermia, and autonomic instability (elevated heart rate and blood pressure). These symptoms are suggestive of a serious condition known as neuroleptic malignant syndrome (NMS) or possibly serotonin syndrome, especially given the context of his behavior at a party, which may indicate substance use.\n\nIn cases of NMS, the best next step in management after supportive care is to administer dantrolene, which is a muscle relaxant that can help reduce muscle rigidity and hyperthermia associated with this condition. \n\nGiven that the patient's symptoms are persistent despite initial supportive measures, the best next step in management is:\n\nAnswer: (B) Dantrolene"
        }
    },
    {
        "question": "A 47-year-old executive schedules an appointment his physician for a routine medical check-up. He currently has no complaints and claims to be \u201cas fit as a fiddle.\u201d The physical examination findings are unremarkable, except for a mid-systolic murmur heard in the 2nd left intercostal space that radiates to the carotids on auscultation. The physician instructs the patient to stand from a supine position with the stethoscope still placed on his chest. Which of the following changes would occur with this maneuver? Options: (B) An increase in left ventricular end-diastolic pressure (D) A reduction in the slope of the pacemaker potential (A) An increase in right atrial pressure (E) A reduction in diastolic filling time (C) An increase in pulmonary capillary wedge pressure",
        "label": "E",
        "answer": "A reduction in diastolic filling time",
        "options": {
            "A": "An increase in right atrial pressure",
            "B": "An increase in left ventricular end-diastolic pressure",
            "C": "An increase in pulmonary capillary wedge pressure",
            "D": "A reduction in the slope of the pacemaker potential",
            "E": "A reduction in diastolic filling time"
        },
        "response": {
            "0.0": "Let's analyze the situation step by step.\n\nThe patient has a mid-systolic murmur that radiates to the carotids, which is suggestive of aortic stenosis. When the physician instructs the patient to stand from a supine position, several hemodynamic changes occur due to the effects of gravity and the shift in blood volume.\n\n1. **Standing from Supine Position**: When a person stands up, there is a transient decrease in venous return to the heart due to blood pooling in the lower extremities. This leads to a decrease in preload (the volume of blood in the ventricles at the end of diastole).\n\n2. **Effects on Cardiac Function**: The decrease in preload results in a reduction in stroke volume and cardiac output initially. The body compensates for this by increasing heart rate and systemic vascular resistance.\n\n3. **Changes in Pressures**:\n   - **Left Ventricular End-Diastolic Pressure (LVEDP)**: This would decrease due to reduced preload.\n   - **Right Atrial Pressure**: This would also decrease due to reduced venous return.\n   - **Pulmonary Capillary Wedge Pressure (PCWP)**: This would decrease as well, as it reflects left atrial pressure, which is affected by left ventricular filling.\n   - **Diastolic Filling Time**: This may be reduced due to an increased heart rate as a compensatory mechanism.\n\nGiven these considerations, the most appropriate answer to the question regarding the changes that would occur with the maneuver of standing from a supine position is:\n\n**(E) A reduction in diastolic filling time.**\n\nThis is because the increased heart rate compensating for the decreased preload leads to a shorter diastolic filling time."
        }
    },
    {
        "question": "A 39-year-old African-American woman presents to the emergency room with hip pain. She has a past medical history significant for sarcoidosis which was recently diagnosed 6 months ago and is currently being treated. She reports that the pain started 2 weeks ago and is localized to the left hip and groin. The pain has been getting progressively more intense. Her temperature is 98.1\u00b0F (36.7\u00b0C), blood pressure is 122/78 mm Hg, pulse is 80/min, respirations are 13/min, and oxygen saturation is 98% on room air. Physical exam is notable for pain with manipulation without restriction of range of motion of the hip. Which of the following is the most sensitive test for this condition? Options: (D) Radionuclide scan of the hip (A) CT of the hip (C) Radiograph of the hip (B) MRI of the hip (E) Ultrasound of the hip",
        "label": "B",
        "answer": "MRI of the hip",
        "options": {
            "A": "CT of the hip",
            "B": "MRI of the hip",
            "C": "Radiograph of the hip",
            "D": "Radionuclide scan of the hip",
            "E": "Ultrasound of the hip"
        },
        "response": {
            "0.0": "Let's think step by step. The patient presents with hip pain that is progressively worsening, and she has a history of sarcoidosis. Given her symptoms and the context, one potential concern is avascular necrosis (AVN) of the hip, which can occur in patients with sarcoidosis due to corticosteroid treatment or other factors.\n\nTo determine the most sensitive test for detecting avascular necrosis of the hip, we can consider the following options:\n\n- **Radiograph of the hip (C)**: This is often the first imaging study done, but it may not show early changes of AVN.\n- **CT of the hip (A)**: This can provide more detail than a standard X-ray but is not the most sensitive for early detection.\n- **MRI of the hip (B)**: MRI is the most sensitive imaging modality for detecting early changes of avascular necrosis, as it can identify changes in the bone marrow and soft tissue before they become apparent on X-rays or CT scans.\n- **Radionuclide scan of the hip (D)**: This can show increased uptake in areas of increased blood flow but is not as specific or sensitive as MRI for AVN.\n- **Ultrasound of the hip (E)**: This is not typically used for diagnosing AVN.\n\nGiven this information, the most sensitive test for detecting avascular necrosis of the hip in this patient is:\n\n**Answer: (B) MRI of the hip**"
        }
    },
    {
        "question": "A 74-year-old man undergoes an open cholecystectomy. Surgery is performed under general anesthesia for which the patient is intubated with an endotracheal tube. Directly following the procedure, his temperature is 37\u00b0C (98.6\u00b0F), pulse is 80/min, and blood pressure is 110/80 mm Hg. He is extubated as soon as he showed signs of alertness. Five minutes later, he becomes unresponsive. He has type 2 diabetes mellitus, coronary artery disease, and hypertension. He underwent stenting of the right coronary artery 10 years ago. He smoked one pack of cigarettes daily for 40 years but quit 2 weeks ago for surgery. He drinks one to two beers daily. His current medications include metformin, enalapril, aspirin, atorvastatin, and a multivitamin. His temperature is 37\u00b0C (98.6\u00b0F), pulse is 102/min, respirations are 20/min, and blood pressure is 130/80 mm Hg. Pulse oximetry shows an oxygen saturation of 73%. He is put on a non-rebreather mask with an FiO2 of 100%. Three minutes later, he is still unresponsive. His arterial blood gas analysis shows:\npH 7.32\nPCO2 33 mm Hg\nPO2 73 mm Hg\nHCO3 22 mEq/L\nO2 saturation 73%\nWhich of the following is the best next step in the management of this patient?\" Options: (D) Close observation only (E) Start BiPAP (B) Continue using the non-rebreather mask (A) Perform tracheostomy (C) Reintubate",
        "label": "C",
        "answer": "Reintubate",
        "options": {
            "A": "Perform tracheostomy",
            "B": "Continue using the non-rebreather mask",
            "C": "Reintubate",
            "D": "Close observation only",
            "E": "Start BiPAP"
        },
        "response": {
            "0.0": "Let's analyze the situation step by step.\n\nThe patient is a 74-year-old man who has just undergone an open cholecystectomy and was extubated after showing signs of alertness. Shortly after extubation, he becomes unresponsive, and his vital signs indicate respiratory distress, with an oxygen saturation of only 73% despite being on a non-rebreather mask with 100% FiO2. \n\nThe arterial blood gas analysis shows:\n- pH 7.32 (acidic, indicating acidosis)\n- PCO2 33 mm Hg (low, indicating respiratory compensation)\n- PO2 73 mm Hg (low, indicating hypoxemia)\n- HCO3 22 mEq/L (normal, indicating no metabolic compensation)\n\nGiven these findings, the patient is experiencing significant hypoxemia and respiratory acidosis. The low oxygen saturation and unresponsiveness indicate that he is not adequately ventilating or oxygenating, and he is likely at risk for respiratory failure.\n\nNow, let's evaluate the options:\n- (D) Close observation only: This is not appropriate given the patient's unresponsiveness and severe hypoxemia.\n- (E) Start BiPAP: While BiPAP can be helpful for some patients with respiratory distress, the patient's level of unresponsiveness and severe hypoxemia suggests that he may not be able to protect his airway adequately.\n- (B) Continue using the non-rebreather mask: This is not sufficient given the patient's worsening condition and lack of improvement.\n- (A) Perform tracheostomy: This is an invasive procedure that is not the immediate next step in this acute situation.\n- (C) Reintubate: Given the patient's unresponsiveness, severe hypoxemia, and inability to maintain adequate oxygenation, reintubation is the most appropriate next step to secure the airway and provide adequate ventilation.\n\nTherefore, the best next step in the management of this patient is:\n\n**Answer: (C) Reintubate**"
        }
    },
    {
        "question": "A 38-year-old woman presents to her primary care physician for her yearly exam. Her only complaint is difficulty losing weight. Her BMI is 34 kg/m^2. In addition to a standard physical exam, the physician orders a glucose tolerance test. The woman's fasting blood glucose level is 120 mg/dL and two-hour post 75g glucose load blood glucose level is 190 mg/dL. The physician informs the patient that she is \"pre-diabetic\" or at risk of developing diabetes and recommends lifestyle modification with follow-up in 6 months. Which of the following endogenous signaling molecules or receptors will increase insulin sensitivity in this patient? Options: (A) Catecholamines (E) TNF-alpha (C) Glucocorticoids (D) Peroxisome proliferator-activated receptor gamma (B) Glucagon",
        "label": "D",
        "answer": "Peroxisome proliferator-activated receptor gamma",
        "options": {
            "A": "Catecholamines",
            "B": "Glucagon",
            "C": "Glucocorticoids",
            "D": "Peroxisome proliferator-activated receptor gamma",
            "E": "TNF-alpha"
        },
        "response": {
            "0.0": "Let's think step by step. The patient is classified as pre-diabetic, and the goal is to increase insulin sensitivity to help manage her blood glucose levels and reduce the risk of developing type 2 diabetes.\n\n1. **Catecholamines (A)**: These hormones (like epinephrine) generally promote gluconeogenesis and glycogenolysis, which can decrease insulin sensitivity.\n\n2. **TNF-alpha (E)**: This cytokine is associated with inflammation and is known to decrease insulin sensitivity.\n\n3. **Glucocorticoids (C)**: These hormones (like cortisol) can increase blood glucose levels and decrease insulin sensitivity.\n\n4. **Glucagon (B)**: This hormone increases blood glucose levels by promoting gluconeogenesis and glycogenolysis, which does not help with insulin sensitivity.\n\n5. **Peroxisome proliferator-activated receptor gamma (D)**: This is a nuclear receptor that, when activated, increases insulin sensitivity and is a target for certain diabetes medications (like thiazolidinediones).\n\nGiven this analysis, the correct answer is:\n\n**Answer: (D) Peroxisome proliferator-activated receptor gamma**"
        }
    },
    {
        "question": "A 21-year-old woman presents to the emergency room with right arm pain and limited range of motion. She does not recall trauma to the arm. She also complains of diarrhea and nausea. She is sexually active with one male partner and admits to having pain during intercourse. There is vague and diffuse tenderness to palpation in all four abdominal quadrants. No erythema or edema is noted on the right arm. The fecal occult test is negative. Past records show that this patient has been in the ER 7 times in the past year with similar symptoms. Which of the following is the most likely diagnosis? Options: (D) Somatoform pain disorder (B) Illness anxiety disorder (E) Conversion disorder (C) Somatization disorder (A) Ulcerative colitis",
        "label": "C",
        "answer": "Somatization disorder",
        "options": {
            "A": "Ulcerative colitis",
            "B": "Illness anxiety disorder",
            "C": "Somatization disorder",
            "D": "Somatoform pain disorder",
            "E": "Conversion disorder"
        },
        "response": {
            "0.0": "Let's analyze the information step by step.\n\n1. **Patient Presentation**: The 21-year-old woman presents with right arm pain, limited range of motion, diarrhea, nausea, and pain during intercourse. She has vague abdominal tenderness and a history of multiple ER visits for similar symptoms.\n\n2. **Symptoms**: The combination of arm pain without trauma, gastrointestinal symptoms (diarrhea and nausea), and pelvic pain (pain during intercourse) suggests a complex presentation. The absence of erythema or edema in the arm indicates that the pain may not be due to a physical injury.\n\n3. **History of Visits**: The fact that she has been to the ER multiple times for similar symptoms suggests a chronic issue rather than an acute medical condition.\n\n4. **Diagnosis Options**:\n   - **(D) Somatoform pain disorder**: This involves experiencing pain that cannot be fully explained by a medical condition, but it is more focused on pain as the primary symptom.\n   - **(B) Illness anxiety disorder**: This involves excessive worry about having a serious illness, which does not seem to fit her presentation.\n   - **(E) Conversion disorder**: This involves neurological symptoms (like weakness or paralysis) that cannot be explained by medical conditions, but her symptoms are more somatic and diffuse.\n   - **(C) Somatization disorder**: This involves multiple physical complaints that cannot be fully explained by a medical condition, which aligns with her history of multiple symptoms and ER visits.\n   - **(A) Ulcerative colitis**: While she has gastrointestinal symptoms, the arm pain and the nature of her visits suggest a more psychological component.\n\n5. **Conclusion**: Given her history of multiple symptoms, the lack of a clear medical explanation for her physical complaints, and the chronic nature of her visits, the most fitting diagnosis is **(C) Somatization disorder**. \n\n**Final Answer**: (C) Somatization disorder"
        }
    },
    {
        "question": "A 12-year-old boy is brought to the emergency department for the evaluation of persistent bleeding from his nose over the past hour. The bleeding started spontaneously. He has no history of a similar episode. He takes no medications. There is no history of abnormal bleeding in the family. His vital signs are within normal limits. On examination, he is pressing a gauze against his left nostril while hyperextending his head. The gauze is stained with blood and upon withdrawal of the gauze blood slowly drips out of his left nostrils. There is no bleeding from the right nostril. The remainder of the physical examination shows no abnormalities. Which of the following is the most appropriate initial therapy? Options: (B) Oxymetazoline nasal spray (A) Anterior packing and topical antibiotics (C) Placement of an epinephrine gauze in the left nostril (D) Silver nitrate cauterization of the bleeding vessel and surrounding vessels (E) Squeezing the nostrils manually for 10 minutes with the head elevated",
        "label": "E",
        "answer": "Squeezing the nostrils manually for 10 minutes with the head elevated",
        "options": {
            "A": "Anterior packing and topical antibiotics",
            "B": "Oxymetazoline nasal spray",
            "C": "Placement of an epinephrine gauze in the left nostril",
            "D": "Silver nitrate cauterization of the bleeding vessel and surrounding vessels",
            "E": "Squeezing the nostrils manually for 10 minutes with the head elevated"
        },
        "response": {
            "0.0": "Let's think step by step. The scenario describes a 12-year-old boy with a spontaneous nosebleed (epistaxis) from the left nostril, which is common in children and often due to local trauma or dryness. \n\n1. **Initial Management**: The first step in managing a nosebleed is to control the bleeding. The recommended initial approach is to have the patient sit up, lean forward slightly, and pinch the nostrils together for about 10 minutes. This helps to apply pressure to the bleeding site and allows for clot formation.\n\n2. **Options Analysis**:\n   - (B) Oxymetazoline nasal spray: This can help constrict blood vessels but is not the first-line initial therapy.\n   - (A) Anterior packing and topical antibiotics: This is more invasive and typically used if initial measures fail.\n   - (C) Placement of an epinephrine gauze in the left nostril: This is also more advanced and not the first step.\n   - (D) Silver nitrate cauterization: This is used for persistent bleeding but is not the first step.\n   - (E) Squeezing the nostrils manually for 10 minutes with the head elevated: This is the correct initial management for a nosebleed.\n\nGiven this reasoning, the most appropriate initial therapy is:\n\n**Answer: (E) Squeezing the nostrils manually for 10 minutes with the head elevated.**"
        }
    },
    {
        "question": "A 33-year-old man presents to the infectious diseases clinic for follow-up. He was recently admitted to the hospital with fever, shortness of breath, and cough, and was found to have Pneumocystic jirovecii pneumonia and a new diagnosis of HIV. His CD4 count is 175, viral load is pending. As part of routine laboratory studies given his new diagnosis, an RPR was found to be positive with a titer of 1:64, and this is confirmed with a positive FTA-ABS. He is unsure when or how he acquired HIV or syphilis. His neurological examination is normal, and he has no symptoms. Which of the following is the most appropriate next step in management: Options: (C) Treat with three weekly injections of penicillin, obtain titers in 6 months (D) Treat with a single injection of penicillin, obtain titers in 3 months (A) Perform lumbar puncture, treat based on presence or absence of CNS disease (B) Treat with three weekly injections of penicillin, obtain titers in 3 months (E) Treat with a single injection of penicillin, obtain titers in 6 months",
        "label": "C",
        "answer": "Treat with three weekly injections of penicillin, obtain titers in 6 months",
        "options": {
            "A": "Perform lumbar puncture, treat based on presence or absence of CNS disease",
            "B": "Treat with three weekly injections of penicillin, obtain titers in 3 months",
            "C": "Treat with three weekly injections of penicillin, obtain titers in 6 months",
            "D": "Treat with a single injection of penicillin, obtain titers in 3 months",
            "E": "Treat with a single injection of penicillin, obtain titers in 6 months"
        },
        "response": {
            "0.0": "Let's think step by step. \n\nThis patient has a positive RPR and FTA-ABS, indicating a diagnosis of syphilis. Given his CD4 count of 175, he is at risk for opportunistic infections, but he currently has no neurological symptoms or signs of neurosyphilis. \n\nIn the case of syphilis, the treatment approach depends on the stage of the disease. Since the patient has a positive RPR with a titer of 1:64, this suggests he may have early syphilis (primary or secondary), especially since he is asymptomatic and has no neurological signs.\n\nFor early syphilis, the standard treatment is a single injection of benzathine penicillin G. However, if there is any concern for neurosyphilis (which is not indicated here since the neurological examination is normal), a lumbar puncture would be warranted.\n\nSince the patient is asymptomatic and there are no signs of CNS involvement, the most appropriate next step in management is to treat with a single injection of penicillin and then obtain titers in 6 months to monitor treatment response.\n\nTherefore, the correct answer is:\n\n**(E) Treat with a single injection of penicillin, obtain titers in 6 months.**"
        }
    },
    {
        "question": "A 17-year-old woman presents to your office concerned that she has not had her menstrual period in 4 months. She states that menses began at age of 13 and has been regular until two months ago. She denies sexual activity, and urine pregnancy test is negative. On exam, she appears well-nourished with a BMI of 21 kg/m^2, but you note that she has enlarged cheeks bilaterally and has calluses on the dorsum of her hands. She says that she has been very stressed with school and has recently been binge eating. What other finding do you expect to see in this patient? Options: (C) Erosion of tooth enamel (A) Malar rash (D) Enlarged thyroid (E) Elevated estrogen levels (B) Increased blood glucose level",
        "label": "C",
        "answer": "Erosion of tooth enamel",
        "options": {
            "A": "Malar rash",
            "B": "Increased blood glucose level",
            "C": "Erosion of tooth enamel",
            "D": "Enlarged thyroid",
            "E": "Elevated estrogen levels"
        },
        "response": {
            "0.0": "Let's analyze the information step by step.\n\nThe patient is a 17-year-old woman who has not had her menstrual period for 4 months, has a history of regular menses, and has recently experienced binge eating. She has enlarged cheeks (which could suggest facial swelling or \"moon facies\") and calluses on the dorsum of her hands, which are indicative of repeated trauma or friction, often seen in individuals who engage in binge eating and purging behaviors.\n\nGiven these findings, the most likely diagnosis is bulimia nervosa, which is characterized by episodes of binge eating followed by compensatory behaviors such as vomiting, excessive exercise, or fasting. \n\nIn bulimia nervosa, one common physical finding is dental erosion due to the exposure of teeth to stomach acid from vomiting. Therefore, the expected finding in this patient would be:\n\n**Answer: (C) Erosion of tooth enamel.** \n\nThis finding aligns with the behaviors associated with bulimia nervosa and is a common consequence of the condition."
        }
    },
    {
        "question": "A 3rd year resident in good standing with his residency training program would like to work more hours outside his residency obligations to gain more experience and pay for his medical school loans. He currently works and trains 60 hours per week as a resident and has a 10-hour shift external to his residency program on Saturdays. He is free of any educational and work obligations on Sundays. Based on the most recent standards set by the Accreditation Council for Graduate Medical Education (ACGME), which of the following is the most accurate statement regarding this resident\u2019s moonlighting and patient safety? Options: (E) He may work up to 20 more hours (D) He may work more hours on Sundays (B) He is not allowed to work outside the scope of his residency training (C) He may work longer shifts (A) He is already overcommitting and must reduce the number of hours",
        "label": "C",
        "answer": "He may work longer shifts",
        "options": {
            "A": "He is already overcommitting and must reduce the number of hours",
            "B": "He is not allowed to work outside the scope of his residency training",
            "C": "He may work longer shifts",
            "D": "He may work more hours on Sundays",
            "E": "He may work up to 20 more hours"
        },
        "response": {
            "0.0": "Let's think step by step. The Accreditation Council for Graduate Medical Education (ACGME) has specific guidelines regarding the work hours of residents to ensure patient safety and the well-being of the residents themselves. \n\n1. **Current Work Hours**: The resident is currently working 60 hours per week in his residency program.\n2. **External Work**: He is also working an additional 10-hour shift on Saturdays, bringing his total to 70 hours per week.\n3. **ACGME Guidelines**: According to ACGME standards, residents are limited to a maximum of 80 hours of work per week, averaged over a 4-week period. This includes both residency and any moonlighting hours.\n4. **Moonlighting**: Residents are allowed to moonlight, but it must not interfere with their residency training or exceed the maximum work hour limits.\n\nGiven that the resident is already working 70 hours per week, he has only 10 hours left to reach the 80-hour limit. Therefore, he cannot work more hours without exceeding the ACGME limit.\n\nConsidering these points, the most accurate statement regarding this resident\u2019s moonlighting and patient safety is:\n\n**Answer: (A) He is already overcommitting and must reduce the number of hours.** \n\nThis is because he is close to the maximum allowed hours, and any additional work would exceed the ACGME's limits."
        }
    },
    {
        "question": "A 28-year-old woman comes to the obstetrics and gynecology clinic because she has been unsuccessfully trying to conceive with her husband for the last 2 years. He has had 2 children from a previous marriage and has been tested for causes of male infertility. She has had prior abdominal surgery as well as a family history of endocrine abnormalities. Based on this history, a panel of tests are obtained and treatment is started. This treatment will be administered intermittently one week before her normal menstrual cycle. If the most likely drug prescribed in this case was administered in a different manner, which of the following conditions may also be treated by this drug? Options: (B) Parkinson disease (A) Diabetes (C) Polycystic ovarian syndrome (D) Premature labor (E) Prostate cancer",
        "label": "E",
        "answer": "Prostate cancer",
        "options": {
            "A": "Diabetes",
            "B": "Parkinson disease",
            "C": "Polycystic ovarian syndrome",
            "D": "Premature labor",
            "E": "Prostate cancer"
        },
        "response": {
            "0.0": "Let's analyze the question step by step.\n\nThe patient is a 28-year-old woman who has been trying to conceive for 2 years. Given her history of prior abdominal surgery and family history of endocrine abnormalities, it is likely that she may have issues related to ovulation or hormonal imbalances. The treatment mentioned is administered intermittently one week before her normal menstrual cycle, which suggests it is likely a medication that is used to induce ovulation or regulate menstrual cycles.\n\nIn the context of fertility treatments, one common medication that fits this description is Clomiphene citrate (Clomid), which is often used to treat anovulation in women with conditions like polycystic ovarian syndrome (PCOS). \n\nNow, the question asks what other condition could be treated by this drug if it were administered differently. Clomiphene citrate is not typically used for the other options listed, but it is important to note that it is not used for Parkinson's disease, diabetes, premature labor, or prostate cancer.\n\nHowever, if we consider the context of treating conditions related to hormonal regulation, Clomiphene citrate can also be used in certain cases of male infertility, particularly in cases of hypogonadism, where it can stimulate the hypothalamus and pituitary to increase testosterone production.\n\nAmong the options provided, the most relevant condition that could be treated with a drug like Clomiphene citrate (if administered differently) is:\n\n(C) Polycystic ovarian syndrome\n\nThis is because Clomiphene citrate is commonly used to treat PCOS-related infertility by inducing ovulation. \n\nSo, the answer is:\nAnswer: (C) Polycystic ovarian syndrome"
        }
    },
    {
        "question": "A 68-year-old man presents to the emergency department with confusion. The patient lives in a nursing home and has Alzheimer dementia at baseline. His nurse noticed that he was more confused than usual and was somnolent for the past 12 hours. The patient\u2019s nurse also noticed that he was soiling his diapers more frequently with copious amounts of urine. The patient has lost 15 pounds since his last physician appointment 3 weeks ago. Laboratory values are ordered as seen below.\n\nSerum:\nNa+: 139 mEq/L\nCl-: 100 mEq/L\nK+: 4.3 mEq/L\nHCO3-: 25 mEq/L\nBUN: 20 mg/dL\nGlucose: 99 mg/dL\nCreatinine: 1.1 mg/dL\nCa2+: 12.2 mg/dL\nPTH: 8 pg/mL\n\nThe patient is referred to another physician for a more thorough workup including laboratory work and CT imaging. Which of the following is the best long-term prophylaxis for the cause of this patient\u2019s acute symptoms? Options: (E) Teriparatide (A) Alendronate (D) IV fluids (C) Furosemide (B) Calcitonin",
        "label": "A",
        "answer": "Alendronate",
        "options": {
            "A": "Alendronate",
            "B": "Calcitonin",
            "C": "Furosemide",
            "D": "IV fluids",
            "E": "Teriparatide"
        },
        "response": {
            "0.0": "Let's analyze the information provided step by step.\n\nThe patient is a 68-year-old man with confusion, increased somnolence, and frequent urination. His laboratory results show hypercalcemia (Ca2+ of 12.2 mg/dL) and low parathyroid hormone (PTH) levels (8 pg/mL). The combination of hypercalcemia and low PTH suggests a primary cause of hypercalcemia that is not due to primary hyperparathyroidism, such as malignancy or other conditions leading to hypercalcemia.\n\nGiven the context, the most likely cause of the patient's hypercalcemia is malignancy, possibly due to paraneoplastic syndromes (e.g., squamous cell carcinoma leading to parathyroid hormone-related peptide secretion). \n\nIn terms of long-term management of hypercalcemia, the best option among the choices provided is to use a bisphosphonate, which helps to inhibit bone resorption and lower serum calcium levels over time.\n\n**Answer: (A) Alendronate** \n\nAlendronate is a bisphosphonate that can be used for long-term management of hypercalcemia, particularly in cases related to malignancy."
        }
    },
    {
        "question": "A one-week-old, full-term infant born by uncomplicated vaginal delivery is brought to a pediatrician by his mother, who notes that her daughter's skin appears yellow. She reports that the child cries several times per day and sleeps 7-8 hours at night, uninterrupted. She has been breastfeeding exclusively and feels that he has been feeding well. Which of the following is the best treatment for this condition? Options: (E) Continue normal breast feeding (C) Plasma exchange (D) Switch from breast milk to formula (A) Phototherapy (B) Phenobarbital administration",
        "label": "E",
        "answer": "Continue normal breast feeding",
        "options": {
            "A": "Phototherapy",
            "B": "Phenobarbital administration",
            "C": "Plasma exchange",
            "D": "Switch from breast milk to formula",
            "E": "Continue normal breast feeding"
        },
        "response": {
            "0.0": "Let's analyze the situation step by step.\n\nThe infant is one week old and presents with jaundice (yellowing of the skin), which is common in newborns. The mother reports that the infant is breastfeeding well and has a good feeding pattern. \n\nIn newborns, jaundice can be classified into two main types: physiological and pathological. Physiological jaundice typically appears after the first 24 hours of life and resolves within the first week or two. It is usually due to the immature liver's inability to process bilirubin effectively. \n\nGiven that this infant is exclusively breastfed and is otherwise healthy, the jaundice is likely physiological. In cases of physiological jaundice, the best management is often to continue normal breastfeeding, as breastfeeding can help promote bilirubin elimination through stool.\n\nNow, let's evaluate the options:\n- (E) Continue normal breast feeding: This is appropriate for physiological jaundice.\n- (C) Plasma exchange: This is typically reserved for severe cases of hemolytic disease of the newborn, not for physiological jaundice.\n- (D) Switch from breast milk to formula: This is not necessary unless there is a concern for breastfeeding failure or significant dehydration.\n- (A) Phototherapy: This is used for more severe jaundice, particularly if bilirubin levels are high enough to pose a risk of kernicterus.\n- (B) Phenobarbital administration: This is not a standard treatment for jaundice in newborns.\n\nGiven the information provided, the best treatment for this infant's condition is to continue normal breastfeeding.\n\nAnswer: (E) Continue normal breast feeding."
        }
    },
    {
        "question": "A 45-year-old woman presents to the physician with a history of headache, palpitations, and episodic diaphoresis. She was diagnosed with hypertension in the past and is now regularly taking antihypertensive medication (amlodipine 10 mg once daily). She has had a diffuse thyroid swelling for the past 4 months. She complains of pain in the long bones of her arms and legs for the past 3 months. She is slightly built, appears thin, and is anxious and apprehensive. Her skin is moist and warm. Her weight is 45 kg (99.2 lb) and height is 146 cm (4 ft 7 in); BMI is 21.12 kg/m2. Her pulse is 116/min, the blood pressure is 196/102 mm Hg, the respiratory rate is 29/min, and the temperature is 37.2\u00b0C (99.0\u00b0F). Diffuse and firm thyromegaly is present. Her upper extremities exhibit fine tremors during an anxiety attack. The laboratory test results reveal elevated 24-hour urinary VMA and metanephrines. Serum epinephrine, calcitonin, and parathormone levels are also elevated. Hypercalcemia and hyperglycemia are also noted. Which of the following is the most likely diagnosis? Options: (B) Multiple endocrine neoplasia (MEN) 1 (A) Von Hippel-Lindau syndrome (D) Multiple endocrine neoplasia (MEN) 2B (C) Multiple endocrine neoplasia (MEN) 2A (E) Neurofibromatosis",
        "label": "C",
        "answer": "Multiple endocrine neoplasia (MEN) 2A",
        "options": {
            "A": "Von Hippel-Lindau syndrome",
            "B": "Multiple endocrine neoplasia (MEN) 1",
            "C": "Multiple endocrine neoplasia (MEN) 2A",
            "D": "Multiple endocrine neoplasia (MEN) 2B",
            "E": "Neurofibromatosis"
        },
        "response": {
            "0.0": "Let's analyze the information step by step.\n\nThe patient presents with several key symptoms and laboratory findings:\n\n1. **Symptoms**: \n   - Headache, palpitations, and diaphoresis suggest catecholamine excess, which is often seen in pheochromocytoma.\n   - Diffuse thyroid swelling (thyromegaly) indicates a thyroid issue, possibly hyperthyroidism.\n   - Pain in long bones and anxiety could be related to hypercalcemia or other metabolic disturbances.\n\n2. **Vital Signs**: \n   - The patient has hypertension (196/102 mm Hg) and tachycardia (pulse of 116/min), which can be associated with pheochromocytoma or hyperthyroidism.\n\n3. **Laboratory Findings**: \n   - Elevated 24-hour urinary VMA and metanephrines indicate catecholamine-secreting tumors, such as pheochromocytoma.\n   - Elevated serum epinephrine suggests adrenal involvement.\n   - Elevated calcitonin indicates possible medullary thyroid carcinoma.\n   - Hypercalcemia and hyperglycemia can be associated with multiple endocrine neoplasia syndromes.\n\n4. **Diagnosis Consideration**:\n   - The combination of pheochromocytoma (elevated catecholamines), medullary thyroid carcinoma (elevated calcitonin), and possibly primary hyperparathyroidism (elevated parathormone and hypercalcemia) points towards Multiple Endocrine Neoplasia (MEN) syndrome.\n   - MEN 2B specifically includes pheochromocytoma, medullary thyroid carcinoma, and mucosal neuromas, and it is associated with a marfanoid habitus, which could explain the patient's thin build.\n\nGiven these considerations, the most likely diagnosis for this patient is:\n\n**Answer: (D) Multiple endocrine neoplasia (MEN) 2B**."
        }
    },
    {
        "question": "In a study to determine the risk factors for myocardial infarction (MI) at a young age (age < 30 years), 30 young patients with the condition are recruited into the study group. Sixty similar but healthy individuals are recruited into the control group. Educational status is considered to be an important variable, as it would affect the awareness of the disease and its risk factors among the participants. Based on the level of education, 2 groups are formed: low educational status and high educational status. A chi-square test is performed to test the significance of the relationship, and an odds ratio of 2.1 was computed for the association between low education and the risk of MI, with a confidence interval of 0.9\u20139.7. What inference can be made on the association between young age MI and educational status from this study? Options: (C) The association is not statistically significant, but low education is a risk factor. (A) The association is not statistically significant, and low education is not a risk factor. (E) The association is statistically significant, and low education is a risk factor. (B) The association is statistically significant, but low education is not a risk factor. (D) One can not comment, as the p-value is not given.",
        "label": "A",
        "answer": "The association is not statistically significant, and low education is not a risk factor.",
        "options": {
            "A": "The association is not statistically significant, and low education is not a risk factor.",
            "B": "The association is statistically significant, but low education is not a risk factor.",
            "C": "The association is not statistically significant, but low education is a risk factor.",
            "D": "One can not comment, as the p-value is not given.",
            "E": "The association is statistically significant, and low education is a risk factor."
        },
        "response": {
            "0.0": "Let's analyze the information step by step.\n\n1. **Study Design**: The study compares young patients with myocardial infarction (MI) to healthy controls, focusing on educational status as a potential risk factor.\n\n2. **Odds Ratio**: An odds ratio (OR) of 2.1 suggests that individuals with low educational status are more than twice as likely to experience MI compared to those with high educational status.\n\n3. **Confidence Interval**: The confidence interval (CI) of 0.9\u20139.7 includes 1. This indicates that the association is not statistically significant because a CI that includes 1 means that we cannot rule out the possibility that there is no effect (i.e., no association).\n\n4. **Statistical Significance**: Since the CI includes 1, we conclude that the association between low education and the risk of MI is not statistically significant.\n\n5. **Risk Factor Conclusion**: Although the odds ratio suggests a potential association, the lack of statistical significance means we cannot definitively say that low education is a risk factor based on this study.\n\nBased on this analysis, the most appropriate inference is:\n\n**Answer: (A) The association is not statistically significant, and low education is not a risk factor.**"
        }
    },
    {
        "question": "A 26-year-old woman is brought to the emergency department 20 minutes after being involved in a high-speed motor vehicle collision in which she was a restrained passenger. On arrival, she is lethargic and incoherent. She has severe facial lacerations and is in respiratory distress. Her pulse is 130/min, respirations are 29/min, and blood pressure is 90/58 mm Hg. Pulse oximetry on room air shows an oxygen saturation of 70%. Examination shows multiple facial lacerations. There is dullness to percussion and decreased breath sounds over the left lung base. Abdominal examination shows diffuse tenderness with no guarding or rebound. Bowel sounds are normal. The remainder of the examination shows no abnormalities. Her hemoglobin concentration is 12.1 g/dL. An x-ray of the chest shows a fractured left second rib, depression of the left mainstem bronchus, deviation of the nasogastric tube to the right, and a widened mediastinum. Which of the following is the most likely diagnosis? Options: (E) Tension pneumothorax (C) Thoracic aortic rupture (B) Traumatic bronchial rupture (A) Diaphragmatic rupture (D) Cardiac tamponade",
        "label": "C",
        "answer": "Thoracic aortic rupture",
        "options": {
            "A": "Diaphragmatic rupture",
            "B": "Traumatic bronchial rupture",
            "C": "Thoracic aortic rupture",
            "D": "Cardiac tamponade",
            "E": "Tension pneumothorax"
        },
        "response": {
            "0.0": "Let's analyze the scenario step by step.\n\n1. **Patient Presentation**: The patient is a 26-year-old woman involved in a high-speed motor vehicle collision. She is lethargic, incoherent, in respiratory distress, and has severe facial lacerations. Her vital signs indicate tachycardia (pulse of 130/min), tachypnea (respirations of 29/min), and hypotension (blood pressure of 90/58 mm Hg). \n\n2. **Oxygen Saturation**: The oxygen saturation is critically low at 70%, indicating significant respiratory compromise.\n\n3. **Physical Examination Findings**: \n   - Dullness to percussion and decreased breath sounds over the left lung base suggest fluid accumulation or a mass effect in the left thoracic cavity.\n   - Abdominal examination shows diffuse tenderness but no guarding or rebound, which may indicate intra-abdominal injury but is not specific.\n\n4. **Imaging Findings**: \n   - The chest x-ray shows a fractured left second rib, depression of the left mainstem bronchus, deviation of the nasogastric tube to the right, and a widened mediastinum. \n   - A widened mediastinum is particularly concerning for potential vascular injury, such as a thoracic aortic rupture.\n\n5. **Differential Diagnosis**:\n   - **Tension pneumothorax**: Would typically present with tracheal deviation away from the affected side and hyper-resonance on percussion, which is not indicated here.\n   - **Thoracic aortic rupture**: The combination of a widened mediastinum, rib fracture, and the mechanism of injury (high-speed collision) strongly suggests this diagnosis.\n   - **Traumatic bronchial rupture**: Would likely present with different findings, such as subcutaneous emphysema or significant respiratory distress without the mediastinal widening.\n   - **Diaphragmatic rupture**: Would typically present with bowel sounds in the thorax or respiratory distress but is less likely given the mediastinal findings.\n   - **Cardiac tamponade**: Would present with hypotension, muffled heart sounds, and jugular venous distension, but the mediastinal widening is more indicative of aortic injury.\n\nGiven the mechanism of injury, the imaging findings, and the clinical presentation, the most likely diagnosis is:\n\n**Answer: (C) Thoracic aortic rupture**"
        }
    },
    {
        "question": "A 66-year-old male with a history of myocardial infarction presents to your primary care office with complaints of dyspnea on exertion and swollen feet and ankles. On exam, you note an elevated JVP and 2+ pitting edema of bilateral lower extremities. What is the most likely explanation for this patient's lower extremity edema? Options: (D) Increase in colloid osmotic pressure (C) Increase in capillary permeability (E) Increase in interstitial fluid pressure (A) Increase in capillary pressure (B) Decrease in plasma proteins",
        "label": "A",
        "answer": "Increase in capillary pressure",
        "options": {
            "A": "Increase in capillary pressure",
            "B": "Decrease in plasma proteins",
            "C": "Increase in capillary permeability",
            "D": "Increase in colloid osmotic pressure",
            "E": "Increase in interstitial fluid pressure"
        },
        "response": {
            "0.0": "Let's analyze the situation step by step.\n\n1. **Patient Background**: The patient is a 66-year-old male with a history of myocardial infarction, which suggests he may have underlying heart failure or reduced cardiac output.\n\n2. **Symptoms**: He presents with dyspnea on exertion and swollen feet and ankles, which are common signs of fluid retention and heart failure.\n\n3. **Physical Exam Findings**: The elevated jugular venous pressure (JVP) indicates increased central venous pressure, which is often seen in heart failure. The presence of 2+ pitting edema in the lower extremities suggests fluid accumulation in the interstitial spaces.\n\n4. **Mechanism of Edema**: In heart failure, the heart's inability to pump effectively leads to increased pressure in the venous system. This increased pressure in the capillaries (capillary hydrostatic pressure) causes fluid to leak out into the interstitial space, resulting in edema.\n\n5. **Options Analysis**:\n   - (D) Increase in colloid osmotic pressure: This would typically decrease edema, not cause it.\n   - (C) Increase in capillary permeability: This can cause edema but is not the primary mechanism in heart failure.\n   - (E) Increase in interstitial fluid pressure: This is a consequence of edema but not the primary cause.\n   - (A) Increase in capillary pressure: This is consistent with heart failure and explains the edema.\n   - (B) Decrease in plasma proteins: This can cause edema but is not indicated in this patient.\n\nBased on this analysis, the most likely explanation for this patient's lower extremity edema is:\n\n**Answer: (A) Increase in capillary pressure**"
        }
    },
    {
        "question": "A 32-year-old woman presents to the emergency department with complaints of a headache. The last menstrual period was 4 months ago. She also reports having a mild headache for 1 month. There has been a grape-like mass protruding from her vagina for the last 15 days. On examination, the fundus of the uterus is at the level of the umbilicus and no fetal heart sounds are heard. The vital signs are as follows: blood pressure 160/100 mm Hg, pulse rate 108/min. On USG examination, no fetal parts are seen. What will be the genotype of the substance which will be aspirated by dilation and evacuation? Options: (A) 69XXY (E) 46XX (C) 23XX (D) 47XYY (B) 45XO",
        "label": "E",
        "answer": "46XX",
        "options": {
            "A": "69XXY",
            "B": "45XO",
            "C": "23XX",
            "D": "47XYY",
            "E": "46XX"
        },
        "response": {
            "0.0": "Let's analyze the case step by step. \n\nThe patient is a 32-year-old woman presenting with a history of amenorrhea (last menstrual period 4 months ago), a grape-like mass protruding from the vagina, and a significantly enlarged uterus. The absence of fetal heart sounds and the ultrasound findings indicating no fetal parts suggest a diagnosis of a molar pregnancy, specifically a complete hydatidiform mole.\n\nIn a complete hydatidiform mole, the typical genotype is 46XX, which arises from the fertilization of an empty ovum by a sperm that duplicates its genetic material, leading to a diploid set of chromosomes that is entirely paternal in origin. \n\nGiven this information, the most appropriate answer regarding the genotype of the substance that will be aspirated by dilation and evacuation is:\n\nAnswer: (E) 46XX"
        }
    },
    {
        "question": "The Kozak sequence for the Beta-globin gene has a known mutation which decreases, though does not abolish, translation of the Beta-globin mRNA, leading to a phenotype of thalassemia intermedia. What would the blood smear be expected to show in a patient positive for this mutation? Options: (C) Microcytic red blood cells (D) Bite cells (A) Macrocytic red blood cells (E) Ringed sideroblasts (B) Hyperchromic red blood cells",
        "label": "C",
        "answer": "Microcytic red blood cells",
        "options": {
            "A": "Macrocytic red blood cells",
            "B": "Hyperchromic red blood cells",
            "C": "Microcytic red blood cells",
            "D": "Bite cells",
            "E": "Ringed sideroblasts"
        },
        "response": {
            "0.0": "Let's think step by step. The mutation in the Kozak sequence of the Beta-globin gene leads to decreased translation of the Beta-globin mRNA, which is associated with thalassemia intermedia. Thalassemia is characterized by reduced production of hemoglobin, leading to microcytic anemia.\n\nIn thalassemia, the red blood cells are typically smaller than normal due to the decreased hemoglobin content, which results in microcytic red blood cells. Therefore, the expected finding on a blood smear for a patient with this mutation would be:\n\nAnswer: (C) Microcytic red blood cells"
        }
    },
    {
        "question": "A gunshot victim is brought to the Emergency Department and appears to be in shock. You note a penetrating wound at the level of L3. Assuming the bullet remained at this level, which vascular structure might have been injured? Options: (D) Renal artery (A) Inferior vena cava (B) Internal iliac artery (C) Internal iliac vein (E) Portal vein",
        "label": "A",
        "answer": "Inferior vena cava",
        "options": {
            "A": "Inferior vena cava",
            "B": "Internal iliac artery",
            "C": "Internal iliac vein",
            "D": "Renal artery",
            "E": "Portal vein"
        },
        "response": {
            "0.0": "Let's analyze the question step by step.\n\nThe question describes a gunshot victim with a penetrating wound at the level of L3. At this level, we need to consider the anatomy of the major vascular structures in the abdomen and pelvis.\n\n1. **Renal artery**: The renal arteries branch off the abdominal aorta at the level of L1-L2, so they are not likely to be injured at L3.\n\n2. **Inferior vena cava (IVC)**: The IVC runs along the right side of the vertebral column and is located at the level of L5, but it can be affected by injuries at L3 due to its proximity.\n\n3. **Internal iliac artery**: The internal iliac arteries branch off the common iliac arteries, which bifurcate at the level of L4-L5. While they are located in the pelvis, they are not directly at the L3 level.\n\n4. **Internal iliac vein**: Similar to the internal iliac artery, the internal iliac veins are also located in the pelvis and are not directly at the L3 level.\n\n5. **Portal vein**: The portal vein is formed by the union of the superior mesenteric vein and the splenic vein, and it is located more superiorly in the abdomen, typically at the level of L2.\n\nGiven this analysis, the most likely vascular structure that could be injured by a penetrating wound at the level of L3 is the **inferior vena cava (IVC)**, as it is in close proximity to that level and can be affected by trauma in that area.\n\nTherefore, the answer is: **(A) Inferior vena cava**."
        }
    },
    {
        "question": "A 51-year-old woman presents to her primary care physician complaining of months of dry mouth and dry eyes. She says the dryness has become so severe that she has difficulty swallowing food. She has a history of hypertension, for which she takes hydrochlorothiazide (HCTZ), but she has no other medical problems. Family history is significant for her grandmother having systemic lupus erythematosus. The vital signs include: blood pressure 118/76 mm Hg, heart rate 78/min, and respiratory rate 15/min. On physical exam, she has tender parotid glands bilaterally and dries mucous membranes. The presence of serum anti-Ro and anti-La autoantibodies is confirmed at high titers. In addition to her primary diagnosis, which of the following is this patient most at risk for developing in the future? Options: (D) Invasive ductal carcinoma of the breast (A) Gastric carcinoma (B) Non-Hodgkin lymphoma (E) Adenocarcinoma of the lung (C) Pancreatic adenocarcinoma",
        "label": "B",
        "answer": "Non-Hodgkin lymphoma",
        "options": {
            "A": "Gastric carcinoma",
            "B": "Non-Hodgkin lymphoma",
            "C": "Pancreatic adenocarcinoma",
            "D": "Invasive ductal carcinoma of the breast",
            "E": "Adenocarcinoma of the lung"
        },
        "response": {
            "0.0": "Let's think step by step. The patient in this scenario is presenting with symptoms consistent with Sj\u00f6gren's syndrome, which is characterized by dry mouth (xerostomia) and dry eyes (keratoconjunctivitis sicca). The presence of anti-Ro (SSA) and anti-La (SSB) autoantibodies further supports this diagnosis.\n\nPatients with Sj\u00f6gren's syndrome are at an increased risk for developing certain complications, particularly non-Hodgkin lymphoma. This association is well-documented, as the chronic inflammation and immune dysregulation seen in Sj\u00f6gren's can lead to lymphoproliferative disorders.\n\nGiven this information, the most appropriate answer to the question regarding what this patient is most at risk for developing in the future is:\n\n**Answer: (B) Non-Hodgkin lymphoma**"
        }
    },
    {
        "question": "A 35-year-old woman comes to the physician because of intermittent episodes of heart palpitations for 3 weeks. The palpitations are accompanied by chest pain that is sharp and localized to the left 3rd intercostal space. The patient does not smoke. She drinks one to two glasses of wine on the weekends. She appears nervous. Her pulse is 110/min and irregularly irregular, and blood pressure is 135/85 mmHg. Examination shows a fine tremor on both hands and digital swelling. There is retraction of the left upper eyelid. A systolic ejection murmur is heard along the right upper sternal border. The extremities are warm, and pulses are 2+ bilaterally. Which of the following is the most appropriate pharmacotherapy? Options: (A) Propranolol (E) Diltiazem (B) Digoxin (C) Amiodarone (D) Warfarin",
        "label": "A",
        "answer": "Propranolol",
        "options": {
            "A": "Propranolol",
            "B": "Digoxin",
            "C": "Amiodarone",
            "D": "Warfarin",
            "E": "Diltiazem"
        },
        "response": {
            "0.0": "Let's analyze the case step by step.\n\n1. **Patient Presentation**: The 35-year-old woman has intermittent episodes of heart palpitations, chest pain localized to the left 3rd intercostal space, a pulse of 110/min that is irregularly irregular, and signs of hyperthyroidism (fine tremor, digital swelling, retraction of the left upper eyelid). \n\n2. **Clinical Signs**: The irregularly irregular pulse suggests atrial fibrillation, which is often associated with hyperthyroidism. The presence of tremors and eyelid retraction further supports this diagnosis.\n\n3. **Heart Murmur**: The systolic ejection murmur heard along the right upper sternal border could indicate aortic stenosis or flow-related murmurs, but in the context of hyperthyroidism, it may be related to increased cardiac output.\n\n4. **Management of Atrial Fibrillation**: In patients with atrial fibrillation, especially when associated with hyperthyroidism, the primary goal is to control the heart rate and manage the underlying hyperthyroid condition.\n\n5. **Pharmacotherapy Options**:\n   - **Propranolol (A)**: A non-selective beta-blocker that can help control heart rate and alleviate symptoms of hyperthyroidism.\n   - **Diltiazem (E)**: A calcium channel blocker that can also be used to control heart rate in atrial fibrillation.\n   - **Digoxin (B)**: Can be used for rate control but is less effective in hyperthyroid patients due to increased heart rate.\n   - **Amiodarone (C)**: An antiarrhythmic that can be used for rhythm control but is not the first line for rate control.\n   - **Warfarin (D)**: An anticoagulant used to prevent thromboembolism in atrial fibrillation but does not address the immediate symptoms.\n\nGiven the patient's symptoms of hyperthyroidism and atrial fibrillation, the most appropriate pharmacotherapy to control her heart rate and alleviate symptoms would be **Propranolol (A)**.\n\n**Answer: (A) Propranolol**"
        }
    },
    {
        "question": "A medical student decides to join an immunology research center, which specifically works on capsular polysaccharide vaccine development against bacteria, such as Haemophilus influenzae type b (Hib), Neisseria meningitidis, and Streptococcus pneumoniae. As a member of a research team working on the Hib vaccine, he asks his senior colleague why capsular polysaccharides are conjugated to protein carriers like tetanus toxoid during vaccine development. Which of the following is the best response to this question? Options: (C) Polysaccharides conjugated with proteins are T cell-independent antigens (B) Conjugation with a protein carrier generates IgM dominant antibody responses (D) Conjugation with a protein carrier improves vaccine stability (E) Conjugation with a protein carrier provides effective protection to infants (A) Conjugation with a protein carrier generates IgG2 dominant antibody responses",
        "label": "E",
        "answer": "Conjugation with a protein carrier provides effective protection to infants",
        "options": {
            "A": "Conjugation with a protein carrier generates IgG2 dominant antibody responses",
            "B": "Conjugation with a protein carrier generates IgM dominant antibody responses",
            "C": "Polysaccharides conjugated with proteins are T cell-independent antigens",
            "D": "Conjugation with a protein carrier improves vaccine stability",
            "E": "Conjugation with a protein carrier provides effective protection to infants"
        },
        "response": {
            "0.0": "Let's think step by step. \n\nThe question is about the rationale behind conjugating capsular polysaccharides to protein carriers in vaccine development, particularly for vaccines against encapsulated bacteria like Haemophilus influenzae type b (Hib).\n\n1. **Understanding Polysaccharide Vaccines**: Capsular polysaccharides are T cell-independent antigens, meaning they can stimulate B cells directly without the help of T cells. However, this type of response is typically weaker and does not lead to the generation of high-affinity IgG antibodies or immunological memory.\n\n2. **Role of Protein Carriers**: By conjugating polysaccharides to protein carriers (like tetanus toxoid), the immune response is converted to a T cell-dependent response. This allows for:\n   - Activation of T helper cells, which in turn help B cells produce high-affinity IgG antibodies.\n   - Generation of immunological memory, which is crucial for long-term protection.\n\n3. **Infant Immunity**: Infants have immature immune systems and often do not respond well to T cell-independent antigens. Conjugating polysaccharides to protein carriers enhances the immune response in infants, making the vaccine more effective.\n\n4. **Antibody Response**: The conjugation leads to a more robust IgG response rather than just IgM, which is typically produced in T cell-independent responses.\n\nGiven this understanding, the best response to the medical student's question is:\n\n**(E) Conjugation with a protein carrier provides effective protection to infants.**\n\nThis option highlights the importance of the conjugation in enhancing the immune response, particularly in the vulnerable infant population."
        }
    },
    {
        "question": "A 45-year-old male with a history of diabetes and poorly controlled hypertension presents to his primary care physician for an annual check-up. He reports that he feels well and has no complaints. He takes enalapril and metformin. His temperature is 98.8\u00b0F (37.1\u00b0C), blood pressure is 155/90 mmHg, pulse is 80/min, and respirations are 16/min. His physician adds another anti-hypertensive medication to the patient\u2019s regimen. One month later, the patient returns to the physician complaining of new onset lower extremity swelling. Which of the following medications was likely prescribed to this patient? Options: (C) Nifedipine (E) Spironolactone (A) Metoprolol (B) Verapamil (D) Hydrochlorthiazide",
        "label": "C",
        "answer": "Nifedipine",
        "options": {
            "A": "Metoprolol",
            "B": "Verapamil",
            "C": "Nifedipine",
            "D": "Hydrochlorthiazide",
            "E": "Spironolactone"
        },
        "response": {
            "0.0": "Let's think step by step. \n\nThe patient has poorly controlled hypertension and is already on enalapril (an ACE inhibitor) and metformin (for diabetes). The physician adds another antihypertensive medication, and one month later, the patient presents with new onset lower extremity swelling.\n\nAmong the options provided:\n\n- (A) Metoprolol: This is a beta-blocker, which is less commonly associated with peripheral edema.\n- (B) Verapamil: This is a calcium channel blocker, but it is more likely to cause constipation than peripheral edema.\n- (C) Nifedipine: This is a dihydropyridine calcium channel blocker that is known to cause peripheral edema as a side effect.\n- (D) Hydrochlorothiazide: This is a thiazide diuretic, which typically does not cause peripheral edema and is more likely to cause electrolyte imbalances.\n- (E) Spironolactone: This is a potassium-sparing diuretic, which can cause some fluid retention but is not typically associated with significant peripheral edema.\n\nGiven that the patient developed lower extremity swelling after the addition of a new antihypertensive medication, the most likely medication prescribed is (C) Nifedipine, as it is known to cause peripheral edema.\n\nAnswer: (C) Nifedipine"
        }
    },
    {
        "question": "A 42-year-old man presents to his primary care physician for a follow-up visit. He has type 1 diabetes mellitus, for which he takes insulin. He complains of frequent episodes of waking up in the middle of his sleep. When he wakes up, he feels excessive sweating, hand tremors, and weakness. His morning blood glucose is high on repeated measurement. Which of the following is the optimal intervention for this patient condition? Options: (D) Increasing daily insulin dose (A) Reassurance (C) Adding pramlintide (E) Reducing daily insulin dose (B) Adding diazepam",
        "label": "E",
        "answer": "Reducing daily insulin dose",
        "options": {
            "A": "Reassurance",
            "B": "Adding diazepam",
            "C": "Adding pramlintide",
            "D": "Increasing daily insulin dose",
            "E": "Reducing daily insulin dose"
        },
        "response": {
            "0.0": "Let's analyze the situation step by step.\n\n1. **Patient Background**: The patient is a 42-year-old man with type 1 diabetes mellitus who is on insulin therapy. He experiences episodes of waking up at night with symptoms such as excessive sweating, hand tremors, and weakness.\n\n2. **Symptoms Analysis**: The symptoms described (sweating, tremors, weakness) are indicative of hypoglycemia. The fact that he wakes up in the middle of the night with these symptoms suggests that he may be experiencing nocturnal hypoglycemia.\n\n3. **Morning Blood Glucose**: The patient also reports high morning blood glucose levels on repeated measurements. This could indicate that he is experiencing hypoglycemia during the night, which leads to a counter-regulatory response that raises his blood glucose levels in the morning (the \"dawn phenomenon\" or rebound hyperglycemia).\n\n4. **Intervention Options**:\n   - (D) **Increasing daily insulin dose**: This would likely worsen his hypoglycemia and is not appropriate.\n   - (A) **Reassurance**: While reassurance is important, it does not address the underlying issue of hypoglycemia.\n   - (C) **Adding pramlintide**: Pramlintide is an amylin analog that can help with postprandial glucose control but does not directly address nocturnal hypoglycemia.\n   - (E) **Reducing daily insulin dose**: This is a reasonable option, as reducing the insulin dose may help prevent nocturnal hypoglycemia.\n   - (B) **Adding diazepam**: Diazepam is a benzodiazepine and is not indicated for managing diabetes or hypoglycemia.\n\n5. **Optimal Intervention**: Given the evidence of nocturnal hypoglycemia and the high morning blood glucose levels, the most appropriate intervention would be to reduce the daily insulin dose to prevent hypoglycemic episodes at night.\n\n**Final Answer**: (E) Reducing daily insulin dose"
        }
    }
]