[
    {
        "question": "A 21-year-old male presents to his primary care provider for fatigue. He reports that he graduated from college last month and returned 3 days ago from a 2 week vacation to Vietnam and Cambodia. For the past 2 days, he has developed a worsening headache, malaise, and pain in his hands and wrists. The patient has a past medical history of asthma managed with albuterol as needed. He is sexually active with both men and women, and he uses condoms \u201cmost of the time.\u201d On physical exam, the patient\u2019s temperature is 102.5\u00b0F (39.2\u00b0C), blood pressure is 112/66 mmHg, pulse is 105/min, respirations are 12/min, and oxygen saturation is 98% on room air. He has tenderness to palpation over his bilateral metacarpophalangeal joints and a maculopapular rash on his trunk and upper thighs. Tourniquet test is negative. Laboratory results are as follows:\n\nHemoglobin: 14 g/dL\nHematocrit: 44%\nLeukocyte count: 3,200/mm^3\nPlatelet count: 112,000/mm^3\n\nSerum:\nNa+: 142 mEq/L\nCl-: 104 mEq/L\nK+: 4.6 mEq/L\nHCO3-: 24 mEq/L\nBUN: 18 mg/dL\nGlucose: 87 mg/dL\nCreatinine: 0.9 mg/dL\nAST: 106 U/L\nALT: 112 U/L\nBilirubin (total): 0.8 mg/dL\nBilirubin (conjugated): 0.3 mg/dL\n\nWhich of the following is the most likely diagnosis in this patient? Options: (D) Hepatitis A (A) Chikungunya (C) Epstein-Barr virus (B) Dengue fever (E) Typhoid fever",
        "label": "A",
        "answer": "Chikungunya",
        "options": {
            "A": "Chikungunya",
            "B": "Dengue fever",
            "C": "Epstein-Barr virus",
            "D": "Hepatitis A",
            "E": "Typhoid fever"
        },
        "response": {
            "0.0": "Let's analyze the case step by step.\n\n1. **Patient Presentation**: The patient is a 21-year-old male who recently returned from a trip to Vietnam and Cambodia. He presents with fatigue, worsening headache, malaise, and pain in his hands and wrists. He also has a fever (102.5\u00b0F) and a maculopapular rash.\n\n2. **Physical Exam Findings**: The patient has tenderness over his bilateral metacarpophalangeal joints, which suggests possible arthralgia or arthritis. The negative tourniquet test indicates that there is no significant bleeding tendency.\n\n3. **Laboratory Results**:\n   - Leukopenia (low white blood cell count: 3,200/mm^3)\n   - Thrombocytopenia (low platelet count: 112,000/mm^3)\n   - Elevated liver enzymes (AST: 106 U/L, ALT: 112 U/L)\n\n4. **Epidemiological Context**: The patient has traveled to Southeast Asia, where several viral infections are endemic, including dengue fever and chikungunya.\n\n5. **Differential Diagnosis**:\n   - **Dengue Fever**: Common in Southeast Asia, presents with fever, headache, retro-orbital pain, myalgia, arthralgia, rash, leukopenia, and thrombocytopenia. The elevated liver enzymes also fit with dengue.\n   - **Chikungunya**: Also presents with fever and severe joint pain, but typically has a more pronounced arthralgia component and may not always show significant thrombocytopenia.\n   - **Hepatitis A**: Would typically present with jaundice and more significant liver enzyme elevation, and the travel history fits, but the joint pain is less characteristic.\n   - **Epstein-Barr Virus**: Typically presents with fatigue, fever, and lymphadenopathy, not usually with significant thrombocytopenia or joint pain.\n   - **Typhoid Fever**: Would present with prolonged fever, abdominal symptoms, and possibly rose spots, but not typically with joint pain and significant liver enzyme elevation.\n\nGiven the travel history, clinical presentation, and laboratory findings, the most likely diagnosis for this patient is **Dengue fever (B)**. \n\n**Answer: (B) Dengue fever**"
        },
        "api_calls": 4
    },
    {
        "question": "A 56-year-old man with a history of hypertension presents to his physician with progressive fatigue and new onset muscle cramps. He has had no recent changes to his medication regimen, which includes hydrochlorothiazide, lisinopril, and amlodipine. His temperature is 98.0\u00b0F (36.7\u00b0C), blood pressure is 174/111 mmHg, pulse is 70/min, respirations are 12/min, and oxygen saturation is 98% on room air. The patient's cardiopulmonary and abdominal exams are unremarkable. Laboratory values are ordered as seen below.\n\nSerum:\nNa+: 138 mEq/L\nCl-: 100 mEq/L\nK+: 3.3 mEq/L\nHCO3-: 33 mEq/L\nBUN: 20 mg/dL\nGlucose: 129 mg/dL\n\nWhat is the most likely underlying etiology of this patient's hypertension? Options: (A) Aldosterone excess (B) Catecholamine-secreting mass (E) Increased peripheral vascular resistance (C) Cortisol excess (D) Impaired kidney perfusion",
        "label": "A",
        "answer": "Aldosterone excess",
        "options": {
            "A": "Aldosterone excess",
            "B": "Catecholamine-secreting mass",
            "C": "Cortisol excess",
            "D": "Impaired kidney perfusion",
            "E": "Increased peripheral vascular resistance"
        },
        "response": {
            "0.0": "Let's analyze the information step by step.\n\n1. **Patient Presentation**: The patient is a 56-year-old man with a history of hypertension, presenting with progressive fatigue and new onset muscle cramps. He is on hydrochlorothiazide, which is a diuretic that can lead to electrolyte imbalances.\n\n2. **Vital Signs**: His blood pressure is significantly elevated at 174/111 mmHg, indicating poorly controlled hypertension.\n\n3. **Laboratory Values**:\n   - Sodium (Na+): 138 mEq/L (normal)\n   - Chloride (Cl-): 100 mEq/L (normal)\n   - Potassium (K+): 3.3 mEq/L (low, indicating hypokalemia)\n   - Bicarbonate (HCO3-): 33 mEq/L (elevated, indicating metabolic alkalosis)\n   - BUN: 20 mg/dL (slightly elevated)\n   - Glucose: 129 mg/dL (elevated, indicating possible insulin resistance or diabetes)\n\n4. **Key Findings**: The patient has hypokalemia (low potassium) and metabolic alkalosis. These findings are particularly suggestive of a condition associated with excess aldosterone, as aldosterone promotes sodium retention (leading to hypertension), potassium excretion (leading to hypokalemia), and hydrogen ion excretion (leading to metabolic alkalosis).\n\n5. **Differential Diagnosis**:\n   - **Aldosterone excess (Primary Hyperaldosteronism)**: This is characterized by hypertension, hypokalemia, and metabolic alkalosis.\n   - **Catecholamine-secreting mass (e.g., pheochromocytoma)**: Typically presents with paroxysmal hypertension and does not usually cause hypokalemia.\n   - **Cortisol excess (Cushing's syndrome)**: Can cause hypertension and hypokalemia, but the metabolic alkalosis is less common.\n   - **Impaired kidney perfusion**: This could lead to secondary hypertension but would not typically cause hypokalemia and metabolic alkalosis.\n   - **Increased peripheral vascular resistance**: This is a common cause of hypertension but does not explain the hypokalemia and metabolic alkalosis.\n\nGiven the combination of hypertension, hypokalemia, and metabolic alkalosis, the most likely underlying etiology of this patient's hypertension is:\n\n**Answer: (A) Aldosterone excess**"
        },
        "api_calls": 4
    },
    {
        "question": "A 47-year-old woman seeks evaluation at your office because she has had postcoital vaginal bleeding for the past 8 months with occasional intermenstrual watery, blood-tinged vaginal discharge. Her family history is negative for malignancies and inherited disorders. She is the result of a pregnancy complicated by numerous miscarriages in the 1960s, for which her mother received diethylstilbestrol. During a pelvic examination, you notice a polypoid mass on the anterior wall of the vagina. The bimanual examination is negative for adnexal masses. You suspect the presence of carcinoma and, therefore, send tissue samples to pathology, which confirmed the presence of malignant cells. Which of the following is the most likely malignant tumor in this patient? Options: (E) Squamous cell carcinoma (SCC) (B) Melanoma (A) Clear cell adenocarcinoma (C) Botryoid sarcoma (D) Verrucous carcinoma",
        "label": "A",
        "answer": "Clear cell adenocarcinoma",
        "options": {
            "A": "Clear cell adenocarcinoma",
            "B": "Melanoma",
            "C": "Botryoid sarcoma",
            "D": "Verrucous carcinoma",
            "E": "Squamous cell carcinoma (SCC)"
        },
        "response": {
            "0.0": "Let's analyze the information provided step by step.\n\n1. **Patient Profile**: The patient is a 47-year-old woman with a history of postcoital vaginal bleeding and intermenstrual watery, blood-tinged discharge. She has a significant history of her mother receiving diethylstilbestrol (DES) during pregnancy, which is known to be associated with certain gynecological malignancies in the offspring.\n\n2. **Examination Findings**: A polypoid mass is noted on the anterior wall of the vagina, and the bimanual examination is negative for adnexal masses. \n\n3. **Pathology Results**: The tissue samples confirmed the presence of malignant cells.\n\n4. **Risk Factors**: The use of DES in the mother is particularly relevant. Daughters of women who took DES are at increased risk for developing clear cell adenocarcinoma of the vagina and cervix.\n\nGiven these points, the most likely malignant tumor in this patient, considering her history and the findings, is:\n\n**Answer: (A) Clear cell adenocarcinoma**."
        },
        "api_calls": 4
    },
    {
        "question": "A 36-year-old man undergoes open reduction and internal fixation of a left femur fracture sustained after a motor vehicle collision. Three days after the surgery, he develops fever and redness around the surgical site. His temperature is 39.5\u00b0C (103.1\u00b0F). Physical examination shows purulent discharge from the wound with erythema of the surrounding skin. Wound culture of the purulent discharge shows gram-positive cocci in clusters. Treatment with oral dicloxacillin is initiated. Four days later, the patient continues to have high-grade fever, pain, and purulent discharge. Which of the following characteristics of the infecting organism best explains the failure to improve with antibiotic therapy? Options: (C) Ability to cleave \u03b2-lactam rings (E) Adaptation in binding proteins (B) Presence of an impenetrable outer membrane (A) Secretion of a pyrogenic toxin (D) Development of efflux pumps",
        "label": "E",
        "answer": "Adaptation in binding proteins",
        "options": {
            "A": "Secretion of a pyrogenic toxin",
            "B": "Presence of an impenetrable outer membrane",
            "C": "Ability to cleave \u03b2-lactam rings",
            "D": "Development of efflux pumps",
            "E": "Adaptation in binding proteins"
        },
        "response": {
            "0.0": "Let's analyze the situation step by step.\n\nThe patient has developed a postoperative infection characterized by fever, purulent discharge, and the presence of gram-positive cocci in clusters. The organism is likely Staphylococcus aureus, which is known to cause such infections. The treatment with oral dicloxacillin, a penicillinase-resistant penicillin, is appropriate for treating infections caused by Staphylococcus aureus.\n\nHowever, the patient continues to have high-grade fever and purulent discharge despite this treatment, indicating that the antibiotic is not effective. \n\nNow, let's evaluate the options:\n\n- (A) Secretion of a pyrogenic toxin: While some bacteria can secrete toxins that cause fever, this does not explain the failure of the antibiotic treatment.\n  \n- (B) Presence of an impenetrable outer membrane: This is characteristic of gram-negative bacteria, not gram-positive cocci, so it does not apply here.\n\n- (C) Ability to cleave \u03b2-lactam rings: This refers to the production of \u03b2-lactamase enzymes, which can inactivate \u03b2-lactam antibiotics like penicillins. Staphylococcus aureus can produce such enzymes, leading to resistance against dicloxacillin.\n\n- (D) Development of efflux pumps: This mechanism is more common in gram-negative bacteria and is not typically associated with Staphylococcus aureus.\n\n- (E) Adaptation in binding proteins: This could refer to changes in penicillin-binding proteins (PBPs) that confer resistance, but it is less common than \u03b2-lactamase production in Staphylococcus aureus.\n\nGiven the context of the infection and the antibiotic used, the most likely explanation for the failure to improve with dicloxacillin is (C) Ability to cleave \u03b2-lactam rings, as this indicates the presence of \u03b2-lactamase, which would render the antibiotic ineffective.\n\n**Answer: (C) Ability to cleave \u03b2-lactam rings**"
        },
        "api_calls": 4
    },
    {
        "question": "A 59-year-old man is brought to the emergency department with a history of black, tarry stools but denies vomiting of blood or abdominal pain. His family has noticed progressive confusion. History is significant for liver cirrhosis and alcoholism. His heart rate is 112/min, temperature is 37.1\u00b0C (98.7\u00b0F), and blood pressure is 110/70 mm Hg. On examination, he is jaundiced, lethargic, is oriented to person and place but not date, and has moderate ascites. Neurological examination reveals asterixis, and his stool is guaiac-positive. Liver function test are shown below:\nTotal albumin 2 g/dL\nProthrombin time 9 seconds\nTotal bilirubin 5 mg/dL\nAlanine aminotransferase (ALT) 100 U/L\nAspartate aminotransferase (AST) 220 U/L\nWhich of the following is a feature of this patient condition? Options: (B) Ammonia level is the best initial test to confirm the diagnosis (E) Electroencephalography (EEG) usually shows focal localising abnormality (D) It only occurs in patients with cirrhosis (C) It is a diagnosis of exclusion (A) It carries a good prognosis",
        "label": "C",
        "answer": "It is a diagnosis of exclusion",
        "options": {
            "A": "It carries a good prognosis",
            "B": "Ammonia level is the best initial test to confirm the diagnosis",
            "C": "It is a diagnosis of exclusion",
            "D": "It only occurs in patients with cirrhosis",
            "E": "Electroencephalography (EEG) usually shows focal localising abnormality"
        },
        "response": {
            "0.0": "Let's analyze the case step by step. The patient has a history of liver cirrhosis and alcoholism, presents with confusion, asterixis, and guaiac-positive stools, indicating possible gastrointestinal bleeding. The symptoms and findings suggest hepatic encephalopathy, which is a complication of liver disease.\n\nNow, let's evaluate the options:\n\n(A) It carries a good prognosis - This is incorrect. Hepatic encephalopathy can have a variable prognosis depending on the underlying liver function and the presence of precipitating factors.\n\n(B) Ammonia level is the best initial test to confirm the diagnosis - While elevated ammonia levels can be associated with hepatic encephalopathy, they are not the best initial test for diagnosis, as ammonia levels can be normal in some cases.\n\n(C) It is a diagnosis of exclusion - This is partially true, as other causes of confusion should be ruled out, but it is not the best answer in this context.\n\n(D) It only occurs in patients with cirrhosis - This is incorrect. Hepatic encephalopathy can occur in patients with acute liver failure or other liver dysfunctions, not just cirrhosis.\n\n(E) Electroencephalography (EEG) usually shows focal localizing abnormality - This is incorrect. EEG in hepatic encephalopathy typically shows generalized slowing rather than focal abnormalities.\n\nGiven the analysis, the best answer is (C) It is a diagnosis of exclusion, as hepatic encephalopathy is often diagnosed after ruling out other potential causes of altered mental status. \n\nAnswer: (C) It is a diagnosis of exclusion."
        },
        "api_calls": 4
    },
    {
        "question": "A 30-year-old man presents to his primary care physician with complaints of excessive fatigue and weakness for the last several weeks. He also complains of abdominal pain and constipation for the same duration. On further questioning, he reports that he has lost 8 pounds in the last 2 weeks. Past medical history and family history are insignificant. His temperature is 37.3\u00b0 C (99.2\u00b0 F), respirations are 21/min, pulse is 63/min, and blood pressure is 99/70 mm Hg. On physical examination, he is a tired-appearing, thin male. He has a bronze discoloration to his skin, but he denies being outside in the sun or any history of laying in tanning beds. What is the next best step in the management of this patient? Options: (B) Administer intravenous fludrocortisone (E) Order an ACTH stimulation test (D) Start him on both hydrocortisone and fludrocortisone therapy (C) Start him on androgen replacement treatment (A) Administer intravenous hydrocortisone",
        "label": "D",
        "answer": "Start him on both hydrocortisone and fludrocortisone therapy",
        "options": {
            "A": "Administer intravenous hydrocortisone",
            "B": "Administer intravenous fludrocortisone",
            "C": "Start him on androgen replacement treatment",
            "D": "Start him on both hydrocortisone and fludrocortisone therapy",
            "E": "Order an ACTH stimulation test"
        },
        "response": {
            "0.0": "Let's analyze the case step by step. \n\nThe patient is a 30-year-old man presenting with excessive fatigue, weakness, abdominal pain, constipation, and significant weight loss. He also has a notable bronze discoloration of the skin, which is characteristic of hemochromatosis or adrenal insufficiency (Addison's disease). The low blood pressure and bradycardia (pulse of 63/min) could suggest adrenal insufficiency as well.\n\nGiven the symptoms and the physical exam findings, this patient likely has primary adrenal insufficiency (Addison's disease), which can present with fatigue, weight loss, abdominal pain, and hyperpigmentation of the skin due to increased ACTH levels.\n\nIn cases of suspected adrenal crisis or significant adrenal insufficiency, the immediate management is to administer intravenous hydrocortisone to provide the necessary glucocorticoids.\n\nTherefore, the next best step in the management of this patient is:\n\n**Answer: (A) Administer intravenous hydrocortisone.**"
        },
        "api_calls": 4
    },
    {
        "question": "A 58-year-old white man with hypertension and type 2 diabetes mellitus comes to the physician because of a 3-month history of a painless lesion on his lower lip. He has smoked one pack of cigarettes daily for 20 years. He has worked as a fruit picker for the past 25 years. His current medications include captopril and metformin. Examination of the oral cavity shows a single ulcer near the vermillion border. Which of the following is the most likely diagnosis? Options: (B) Herpes labialis (A) Squamous cell carcinoma (C) Aphthous stomatitis (E) Traumatic ulcer (D) Actinic keratosis",
        "label": "A",
        "answer": "Squamous cell carcinoma",
        "options": {
            "A": "Squamous cell carcinoma",
            "B": "Herpes labialis",
            "C": "Aphthous stomatitis",
            "D": "Actinic keratosis",
            "E": "Traumatic ulcer"
        },
        "response": {
            "0.0": "Let's analyze the information step by step.\n\n1. **Patient Profile**: The patient is a 58-year-old man with a history of hypertension and type 2 diabetes mellitus. He is a smoker and has worked as a fruit picker, which may expose him to sun and other environmental factors.\n\n2. **Symptoms**: He presents with a painless lesion on his lower lip that has been present for 3 months. The lesion is described as a single ulcer near the vermillion border.\n\n3. **Differential Diagnosis**:\n   - **Herpes labialis (B)**: Typically presents as painful vesicular lesions, not usually as a single painless ulcer.\n   - **Squamous cell carcinoma (A)**: Commonly presents as a non-healing ulcer or lesion, especially in smokers and those with sun exposure. The location and characteristics fit this diagnosis.\n   - **Aphthous stomatitis (C)**: Usually presents as painful ulcers and is not typically found on the vermillion border.\n   - **Traumatic ulcer (E)**: Would usually have a history of trauma or irritation, and these are often painful.\n   - **Actinic keratosis (D)**: Typically presents as a scaly patch rather than an ulcer, and while it can occur on sun-exposed areas, it does not fit the description of a single ulcer.\n\n4. **Conclusion**: Given the patient's age, smoking history, and the characteristics of the lesion (painless, persistent for 3 months, located on the lip), the most likely diagnosis is **squamous cell carcinoma**.\n\nAnswer: (A) Squamous cell carcinoma"
        },
        "api_calls": 4
    },
    {
        "question": "A 46-year-old woman comes to the physician because of severe muscle and joint pain for 5 months. The pain varies in location and intensity. She also has joint stiffness in the morning and reports fatigue throughout the day that she attributes to not sleeping well. She reports a tingling sensation in her lower limbs. Her bowel habits are unchanged but she often feels bloated. She has primary hypertension and occasional migraine headaches. She does not smoke or consume alcohol. Her medications include propranolol and sumatriptan. She appears healthy. Examination shows symmetric muscular tenderness at the base of the neck, over the shoulders, and in the lumbosacral area. Strength and deep tendon reflexes are normal. Laboratory studies show:\nHemoglobin 14.3 g/dL\nLeukocyte count 9300/mm3\nPlatelet count 230,000/mm3\nMean corpuscular volume 85 \u03bcm3\nErythrocyte sedimentation rate 12 mm/h\nSerum\nGlucose 92 mg/dL\nCreatinine 0.6 mg/dL\nTSH 3.1 \u03bcU/mL\nUrinalysis is within normal limits. Which of the following is the most appropriate therapy for this patient?\" Options: (D) Amitriptyline (B) Temazepam (E) Methotrexate\n\" (C) Vitamin B12 (A) Bupropion",
        "label": "D",
        "answer": "Amitriptyline",
        "options": {
            "A": "Bupropion",
            "B": "Temazepam",
            "C": "Vitamin B12",
            "D": "Amitriptyline",
            "E": "Methotrexate\n\""
        },
        "response": {
            "0.0": "Let's analyze the case step by step.\n\nThe patient is a 46-year-old woman presenting with severe muscle and joint pain, joint stiffness, fatigue, and tingling sensations in her lower limbs. The symptoms have been ongoing for 5 months, and she has a normal examination with symmetric muscular tenderness but normal strength and deep tendon reflexes. The laboratory results show normal blood counts, normal ESR, and normal metabolic panel, which suggests that there is no significant inflammatory or hematological disorder.\n\nGiven her symptoms, particularly the muscle and joint pain, along with the fatigue and tingling sensations, this presentation is suggestive of fibromyalgia. Fibromyalgia is characterized by widespread musculoskeletal pain, fatigue, and often associated with sleep disturbances and mood disorders.\n\nThe treatment options provided include:\n\n- (D) Amitriptyline: This is a tricyclic antidepressant that is often used to help manage fibromyalgia symptoms, particularly pain and sleep disturbances.\n- (B) Temazepam: This is a benzodiazepine used for sleep disorders but is not typically a first-line treatment for fibromyalgia.\n- (E) Methotrexate: This is used for inflammatory conditions like rheumatoid arthritis but is not indicated for fibromyalgia.\n- (C) Vitamin B12: This is not a treatment for fibromyalgia.\n- (A) Bupropion: This is an antidepressant that is not typically used for fibromyalgia.\n\nConsidering the most appropriate therapy for fibromyalgia, the best choice is:\n\n**Answer: (D) Amitriptyline**"
        },
        "api_calls": 4
    },
    {
        "question": "A 40-year-old businessman who was previously well is brought into the emergency department by his assistant with a complaint of left-sided weakness after a chiropractic neck manipulation. He has never felt like this before. Past medical history is insignificant. His blood pressure is 125/75 mm Hg, pulse 86/min, respiratory rate 13/min, temperature 36.8\u00b0C (98.2\u00b0F). A T2-weighted MRI shows a left C5 hemicord lesion. The patient is treated with cervical immobilization, a course of steroids, and physical therapy. What other finding will most likely be seen in this patient? Options: (D) Right-sided analgesia (E) Contralateral loss of vibration and proprioception (C) Contralateral corticospinal tract involvement (A) Spastic paralysis at the level of lesion (B) Right-sided Horner's syndrome",
        "label": "D",
        "answer": "Right-sided analgesia",
        "options": {
            "A": "Spastic paralysis at the level of lesion",
            "B": "Right-sided Horner's syndrome",
            "C": "Contralateral corticospinal tract involvement",
            "D": "Right-sided analgesia",
            "E": "Contralateral loss of vibration and proprioception"
        },
        "response": {
            "0.0": "Let's analyze the case step by step. The patient has a left C5 hemicord lesion, which suggests a Brown-S\u00e9quard syndrome, characterized by hemisection of the spinal cord. \n\n1. **Left-sided weakness**: This indicates involvement of the corticospinal tract on the left side, leading to motor deficits on the same side as the lesion.\n2. **Sensory findings**: In Brown-S\u00e9quard syndrome, there is typically:\n   - Ipsilateral loss of motor function (due to corticospinal tract involvement).\n   - Ipsilateral loss of proprioception and vibration sense (due to dorsal column involvement).\n   - Contralateral loss of pain and temperature sensation (due to spinothalamic tract involvement).\n\nGiven these points, the most likely additional finding in this patient would be:\n\n- **Contralateral loss of pain and temperature sensation** (which corresponds to the loss of analgesia on the right side due to the crossing of the spinothalamic tract fibers).\n\nThus, the correct answer is:\n\n**(D) Right-sided analgesia**."
        },
        "api_calls": 4
    },
    {
        "question": "A 29-year-old man is brought to the emergency department by a concerned neighbor. The patient appears disheveled, has a flat affect, and appears to be having auditory hallucinations. He is alert and oriented to time, person, and place and has an intact long-term and short-term memory. His neighbor says that he never really knew the patient that well and that he mostly kept to himself. They have been neighbors for the past 3 years at an apartment close to the hospital. What worried the neighbor was a sudden change in the patient's behavior which started last week. He suddenly seemed interested in attending all the local council meetings and social gatherings. He is very talkative at these events and boasts highly of himself and starts suggesting changes that the committee could make with his help. He gets very agitated when they deny accepting his suggestions. Which of the following is a predictor of good prognosis for this patient's condition? Options: (D) Male sex (E) Negative symptoms (C) Being single (A) Affective symptoms (B) Slow onset",
        "label": "A",
        "answer": "Affective symptoms",
        "options": {
            "A": "Affective symptoms",
            "B": "Slow onset",
            "C": "Being single",
            "D": "Male sex",
            "E": "Negative symptoms"
        },
        "response": {
            "0.0": "Let's analyze the question step by step. The patient is exhibiting symptoms consistent with a manic episode, possibly indicative of bipolar disorder or a similar mood disorder. The key points to consider for prognosis in such conditions include the nature of the symptoms, the duration of the episode, and the patient's background.\n\n1. **Male sex (D)**: Generally, sex does not significantly influence the prognosis of mood disorders.\n2. **Negative symptoms (E)**: Negative symptoms (such as flat affect, lack of motivation) are often associated with poorer prognosis in psychotic disorders.\n3. **Being single (C)**: Being single can sometimes correlate with poorer social support, which may negatively impact prognosis.\n4. **Affective symptoms (A)**: The presence of affective symptoms (such as mood disturbances) can indicate a better prognosis, especially if they are prominent in the clinical picture.\n5. **Slow onset (B)**: A slow onset of symptoms is often associated with a poorer prognosis in mood disorders.\n\nGiven these considerations, the presence of **affective symptoms (A)** is generally associated with a better prognosis in mood disorders, as it suggests that the mood component is significant and may respond well to treatment.\n\nTherefore, the answer is: **(A) Affective symptoms**."
        },
        "api_calls": 4
    },
    {
        "question": "A 26-year-old man with no significant past medical history presents to the ED following a motor vehicle accident. Vital signs on presentation are T 99.0 F, BP 100/60 mmHg, HR 125 bpm, RR 16/min, SpO2 98% on room air. He complains of extreme abdominal pain worse in the left upper quadrant which has worsened over the past 30 minutes. Exam demonstrates abdominal wall rigidity, involuntary guarding, and tenderness on light percussion. Bedside sonography shows evidence for hemoperitoneum. Despite administering more intravenous fluids, repeat vitals are T 98.9 F, BP 82/50 mm hg, HR 180 bpm, RR 20/min, SpO2 97% on room air. Which of the following is the best next step? Options: (C) Morphine (B) CT abdomen and pelvis (E) Exploratory laparotomy (A) Normal saline bolus and re-evaluation of hemodynamics after infusion (D) Abdominal plain film",
        "label": "E",
        "answer": "Exploratory laparotomy",
        "options": {
            "A": "Normal saline bolus and re-evaluation of hemodynamics after infusion",
            "B": "CT abdomen and pelvis",
            "C": "Morphine",
            "D": "Abdominal plain film",
            "E": "Exploratory laparotomy"
        },
        "response": {
            "0.0": "Let's analyze the situation step by step. \n\nThe patient is a 26-year-old man who has been involved in a motor vehicle accident and presents with signs of significant abdominal trauma. His vital signs indicate hypotension (BP 82/50 mmHg) and tachycardia (HR 180 bpm), which suggest he is likely in shock. The physical exam findings of abdominal wall rigidity, involuntary guarding, and tenderness indicate possible peritonitis, and the bedside sonography shows hemoperitoneum, which is concerning for intra-abdominal bleeding.\n\nGiven the patient's unstable vital signs and the evidence of hemoperitoneum, the best next step in management is to address the potential source of bleeding and the need for surgical intervention. While fluid resuscitation is important, the patient's ongoing hypotension despite fluid administration indicates that he may require surgical intervention rather than further conservative management.\n\nTherefore, the best next step is:\n\n**Answer: (E) Exploratory laparotomy** \n\nThis is necessary to evaluate and manage the source of the bleeding and any potential intra-abdominal injuries."
        },
        "api_calls": 4
    },
    {
        "question": "A 56-year-old man presents to the clinic complaining of subacute back pain for the past month. The pain is described as a dull, constant ache that is worse at night. He could not recall any precipitating event except for an amateur weight-lifting competition that he participated in 2 months ago. Past medical history is significant for non-small cell lung cancer that was diagnosed and successfully treated. A PET scan 1 year ago demonstrated no recurrence. Physical exam was unremarkable except for some point tenderness along the lumbosacral area. What is the most likely imaging finding in this patient? Options: (C) Lytic lesions of the lumbar spine (A) Blastic lesions of the lumbar spine (D) Narrowing of the lumbar disc space (E) Sacroilitis and fusion of the lumbar spine (B) Bulging disc impinging on lumbar spinal nerve",
        "label": "C",
        "answer": "Lytic lesions of the lumbar spine",
        "options": {
            "A": "Blastic lesions of the lumbar spine",
            "B": "Bulging disc impinging on lumbar spinal nerve",
            "C": "Lytic lesions of the lumbar spine",
            "D": "Narrowing of the lumbar disc space",
            "E": "Sacroilitis and fusion of the lumbar spine"
        },
        "response": {
            "0.0": "Let's analyze the case step by step.\n\n1. **Patient Background**: The patient is a 56-year-old man with a history of non-small cell lung cancer that was treated successfully. He presents with subacute back pain that is worse at night and has point tenderness in the lumbosacral area.\n\n2. **Pain Characteristics**: The pain is described as a dull, constant ache, which raises suspicion for a more serious underlying condition, especially given the history of cancer.\n\n3. **Possible Causes of Back Pain**: In a patient with a history of cancer, back pain can be due to metastatic disease, which is a common complication. The nature of the pain (worse at night) and the point tenderness suggest a possible involvement of the spine.\n\n4. **Imaging Findings**: \n   - **Lytic lesions** (C) are often associated with metastatic disease, particularly from cancers like lung cancer, which commonly metastasizes to the bones.\n   - **Blastic lesions** (A) are more typical of prostate cancer or other cancers that cause increased bone density.\n   - **Narrowing of the lumbar disc space** (D) and **bulging disc** (B) are more indicative of degenerative disc disease or herniated discs, which are less likely given the patient's cancer history and the nature of the pain.\n   - **Sacroilitis and fusion of the lumbar spine** (E) are associated with inflammatory conditions like ankylosing spondylitis, which is less likely in this context.\n\nGiven the patient's history of lung cancer and the characteristics of his back pain, the most likely imaging finding would be:\n\n**Answer: (C) Lytic lesions of the lumbar spine.** \n\nThis is consistent with the possibility of metastatic disease from his previous lung cancer."
        },
        "api_calls": 4
    },
    {
        "question": "A 22-year-old female college student is treated with metronidazole after presenting to student health services with itching, discharge, and pain in her vagina. At a party shortly afterward she experiences facial flushing, nausea, tachycardia, dyspnea, headache, and abdominal cramps after consuming alcohol. Serum levels of which of the following are likely elevated in this patient following alcohol consumption: Options: (A) Acetaldehyde (D) Triglycerides (E) Amylase (B) Uric acid (C) Cytochrome P-450 enzymes",
        "label": "A",
        "answer": "Acetaldehyde",
        "options": {
            "A": "Acetaldehyde",
            "B": "Uric acid",
            "C": "Cytochrome P-450 enzymes",
            "D": "Triglycerides",
            "E": "Amylase"
        },
        "response": {
            "0.0": "Let's analyze the situation step by step. The patient is experiencing a disulfiram-like reaction after consuming alcohol while being treated with metronidazole. This reaction is characterized by symptoms such as facial flushing, nausea, tachycardia, dyspnea, headache, and abdominal cramps.\n\nThe mechanism behind this reaction involves the inhibition of aldehyde dehydrogenase, an enzyme responsible for metabolizing acetaldehyde, a byproduct of alcohol metabolism. When alcohol is consumed, acetaldehyde accumulates in the body, leading to the symptoms described.\n\nGiven this information, the serum levels of which substance are likely elevated in this patient following alcohol consumption?\n\nThe correct answer is:\n(A) Acetaldehyde\n\nThis is because the disulfiram-like reaction leads to an accumulation of acetaldehyde due to the inhibition of its metabolism."
        },
        "api_calls": 4
    },
    {
        "question": "A stillborn infant is delivered at 38 weeks' gestation to a 32-year-old woman. The mother had no prenatal care. Examination of the stillborn shows a small pelvis, shallow intergluteal cleft, and club feet. An x-ray shows the absence of the sacrum and lumbar vertebrae. Which of the following is the strongest predisposing factor for this patient's condition? Options: (C) Chromosome 13 trisomy (B) Intrauterine alcohol exposure (D) Maternal diabetes (E) Chromosome 18 trisomy (A) Maternal oligohydramnios",
        "label": "D",
        "answer": "Maternal diabetes",
        "options": {
            "A": "Maternal oligohydramnios",
            "B": "Intrauterine alcohol exposure",
            "C": "Chromosome 13 trisomy",
            "D": "Maternal diabetes",
            "E": "Chromosome 18 trisomy"
        },
        "response": {
            "0.0": "Let's analyze the information provided step by step.\n\nThe stillborn infant exhibits several significant physical findings: a small pelvis, shallow intergluteal cleft, club feet, and an x-ray showing the absence of the sacrum and lumbar vertebrae. These findings are suggestive of a condition known as caudal regression syndrome or sacral agenesis, which is often associated with maternal factors.\n\nNow, let's evaluate the options:\n\n(A) Maternal oligohydramnios - This condition can lead to fetal deformities due to compression (part of Potter's sequence), but it is not the strongest predisposing factor for the specific findings described.\n\n(B) Intrauterine alcohol exposure - This is known to cause a range of fetal abnormalities, including growth restriction and facial dysmorphisms, but it is not specifically linked to the skeletal abnormalities seen here.\n\n(C) Chromosome 13 trisomy - This is associated with Patau syndrome, which has its own set of anomalies but does not specifically correlate with the findings described.\n\n(D) Maternal diabetes - This condition is known to be associated with various fetal anomalies, including caudal regression syndrome, particularly in cases of poorly controlled diabetes.\n\n(E) Chromosome 18 trisomy - This is associated with Edwards syndrome, which has its own set of anomalies but does not specifically correlate with the findings described.\n\nGiven the findings of the stillborn infant and the known associations, the strongest predisposing factor for this patient's condition is:\n\n**Answer: (D) Maternal diabetes**"
        },
        "api_calls": 4
    },
    {
        "question": "A 52-year-old man is brought to the emergency department for recurrent vomiting that began 5 hours ago. He describes the vomitus as bloody and containing black specks. He drinks 10\u201312 beers daily and has not seen a physician in 15 years. He appears pale. His temperature is 36.7\u00b0C (98.1\u00b0F), pulse is 122/min, and blood pressure is 85/59 mm Hg. Physical examination shows decreased radial pulses, delayed capillary refill, multiple spider angiomata, and a distended abdomen. He is oriented to person but not to place or time. Which of the following is most likely decreased in this patient in response to his current condition compared to a healthy adult? Options: (D) Pulmonary vascular resistance (C) Carotid baroreceptor firing activity (E) Cardiac inotropy (A) Systemic vascular resistance (B) Fractional tissue oxygen extraction",
        "label": "C",
        "answer": "Carotid baroreceptor firing activity",
        "options": {
            "A": "Systemic vascular resistance",
            "B": "Fractional tissue oxygen extraction",
            "C": "Carotid baroreceptor firing activity",
            "D": "Pulmonary vascular resistance",
            "E": "Cardiac inotropy"
        },
        "response": {
            "0.0": "Let's analyze the situation step by step.\n\nThe patient is presenting with signs of significant volume depletion and possibly shock, indicated by his low blood pressure (85/59 mm Hg), tachycardia (pulse of 122/min), and pale appearance. He has a history of heavy alcohol use, which can lead to liver disease and portal hypertension, contributing to his symptoms.\n\n1. **Pulmonary vascular resistance (D)**: This is unlikely to decrease in this patient, as he is likely experiencing hypovolemia and potential right heart strain.\n\n2. **Carotid baroreceptor firing activity (C)**: In response to low blood pressure, baroreceptors would decrease their firing rate, but this is not what is being asked about in terms of a direct decrease in response to his condition.\n\n3. **Cardiac inotropy (E)**: While cardiac contractility may be affected, the question asks for something that is most likely decreased in response to his current condition.\n\n4. **Systemic vascular resistance (A)**: In a state of shock, systemic vascular resistance typically increases as the body attempts to maintain blood pressure.\n\n5. **Fractional tissue oxygen extraction (B)**: In a state of shock, tissues may extract more oxygen due to decreased perfusion, so this is also unlikely to be decreased.\n\nGiven the context of the patient's condition, the most likely option that would be decreased in response to his current state of shock is **(C) Carotid baroreceptor firing activity**. This is because the low blood pressure would lead to decreased firing of the baroreceptors, which is a compensatory response to maintain blood pressure.\n\nTherefore, the answer is: **(C) Carotid baroreceptor firing activity**."
        },
        "api_calls": 4
    },
    {
        "question": "A 14-year-old boy presents with right upper quadrant abdominal pain and is found on ultrasound to have a gallstone. Based on clinical suspicion, a CBC, a Coombs test, and a bilirubin panel are obtained to determine the etiology of the gallstone. These tests reveal a mild normocytic anemia with associated reticulocytosis as well as an increased RDW. In addition there is an indirect hyperbilirubinemia and the Coombs test results are negative. To confirm the diagnosis, an osmotic fragility test is performed which shows increased fragility in hypotonic solution. In this patient, what findings would most likely be anticipated if a blood smear were obtained? Options: (C) Sideroblasts (D) Spherocytes (E) Dacrocytes (A) Hypersegmented neutrophils (B) Schistocytes",
        "label": "D",
        "answer": "Spherocytes",
        "options": {
            "A": "Hypersegmented neutrophils",
            "B": "Schistocytes",
            "C": "Sideroblasts",
            "D": "Spherocytes",
            "E": "Dacrocytes"
        },
        "response": {
            "0.0": "Let's analyze the information step by step.\n\nThe patient is a 14-year-old boy with right upper quadrant abdominal pain and gallstones. The laboratory findings indicate:\n\n- Mild normocytic anemia with reticulocytosis\n- Increased RDW (red cell distribution width)\n- Indirect hyperbilirubinemia\n- Negative Coombs test\n- Increased fragility in hypotonic solution on osmotic fragility test\n\nThese findings suggest a hemolytic anemia, specifically hereditary spherocytosis, which is characterized by the presence of spherocytes due to the membrane defect in red blood cells. The increased fragility in hypotonic solutions supports this diagnosis.\n\nNow, considering the options provided for what would be seen on a blood smear:\n\n- (C) Sideroblasts: Typically seen in sideroblastic anemia, not related to this case.\n- (D) Spherocytes: These are the expected findings in hereditary spherocytosis.\n- (E) Dacrocytes: These are teardrop cells, often seen in myelofibrosis or other conditions, not typical for this case.\n- (A) Hypersegmented neutrophils: Associated with megaloblastic anemia, not relevant here.\n- (B) Schistocytes: These are fragmented red blood cells seen in microangiopathic hemolytic anemia, not consistent with the osmotic fragility test results.\n\nGiven the context and the findings, the most likely anticipated finding on a blood smear would be:\n\n**Answer: (D) Spherocytes**"
        },
        "api_calls": 4
    },
    {
        "question": "A 34-year-old woman presents to the plastic surgery office 3 months following a rhinoplasty procedure. The patient has been recovering well. However, she has noticed a small whistling noise when she respires through her nose, which you appreciate on physical exam. Which of the following is the most likely cause of this phenomenon? Options: (D) Excessive columellar show resulting in increased nasal airflow (A) Post-operative swelling (E) A fracture of the bony septum (C) A deviated septum that is now straight, resulting in altered nasal airflow (B) A septal hematoma causing a perforation",
        "label": "B",
        "answer": "A septal hematoma causing a perforation",
        "options": {
            "A": "Post-operative swelling",
            "B": "A septal hematoma causing a perforation",
            "C": "A deviated septum that is now straight, resulting in altered nasal airflow",
            "D": "Excessive columellar show resulting in increased nasal airflow",
            "E": "A fracture of the bony septum"
        },
        "response": {
            "0.0": "Let's analyze the situation step by step. The patient is experiencing a whistling noise when breathing through her nose three months after rhinoplasty. This symptom suggests that there is an abnormal airflow pattern through the nasal passages.\n\n1. **Post-operative swelling (A)**: While swelling can affect airflow, it typically resolves within weeks after surgery, and three months post-op would likely not result in a whistling noise.\n\n2. **Excessive columellar show (D)**: This refers to the visibility of the columella (the tissue between the nostrils) and is unlikely to cause a whistling noise.\n\n3. **Fracture of the bony septum (E)**: A fracture could potentially cause nasal obstruction, but it would not typically lead to a whistling sound.\n\n4. **Deviated septum that is now straight (C)**: If the septum was previously deviated and is now straightened, it could alter airflow dynamics, but it would not typically cause a whistling noise unless there was a significant change in airflow patterns.\n\n5. **Septal hematoma causing a perforation (B)**: A septal hematoma can lead to a perforation in the septum, which can create an abnormal airflow pattern and result in a whistling sound when breathing.\n\nGiven the context of the question and the options provided, the most likely cause of the whistling noise in this patient is:\n\n**Answer: (B) A septal hematoma causing a perforation.**"
        },
        "api_calls": 4
    },
    {
        "question": "Background:\nSome patients with severe asthma have frequent exacerbations associated with persistent eosinophilic inflammation despite continuous treatment with high-dose inhaled glucocorticoids with or without oral glucocorticoids.\nMethods:\nIn this randomized, double-blind clinical trial we assigned 576 patients with recurrent asthma exacerbations and evidence of eosinophilic inflammation despite high doses of inhaled glucocorticoids to one of three study groups. Patients were assigned to receive mepolizumab, a humanized monoclonal antibody against interleukin-5, which was administered as either a 75-mg intravenous dose or a 100-mg subcutaneous dose or placebo every 4 weeks for 32 weeks. The primary outcome was the rate of exacerbations. Other outcomes included the forced expiratory volume in 1 second (FEV1) and scores on the St. George\u2019s Respiratory Questionnaire (SGRQ) and the 5-item Asthma Control Questionnaire (ACQ-5).\nResults:\nThe rate of exacerbations was reduced by 47% (95% confidence interval [CI], 29 to 61) among patients receiving intravenous mepolizumab and by 53% (95% CI, 37 to 65) among those receiving subcutaneous mepolizumab, as compared with those receiving placebo (p<0.001 for both comparisons). Exacerbations necessitating an emergency department visit or hospitalization were reduced by 32% in the group receiving intravenous mepolizumab and by 61% in the group receiving subcutaneous mepolizumab. At week 32, the mean increase from baseline in FEV1 was 100 ml greater in patients receiving intravenous mepolizumab than in those receiving placebo (p=0.02) and 98 ml greater in patients receiving subcutaneous mepolizumab than in those receiving placebo (p=0.03). The improvement from baseline in the SGRQ score was 6.4 points and 7.0 points greater in the intravenous and subcutaneous mepolizumab groups, respectively than in the placebo group, and the improvement in the ACQ-5 score was 0.42 points and 0.44 points greater in the two mepolizumab groups, respectively than in the placebo group (p<0.001 for all comparisons).\nConclusions:\nMepolizumab administered either intravenously or subcutaneously significantly reduced asthma exacerbations and was associated with improvements in markers of asthma control.\nGiven the original research abstract above, which of the following would be true if the authors had inadvertently encountered a type 1 error? Options: (B) A type 1 error occurs when the null hypothesis is true but is rejected in error. (E) A type 1 error is dependent on the confidence interval of a study. (C) A type 1 error occurs when the null hypothesis is false, yet is accepted in error. (A) A type 1 error means the study is not significantly powered to detect a true difference between study groups. (D) A type 1 error is a beta (\u03b2) error and is usually 0.1 or 0.2.",
        "label": "B",
        "answer": "A type 1 error occurs when the null hypothesis is true but is rejected in error.",
        "options": {
            "A": "A type 1 error means the study is not significantly powered to detect a true difference between study groups.",
            "B": "A type 1 error occurs when the null hypothesis is true but is rejected in error.",
            "C": "A type 1 error occurs when the null hypothesis is false, yet is accepted in error.",
            "D": "A type 1 error is a beta (\u03b2) error and is usually 0.1 or 0.2.",
            "E": "A type 1 error is dependent on the confidence interval of a study."
        },
        "response": {
            "0.0": "Let's analyze the options step by step.\n\nA type 1 error occurs when the null hypothesis is true, but the researchers incorrectly reject it, concluding that there is a significant effect or difference when there is none. \n\nNow, let's evaluate the options:\n\n(A) A type 1 error means the study is not significantly powered to detect a true difference between study groups.  \n- This statement is incorrect. A type 1 error is not related to the power of the study; it is about incorrectly rejecting a true null hypothesis.\n\n(B) A type 1 error occurs when the null hypothesis is true but is rejected in error.  \n- This statement is correct. It accurately describes a type 1 error.\n\n(C) A type 1 error occurs when the null hypothesis is false, yet is accepted in error.  \n- This statement describes a type 2 error, not a type 1 error.\n\n(D) A type 1 error is a beta (\u03b2) error and is usually 0.1 or 0.2.  \n- This statement is incorrect. A type 1 error is denoted by alpha (\u03b1), not beta (\u03b2). Beta errors relate to type 2 errors.\n\n(E) A type 1 error is dependent on the confidence interval of a study.  \n- This statement is somewhat misleading. While the confidence interval is related to the significance level (alpha), a type 1 error itself is not directly dependent on the confidence interval.\n\nBased on this analysis, the correct answer is:\n\n**Answer: (B) A type 1 error occurs when the null hypothesis is true but is rejected in error.**"
        },
        "api_calls": 4
    },
    {
        "question": "A 61-year-old man with schizophrenia in a locked inpatient psychiatry unit was observed making an unusual smacking motion with his lips, pursing his mouth, and blinking excessively. These symptoms started slowly about 2 weeks ago and have become more pronounced, but they do not seem to bother the patient. He resides in an inpatient psychiatric facility where he has been successfully treated with haloperidol for the past several months. His physical exam and vitals are within normal limits. Which of the following accurately describes his symptoms? Options: (B) Tardive dyskinesia (D) Pseudoparkinsonism (A) Akathisia (E) Palsy (C) Acute dystonia",
        "label": "B",
        "answer": "Tardive dyskinesia",
        "options": {
            "A": "Akathisia",
            "B": "Tardive dyskinesia",
            "C": "Acute dystonia",
            "D": "Pseudoparkinsonism",
            "E": "Palsy"
        },
        "response": {
            "0.0": "Let's analyze the symptoms presented by the patient step by step. \n\nThe patient is exhibiting:\n- Unusual smacking motion with his lips\n- Pursing of the mouth\n- Excessive blinking\n- Symptoms that started slowly about 2 weeks ago and have become more pronounced\n- Symptoms that do not seem to bother the patient\n\nThese symptoms are characteristic of tardive dyskinesia, which is a movement disorder that can occur after prolonged use of antipsychotic medications, such as haloperidol. Tardive dyskinesia is characterized by involuntary, repetitive movements, often involving the face and mouth, and can develop after weeks to months of treatment.\n\nGiven this information, the most accurate description of his symptoms is:\n\nAnswer: (B) Tardive dyskinesia"
        },
        "api_calls": 4
    },
    {
        "question": "A 21-month-old boy is brought to the physician for a well-child examination. His mother noticed deformities in both of his legs since he started walking independently. He has been healthy apart from an upper respiratory tract infection 6 months ago. He was delivered at 38 weeks' gestation. His 6-year-old sister was treated for developmental dysplasia of the hip. He can kick a ball and say a 2-word phrase. He plays well with other children at his day care. His immunizations are up-to-date. He is at the 40th percentile for height and 50th percentile for weight. Vital signs are within normal limits. Examination shows closed anterior and posterior fontanelles. The knees do not stay together when both the feet and ankles are placed together. The gait is unremarkable. The mother is concerned that he has a growth disorder. Which of the following is the most appropriate next step in management? Options: (B) Reassurance and follow-up (C) X-ray of the lower extremities (D) Bracing of the lower extremities (A) Vitamin D supplementation (E) Tibial osteotomy",
        "label": "B",
        "answer": "Reassurance and follow-up",
        "options": {
            "A": "Vitamin D supplementation",
            "B": "Reassurance and follow-up",
            "C": "X-ray of the lower extremities",
            "D": "Bracing of the lower extremities",
            "E": "Tibial osteotomy"
        },
        "response": {
            "0.0": "Let's analyze the situation step by step. The 21-month-old boy has deformities in both legs that have been noticed since he started walking. The examination reveals that the knees do not stay together when the feet and ankles are placed together, which suggests a possible issue with the alignment of the legs, such as bowing (genu varum) or other developmental concerns.\n\nGiven that he is otherwise healthy, has normal developmental milestones, and his growth parameters are within normal limits, the most appropriate next step in management would be to assess the nature of the leg deformities further. \n\nIn this case, an X-ray of the lower extremities would help determine if there are any underlying skeletal abnormalities or conditions contributing to the leg deformities. \n\nTherefore, the most appropriate next step in management is:\n\n**Answer: (C) X-ray of the lower extremities**"
        },
        "api_calls": 4
    },
    {
        "question": "A 60-year-old female patient with a history of hypertension presents to an outpatient office for regular check-up and is found to have hypertriglyceridemia. Her physician prescribes high-dose niacin and recommends taking the medication along with aspirin. The side effect the physician is trying to avoid is thought to be mediated by what mechanism? Options: (A) Bile deposition in the dermis (B) Immune complex formation (E) T cell activation (D) Mast cell degranulation (C) Release of prostaglandins",
        "label": "C",
        "answer": "Release of prostaglandins",
        "options": {
            "A": "Bile deposition in the dermis",
            "B": "Immune complex formation",
            "C": "Release of prostaglandins",
            "D": "Mast cell degranulation",
            "E": "T cell activation"
        },
        "response": {
            "0.0": "Let's analyze the question step by step.\n\nThe patient is being prescribed high-dose niacin (vitamin B3) for hypertriglyceridemia. One of the common side effects of niacin is flushing, which is often accompanied by itching and a sensation of warmth. This flushing is thought to be mediated by the release of prostaglandins, which are compounds that cause vasodilation and increased blood flow to the skin.\n\nTo prevent this flushing, physicians often recommend taking aspirin before administering niacin, as aspirin can inhibit the cyclooxygenase (COX) enzymes that are responsible for the production of prostaglandins.\n\nNow, let's look at the options provided:\n\n(A) Bile deposition in the dermis - This is not related to niacin's side effects.\n(B) Immune complex formation - This is not relevant to the flushing caused by niacin.\n(C) Release of prostaglandins - This is the correct mechanism related to the flushing side effect of niacin.\n(D) Mast cell degranulation - While mast cells can be involved in allergic reactions, they are not the primary mechanism for niacin flushing.\n(E) T cell activation - This is not related to the flushing caused by niacin.\n\nBased on this analysis, the answer is:\n\n**Answer: (C) Release of prostaglandins**"
        },
        "api_calls": 4
    },
    {
        "question": "A 58-year-old male presents with an acutely elevated blood pressure of 220/140 mmHg. The patient complains of a headache and chest pain, and he has been vomiting for the last several hours. Physical exam demonstrates papilledema and a depressed level of consciousness. To treat this patient's hypertensive emergency, he is started on an IV medication commonly used in this situation. The agent exerts its effect by releasing nitric oxide as a metabolite, which subsequently activates guanylate cyclase and increases production of cGMP in vascular smooth muscle. Which of the following clinical effects would be expected from administration of this medication? Options: (B) Increased left ventricular end-diastolic pressure (A) Decreased cardiac contractility (C) Decreased stroke volume (D) Decreased pulmonary capillary wedge pressure (E) Increased systemic vascular resistance",
        "label": "D",
        "answer": "Decreased pulmonary capillary wedge pressure",
        "options": {
            "A": "Decreased cardiac contractility",
            "B": "Increased left ventricular end-diastolic pressure",
            "C": "Decreased stroke volume",
            "D": "Decreased pulmonary capillary wedge pressure",
            "E": "Increased systemic vascular resistance"
        },
        "response": {
            "0.0": "Let's analyze the situation step by step. The patient is experiencing a hypertensive emergency, and the medication being used is likely nitroglycerin or a similar agent that releases nitric oxide. \n\nNitric oxide causes vasodilation by increasing cGMP in vascular smooth muscle, which leads to a decrease in systemic vascular resistance (SVR) and subsequently lowers blood pressure. \n\nIn this context, the expected clinical effect of administering this medication would be:\n\n- **Decreased pulmonary capillary wedge pressure (PCWP)**: This is because vasodilation reduces the pressure in the pulmonary circulation, which is reflected in the PCWP.\n\nGiven the options provided, the correct answer is:\n\n**(D) Decreased pulmonary capillary wedge pressure**. \n\nThis effect is consistent with the vasodilatory action of the medication used in treating the hypertensive emergency."
        },
        "api_calls": 4
    },
    {
        "question": "A 63-year-old man is aiming to improve his health by eating a well balanced diet, walking daily, and quitting smoking following a 45-year smoking history. While on his daily walks he notices a strong cramping pain in his calves that consistently appears after a mile of walking. He sees his physician and a diagnosis of peripheral artery disease with intermittent claudication is made. To improve his symptoms, cilostazol is prescribed. What is the mechanism of action of this medication? Options: (B) Glycoprotein IIB/IIIA inhibitor (A) Irreversible cyclooxygenase inhibitor (C) Thromboxane synthase inhibitor (E) Phosphodiesterase inhibitor (D) Adenosine diphosphate receptor inhibitor",
        "label": "E",
        "answer": "Phosphodiesterase inhibitor",
        "options": {
            "A": "Irreversible cyclooxygenase inhibitor",
            "B": "Glycoprotein IIB/IIIA inhibitor",
            "C": "Thromboxane synthase inhibitor",
            "D": "Adenosine diphosphate receptor inhibitor",
            "E": "Phosphodiesterase inhibitor"
        },
        "response": {
            "0.0": "Let's analyze the question step by step. \n\nCilostazol is a medication commonly used to treat intermittent claudication in patients with peripheral artery disease. Its primary mechanism of action is as a phosphodiesterase (PDE) inhibitor. By inhibiting phosphodiesterase type 3 (PDE3), cilostazol increases the levels of cyclic adenosine monophosphate (cAMP) in platelets and vascular smooth muscle cells, leading to vasodilation and inhibition of platelet aggregation.\n\nGiven the options provided:\n\n- (B) Glycoprotein IIB/IIIA inhibitor: This is not the mechanism of cilostazol.\n- (A) Irreversible cyclooxygenase inhibitor: This refers to medications like aspirin, not cilostazol.\n- (C) Thromboxane synthase inhibitor: This is not applicable to cilostazol.\n- (E) Phosphodiesterase inhibitor: This is the correct mechanism of action for cilostazol.\n- (D) Adenosine diphosphate receptor inhibitor: This refers to medications like clopidogrel, not cilostazol.\n\nTherefore, the correct answer is:\n\n**Answer: (E) Phosphodiesterase inhibitor**"
        },
        "api_calls": 4
    },
    {
        "question": "A 69-year-old man presents to his primary care physician with hip and back pain. The patient states that this weekend he had a barbecue. When he was lifting a heavy object he suddenly felt pain in his lower back. He describes the pain as in his buttocks but states that at times it travels down his leg. The patient states that it feels, \"electrical.\" The patient has a past medical history of obesity, diabetes, depression, anxiety, diverticulosis, constipation, and a surgical repair of his anterior cruciate ligament. His current medications include metformin, insulin, lisinopril, fluoxetine, and sodium docusate. Which of the following is most likely to help confirm the diagnosis? Options: (B) Flexion, abduction, and external rotation of the thigh (D) Internal rotation of the extended hip (E) Radiography (A) Palpating the paraspinus muscle (C) Straight leg raise",
        "label": "C",
        "answer": "Straight leg raise",
        "options": {
            "A": "Palpating the paraspinus muscle",
            "B": "Flexion, abduction, and external rotation of the thigh",
            "C": "Straight leg raise",
            "D": "Internal rotation of the extended hip",
            "E": "Radiography"
        },
        "response": {
            "0.0": "Let's analyze the case step by step. The patient is a 69-year-old man with hip and back pain, which worsened after lifting a heavy object. He describes the pain as \"electrical\" and radiating down his leg, which suggests possible nerve involvement, likely due to a herniated disc or lumbar radiculopathy.\n\nTo confirm the diagnosis of a lumbar disc herniation or radiculopathy, the **straight leg raise test (C)** is commonly used. This test helps to assess for nerve root irritation or compression, particularly of the L5 or S1 nerve roots, which can cause pain that radiates down the leg.\n\nTherefore, the most likely option to help confirm the diagnosis is:\n\n**Answer: (C) Straight leg raise**"
        },
        "api_calls": 4
    },
    {
        "question": "A 35-year-old woman comes to the physician for genetic counseling prior to conception. Her younger brother has mild developmental delay, pale complexion, and has to limit his dietary intake of phenylalanine. She has no similar symptoms and is in good health. Her parents are healthy. Which of the following is the most appropriate assessment of her carrier status for the disease affecting her brother? Options: (E) 50% (C) 100% (A) 67% (D) 75% (B) 33%",
        "label": "A",
        "answer": "67%",
        "options": {
            "A": "67%",
            "B": "33%",
            "C": "100%",
            "D": "75%",
            "E": "50%"
        },
        "response": {
            "0.0": "To determine the most appropriate assessment of the woman's carrier status for the disease affecting her brother, we need to consider the inheritance pattern of the condition described.\n\nThe symptoms of the brother (mild developmental delay, pale complexion, and dietary restriction of phenylalanine) are suggestive of phenylketonuria (PKU), which is an autosomal recessive disorder. This means that both parents must be carriers of the gene mutation for their child to be affected.\n\n1. The brother is affected, which means he has two copies of the mutated gene (let's denote it as \"a\").\n2. Since both parents are healthy, they must each be carriers (Aa) of the gene, where \"A\" is the normal allele and \"a\" is the mutated allele.\n3. The woman (sister) has no symptoms, so she could either be a carrier (Aa) or not a carrier (AA).\n\nTo assess her carrier status:\n- If both parents are carriers (Aa), the possible genotypes for their children are:\n  - AA (25% chance)\n  - Aa (50% chance - carrier)\n  - aa (25% chance - affected)\n\nSince the brother is affected (aa), we know that both parents are carriers (Aa). Therefore, the woman has a 50% chance of being a carrier (Aa) and a 50% chance of being non-carrier (AA).\n\nThus, the most appropriate assessment of her carrier status is:\n**Answer: (E) 50%**"
        },
        "api_calls": 4
    },
    {
        "question": "A 25-year-old man is brought to the emergency department after being found unconscious. He was at a college party exhibiting belligerent behavior when he suddenly passed out and fell to the ground. His past medical history is not known. His temperature is 100\u00b0F (37.8\u00b0C), blood pressure is 107/48 mmHg, pulse is 125/min, respirations are 19/min, and oxygen saturation is 99% on room air. The patient is covered with emesis and responds incoherently to questions. As the patient begins to wake up he continues vomiting. The patient is started on IV fluids, analgesics, and anti-emetics and begins to feel better. Thirty minutes later the patient presents with muscle rigidity and is no longer responding coherently to questions. His temperature is 103\u00b0F (39.4\u00b0C), blood pressure is 127/68 mmHg, pulse is 125/min, respirations are 18/min, and oxygen saturation is 98% on room air. The patient's basic laboratory studies are drawn and he is started on IV fluids, given lorazepam, and placed under a cooling blanket. Despite these initial measures, his symptoms persist. Which of the following is the best next step in management? Options: (D) Intubation (C) Diazepam (B) Dantrolene (A) Acetaminophen (E) Supportive therapy",
        "label": "B",
        "answer": "Dantrolene",
        "options": {
            "A": "Acetaminophen",
            "B": "Dantrolene",
            "C": "Diazepam",
            "D": "Intubation",
            "E": "Supportive therapy"
        },
        "response": {
            "0.0": "Let's analyze the situation step by step. The patient is presenting with signs of altered mental status, muscle rigidity, hyperthermia, and autonomic instability after being found unconscious. These symptoms are suggestive of a serious condition, likely neuroleptic malignant syndrome (NMS) or serotonin syndrome, especially given the context of a college party where substances may have been involved.\n\nThe key features to note are:\n- Muscle rigidity\n- Hyperthermia (temperature of 103\u00b0F)\n- Altered mental status\n- Autonomic instability (elevated pulse and blood pressure)\n\nGiven that the patient is exhibiting muscle rigidity and hyperthermia, the most appropriate next step in management is to administer dantrolene, which is effective in treating malignant hyperthermia and NMS by reducing muscle rigidity and hyperthermia.\n\nTherefore, the best next step in management is:\n**(B) Dantrolene**"
        },
        "api_calls": 4
    },
    {
        "question": "A 47-year-old executive schedules an appointment his physician for a routine medical check-up. He currently has no complaints and claims to be \u201cas fit as a fiddle.\u201d The physical examination findings are unremarkable, except for a mid-systolic murmur heard in the 2nd left intercostal space that radiates to the carotids on auscultation. The physician instructs the patient to stand from a supine position with the stethoscope still placed on his chest. Which of the following changes would occur with this maneuver? Options: (C) An increase in pulmonary capillary wedge pressure (B) An increase in left ventricular end-diastolic pressure (E) A reduction in diastolic filling time (D) A reduction in the slope of the pacemaker potential (A) An increase in right atrial pressure",
        "label": "E",
        "answer": "A reduction in diastolic filling time",
        "options": {
            "A": "An increase in right atrial pressure",
            "B": "An increase in left ventricular end-diastolic pressure",
            "C": "An increase in pulmonary capillary wedge pressure",
            "D": "A reduction in the slope of the pacemaker potential",
            "E": "A reduction in diastolic filling time"
        },
        "response": {
            "0.0": "Let's analyze the situation step by step.\n\nThe patient has a mid-systolic murmur that radiates to the carotids, which is suggestive of aortic stenosis. When the physician instructs the patient to stand from a supine position, this maneuver typically leads to a decrease in venous return to the heart due to the effects of gravity. \n\n1. **Standing from Supine Position**: When a person stands up, blood pools in the lower extremities, which reduces the amount of blood returning to the heart (preload). This can lead to a decrease in stroke volume and cardiac output temporarily.\n\n2. **Effects on Cardiac Pressures**: \n   - **Right Atrial Pressure**: This would likely decrease due to reduced venous return.\n   - **Left Ventricular End-Diastolic Pressure (LVEDP)**: This would also decrease due to reduced preload.\n   - **Pulmonary Capillary Wedge Pressure (PCWP)**: This would decrease as well, as it reflects left atrial pressure, which is influenced by left ventricular filling.\n   - **Diastolic Filling Time**: This would not necessarily change significantly with standing; however, the heart rate may increase to compensate for the reduced stroke volume, which could reduce diastolic filling time slightly.\n\n3. **Conclusion**: Given the options, the most appropriate answer is that there would be a reduction in left ventricular end-diastolic pressure (B) due to decreased preload from standing.\n\nTherefore, the answer is: **(B) An increase in left ventricular end-diastolic pressure**."
        },
        "api_calls": 4
    },
    {
        "question": "A 39-year-old African-American woman presents to the emergency room with hip pain. She has a past medical history significant for sarcoidosis which was recently diagnosed 6 months ago and is currently being treated. She reports that the pain started 2 weeks ago and is localized to the left hip and groin. The pain has been getting progressively more intense. Her temperature is 98.1\u00b0F (36.7\u00b0C), blood pressure is 122/78 mm Hg, pulse is 80/min, respirations are 13/min, and oxygen saturation is 98% on room air. Physical exam is notable for pain with manipulation without restriction of range of motion of the hip. Which of the following is the most sensitive test for this condition? Options: (E) Ultrasound of the hip (C) Radiograph of the hip (A) CT of the hip (D) Radionuclide scan of the hip (B) MRI of the hip",
        "label": "B",
        "answer": "MRI of the hip",
        "options": {
            "A": "CT of the hip",
            "B": "MRI of the hip",
            "C": "Radiograph of the hip",
            "D": "Radionuclide scan of the hip",
            "E": "Ultrasound of the hip"
        },
        "response": {
            "0.0": "Let's analyze the situation step by step.\n\nThe patient is a 39-year-old African-American woman with a history of sarcoidosis presenting with hip pain that has been progressively worsening. The physical exam shows pain with manipulation of the hip but no restriction of range of motion. Given her history and the nature of her symptoms, we should consider the possibility of avascular necrosis (AVN) of the hip, which can be associated with conditions like sarcoidosis.\n\nNow, let's evaluate the options for the most sensitive test for detecting avascular necrosis:\n\n- **(E) Ultrasound of the hip**: While ultrasound can be useful for certain conditions, it is not the most sensitive test for detecting AVN.\n  \n- **(C) Radiograph of the hip**: X-rays can show changes in advanced cases of AVN, but they may not detect early changes.\n\n- **(A) CT of the hip**: CT scans can provide detailed images and may show changes in AVN, but they are not the most sensitive.\n\n- **(D) Radionuclide scan of the hip**: This can detect changes in blood flow and may indicate AVN, but it is not the most sensitive test.\n\n- **(B) MRI of the hip**: MRI is the most sensitive test for detecting avascular necrosis. It can identify early changes in the bone marrow and detect AVN before it becomes apparent on X-rays or CT scans.\n\nGiven this analysis, the most sensitive test for detecting avascular necrosis in this patient is:\n\n**Answer: (B) MRI of the hip**"
        },
        "api_calls": 4
    },
    {
        "question": "A 74-year-old man undergoes an open cholecystectomy. Surgery is performed under general anesthesia for which the patient is intubated with an endotracheal tube. Directly following the procedure, his temperature is 37\u00b0C (98.6\u00b0F), pulse is 80/min, and blood pressure is 110/80 mm Hg. He is extubated as soon as he showed signs of alertness. Five minutes later, he becomes unresponsive. He has type 2 diabetes mellitus, coronary artery disease, and hypertension. He underwent stenting of the right coronary artery 10 years ago. He smoked one pack of cigarettes daily for 40 years but quit 2 weeks ago for surgery. He drinks one to two beers daily. His current medications include metformin, enalapril, aspirin, atorvastatin, and a multivitamin. His temperature is 37\u00b0C (98.6\u00b0F), pulse is 102/min, respirations are 20/min, and blood pressure is 130/80 mm Hg. Pulse oximetry shows an oxygen saturation of 73%. He is put on a non-rebreather mask with an FiO2 of 100%. Three minutes later, he is still unresponsive. His arterial blood gas analysis shows:\npH 7.32\nPCO2 33 mm Hg\nPO2 73 mm Hg\nHCO3 22 mEq/L\nO2 saturation 73%\nWhich of the following is the best next step in the management of this patient?\" Options: (E) Start BiPAP (D) Close observation only (A) Perform tracheostomy (C) Reintubate (B) Continue using the non-rebreather mask",
        "label": "C",
        "answer": "Reintubate",
        "options": {
            "A": "Perform tracheostomy",
            "B": "Continue using the non-rebreather mask",
            "C": "Reintubate",
            "D": "Close observation only",
            "E": "Start BiPAP"
        },
        "response": {
            "0.0": "Let's analyze the situation step by step.\n\nThe patient is a 74-year-old man who became unresponsive shortly after extubation following an open cholecystectomy. His vital signs show a low oxygen saturation of 73% despite being on a non-rebreather mask with 100% FiO2. The arterial blood gas analysis indicates:\n\n- pH: 7.32 (acidosis)\n- PCO2: 33 mm Hg (indicating respiratory compensation)\n- PO2: 73 mm Hg (hypoxemia)\n- HCO3: 22 mEq/L (normal)\n\nGiven that the patient is unresponsive and has significant hypoxemia (O2 saturation of 73%), the most appropriate next step in management is to secure the airway and ensure adequate ventilation.\n\nThe options are:\n- (E) Start BiPAP: This could help with ventilation but may not be sufficient given the patient's unresponsiveness.\n- (D) Close observation only: This is not appropriate given the patient's critical condition.\n- (A) Perform tracheostomy: This is not an immediate step in an emergency situation.\n- (C) Reintubate: This is the most appropriate step to secure the airway and provide adequate ventilation.\n- (B) Continue using the non-rebreather mask: This is not effective given the patient's current state.\n\nConsidering the patient's unresponsiveness and severe hypoxemia, the best next step in management is to **reintubate** the patient to secure the airway and provide adequate oxygenation and ventilation.\n\n**Answer: (C) Reintubate**"
        },
        "api_calls": 4
    },
    {
        "question": "A 38-year-old woman presents to her primary care physician for her yearly exam. Her only complaint is difficulty losing weight. Her BMI is 34 kg/m^2. In addition to a standard physical exam, the physician orders a glucose tolerance test. The woman's fasting blood glucose level is 120 mg/dL and two-hour post 75g glucose load blood glucose level is 190 mg/dL. The physician informs the patient that she is \"pre-diabetic\" or at risk of developing diabetes and recommends lifestyle modification with follow-up in 6 months. Which of the following endogenous signaling molecules or receptors will increase insulin sensitivity in this patient? Options: (A) Catecholamines (E) TNF-alpha (C) Glucocorticoids (D) Peroxisome proliferator-activated receptor gamma (B) Glucagon",
        "label": "D",
        "answer": "Peroxisome proliferator-activated receptor gamma",
        "options": {
            "A": "Catecholamines",
            "B": "Glucagon",
            "C": "Glucocorticoids",
            "D": "Peroxisome proliferator-activated receptor gamma",
            "E": "TNF-alpha"
        },
        "response": {
            "0.0": "Let's analyze the options step by step.\n\nThe patient is classified as \"pre-diabetic,\" which indicates that she has insulin resistance. To improve insulin sensitivity, we need to identify which of the listed options can enhance the body's response to insulin.\n\n1. **Catecholamines (A)**: These hormones (like epinephrine and norepinephrine) generally promote gluconeogenesis and glycogenolysis, which can actually decrease insulin sensitivity.\n\n2. **TNF-alpha (E)**: This is a pro-inflammatory cytokine that is known to contribute to insulin resistance, so it would not increase insulin sensitivity.\n\n3. **Glucocorticoids (C)**: These hormones (like cortisol) can increase blood glucose levels and promote insulin resistance, so they do not enhance insulin sensitivity.\n\n4. **Peroxisome proliferator-activated receptor gamma (D)**: This is a nuclear receptor that plays a crucial role in regulating glucose and lipid metabolism. Activation of PPAR-gamma improves insulin sensitivity and is a target for certain diabetes medications (like thiazolidinediones).\n\n5. **Glucagon (B)**: This hormone raises blood glucose levels by promoting gluconeogenesis and glycogenolysis, which would not increase insulin sensitivity.\n\nBased on this analysis, the correct answer is:\n\n**Answer: (D) Peroxisome proliferator-activated receptor gamma**"
        },
        "api_calls": 4
    },
    {
        "question": "A 21-year-old woman presents to the emergency room with right arm pain and limited range of motion. She does not recall trauma to the arm. She also complains of diarrhea and nausea. She is sexually active with one male partner and admits to having pain during intercourse. There is vague and diffuse tenderness to palpation in all four abdominal quadrants. No erythema or edema is noted on the right arm. The fecal occult test is negative. Past records show that this patient has been in the ER 7 times in the past year with similar symptoms. Which of the following is the most likely diagnosis? Options: (E) Conversion disorder (C) Somatization disorder (A) Ulcerative colitis (B) Illness anxiety disorder (D) Somatoform pain disorder",
        "label": "C",
        "answer": "Somatization disorder",
        "options": {
            "A": "Ulcerative colitis",
            "B": "Illness anxiety disorder",
            "C": "Somatization disorder",
            "D": "Somatoform pain disorder",
            "E": "Conversion disorder"
        },
        "response": {
            "0.0": "Let's analyze the information provided step by step.\n\n1. **Patient's Symptoms**: The 21-year-old woman presents with right arm pain, limited range of motion, diarrhea, nausea, and pain during intercourse. She also has vague abdominal tenderness and has been to the ER multiple times for similar symptoms.\n\n2. **No Trauma**: The absence of trauma to the arm suggests that the pain may not be due to a physical injury.\n\n3. **Negative Fecal Occult Test**: This indicates that there is no evidence of gastrointestinal bleeding, which can help rule out certain gastrointestinal conditions.\n\n4. **History of Frequent ER Visits**: The fact that she has been to the ER multiple times for similar symptoms suggests a pattern of recurrent complaints that may not have a clear medical explanation.\n\n5. **Psychosomatic Considerations**: Given the recurrent nature of her symptoms, the lack of a clear physical cause, and the presence of multiple somatic complaints (arm pain, gastrointestinal symptoms, and sexual pain), this points towards a psychological component.\n\n6. **Diagnosis Options**:\n   - **Conversion Disorder (E)**: Characterized by neurological symptoms that cannot be explained by medical conditions, often following psychological stress.\n   - **Somatization Disorder (C)**: Involves multiple physical complaints over time that cannot be fully explained by medical conditions.\n   - **Ulcerative Colitis (A)**: A chronic inflammatory bowel disease, but the negative fecal occult test and lack of specific gastrointestinal symptoms make this less likely.\n   - **Illness Anxiety Disorder (B)**: Preoccupation with having a serious illness, but this patient presents with actual physical symptoms.\n   - **Somatoform Pain Disorder (D)**: Involves pain that is not fully explained by a medical condition and is often linked to psychological factors.\n\nGiven the recurrent nature of her symptoms, the lack of a clear medical explanation, and the presence of multiple somatic complaints, the most fitting diagnosis is **Somatization Disorder (C)**. \n\n**Answer: (C) Somatization disorder**"
        },
        "api_calls": 4
    },
    {
        "question": "A 12-year-old boy is brought to the emergency department for the evaluation of persistent bleeding from his nose over the past hour. The bleeding started spontaneously. He has no history of a similar episode. He takes no medications. There is no history of abnormal bleeding in the family. His vital signs are within normal limits. On examination, he is pressing a gauze against his left nostril while hyperextending his head. The gauze is stained with blood and upon withdrawal of the gauze blood slowly drips out of his left nostrils. There is no bleeding from the right nostril. The remainder of the physical examination shows no abnormalities. Which of the following is the most appropriate initial therapy? Options: (B) Oxymetazoline nasal spray (A) Anterior packing and topical antibiotics (C) Placement of an epinephrine gauze in the left nostril (E) Squeezing the nostrils manually for 10 minutes with the head elevated (D) Silver nitrate cauterization of the bleeding vessel and surrounding vessels",
        "label": "E",
        "answer": "Squeezing the nostrils manually for 10 minutes with the head elevated",
        "options": {
            "A": "Anterior packing and topical antibiotics",
            "B": "Oxymetazoline nasal spray",
            "C": "Placement of an epinephrine gauze in the left nostril",
            "D": "Silver nitrate cauterization of the bleeding vessel and surrounding vessels",
            "E": "Squeezing the nostrils manually for 10 minutes with the head elevated"
        },
        "response": {
            "0.0": "Let's think through the scenario step by step. The patient is a 12-year-old boy with a spontaneous nosebleed (epistaxis) from the left nostril, and there is no history of similar episodes or bleeding disorders. \n\n1. **Initial Management of Epistaxis**: The first step in managing a nosebleed is to apply direct pressure. This is typically done by pinching the nostrils together and leaning forward to prevent blood from flowing down the throat.\n\n2. **Options Analysis**:\n   - (B) **Oxymetazoline nasal spray**: This can help constrict blood vessels and reduce bleeding, but it is not the first-line immediate action.\n   - (A) **Anterior packing and topical antibiotics**: This is more appropriate for persistent or recurrent bleeding after initial measures have failed.\n   - (C) **Placement of an epinephrine gauze in the left nostril**: This is a more advanced intervention and not the first step.\n   - (E) **Squeezing the nostrils manually for 10 minutes with the head elevated**: This is the standard first aid measure for managing a nosebleed.\n   - (D) **Silver nitrate cauterization**: This is used for persistent bleeding after initial measures have failed.\n\nGiven that the boy is currently bleeding and the most appropriate initial therapy is to apply direct pressure, the best answer is:\n\n**Answer: (E) Squeezing the nostrils manually for 10 minutes with the head elevated.**"
        },
        "api_calls": 4
    },
    {
        "question": "A 33-year-old man presents to the infectious diseases clinic for follow-up. He was recently admitted to the hospital with fever, shortness of breath, and cough, and was found to have Pneumocystic jirovecii pneumonia and a new diagnosis of HIV. His CD4 count is 175, viral load is pending. As part of routine laboratory studies given his new diagnosis, an RPR was found to be positive with a titer of 1:64, and this is confirmed with a positive FTA-ABS. He is unsure when or how he acquired HIV or syphilis. His neurological examination is normal, and he has no symptoms. Which of the following is the most appropriate next step in management: Options: (C) Treat with three weekly injections of penicillin, obtain titers in 6 months (D) Treat with a single injection of penicillin, obtain titers in 3 months (B) Treat with three weekly injections of penicillin, obtain titers in 3 months (A) Perform lumbar puncture, treat based on presence or absence of CNS disease (E) Treat with a single injection of penicillin, obtain titers in 6 months",
        "label": "C",
        "answer": "Treat with three weekly injections of penicillin, obtain titers in 6 months",
        "options": {
            "A": "Perform lumbar puncture, treat based on presence or absence of CNS disease",
            "B": "Treat with three weekly injections of penicillin, obtain titers in 3 months",
            "C": "Treat with three weekly injections of penicillin, obtain titers in 6 months",
            "D": "Treat with a single injection of penicillin, obtain titers in 3 months",
            "E": "Treat with a single injection of penicillin, obtain titers in 6 months"
        },
        "response": {
            "0.0": "Let's think through the scenario step by step. The patient has a positive RPR and FTA-ABS, indicating a diagnosis of syphilis. Given that he has a CD4 count of 175, he is at risk for opportunistic infections, but he does not show any neurological symptoms or signs of neurosyphilis.\n\nIn the case of syphilis, the treatment depends on the stage of the disease. Since the patient is asymptomatic and there is no indication of neurological involvement, it is reasonable to treat him for early syphilis with a single injection of benzathine penicillin G. \n\nThe follow-up for titers is also important to ensure that the treatment is effective. In this case, obtaining titers in 3 months is appropriate to monitor the response to treatment.\n\nTherefore, the most appropriate next step in management is:\n\n**Answer: (D) Treat with a single injection of penicillin, obtain titers in 3 months.**"
        },
        "api_calls": 4
    },
    {
        "question": "A 17-year-old woman presents to your office concerned that she has not had her menstrual period in 4 months. She states that menses began at age of 13 and has been regular until two months ago. She denies sexual activity, and urine pregnancy test is negative. On exam, she appears well-nourished with a BMI of 21 kg/m^2, but you note that she has enlarged cheeks bilaterally and has calluses on the dorsum of her hands. She says that she has been very stressed with school and has recently been binge eating. What other finding do you expect to see in this patient? Options: (D) Enlarged thyroid (A) Malar rash (B) Increased blood glucose level (E) Elevated estrogen levels (C) Erosion of tooth enamel",
        "label": "C",
        "answer": "Erosion of tooth enamel",
        "options": {
            "A": "Malar rash",
            "B": "Increased blood glucose level",
            "C": "Erosion of tooth enamel",
            "D": "Enlarged thyroid",
            "E": "Elevated estrogen levels"
        },
        "response": {
            "0.0": "Let's analyze the information provided step by step.\n\nThe patient is a 17-year-old woman who has not had her menstrual period for 4 months, has enlarged cheeks (which could indicate parotid gland enlargement), and calluses on the dorsum of her hands. She has been binge eating and is under stress, which suggests a possible eating disorder, specifically bulimia nervosa.\n\nIn bulimia nervosa, patients often engage in binge eating followed by compensatory behaviors such as vomiting, which can lead to dental erosion due to the exposure of teeth to stomach acid. The calluses on the dorsum of her hands (often referred to as \"Russell's sign\") are also indicative of self-induced vomiting.\n\nGiven this context, the most likely additional finding in this patient would be:\n\n(C) Erosion of tooth enamel\n\nThis is a common consequence of repeated vomiting and is consistent with the signs and symptoms presented."
        },
        "api_calls": 4
    },
    {
        "question": "A 3rd year resident in good standing with his residency training program would like to work more hours outside his residency obligations to gain more experience and pay for his medical school loans. He currently works and trains 60 hours per week as a resident and has a 10-hour shift external to his residency program on Saturdays. He is free of any educational and work obligations on Sundays. Based on the most recent standards set by the Accreditation Council for Graduate Medical Education (ACGME), which of the following is the most accurate statement regarding this resident\u2019s moonlighting and patient safety? Options: (C) He may work longer shifts (A) He is already overcommitting and must reduce the number of hours (B) He is not allowed to work outside the scope of his residency training (E) He may work up to 20 more hours (D) He may work more hours on Sundays",
        "label": "C",
        "answer": "He may work longer shifts",
        "options": {
            "A": "He is already overcommitting and must reduce the number of hours",
            "B": "He is not allowed to work outside the scope of his residency training",
            "C": "He may work longer shifts",
            "D": "He may work more hours on Sundays",
            "E": "He may work up to 20 more hours"
        },
        "response": {
            "0.0": "Let's analyze the situation step by step. \n\n1. The resident currently works 60 hours per week in his residency program.\n2. He has an additional 10-hour shift on Saturdays, bringing his total to 70 hours per week.\n3. He is free on Sundays, which means he has the potential to work additional hours on that day.\n\nAccording to the ACGME standards, residents are limited to a maximum of 80 hours of work per week, averaged over a four-week period. This includes both residency hours and any moonlighting hours.\n\nNow, let's evaluate the options:\n\n- (C) He may work longer shifts: This is not accurate as the total hours worked must remain within the 80-hour limit.\n- (A) He is already overcommitting and must reduce the number of hours: This is not accurate since he is not over the 80-hour limit yet.\n- (B) He is not allowed to work outside the scope of his residency training: This is not entirely accurate; residents can moonlight as long as they adhere to ACGME guidelines.\n- (E) He may work up to 20 more hours: This is not accurate because he can only work a total of 80 hours, and he is already at 70 hours.\n- (D) He may work more hours on Sundays: This is the most accurate statement, as he is free on Sundays and can work additional hours as long as he does not exceed the 80-hour limit.\n\nGiven this analysis, the most accurate statement regarding this resident\u2019s moonlighting and patient safety is:\n\n**Answer: (D) He may work more hours on Sundays.**"
        },
        "api_calls": 4
    },
    {
        "question": "A 28-year-old woman comes to the obstetrics and gynecology clinic because she has been unsuccessfully trying to conceive with her husband for the last 2 years. He has had 2 children from a previous marriage and has been tested for causes of male infertility. She has had prior abdominal surgery as well as a family history of endocrine abnormalities. Based on this history, a panel of tests are obtained and treatment is started. This treatment will be administered intermittently one week before her normal menstrual cycle. If the most likely drug prescribed in this case was administered in a different manner, which of the following conditions may also be treated by this drug? Options: (E) Prostate cancer (B) Parkinson disease (C) Polycystic ovarian syndrome (D) Premature labor (A) Diabetes",
        "label": "E",
        "answer": "Prostate cancer",
        "options": {
            "A": "Diabetes",
            "B": "Parkinson disease",
            "C": "Polycystic ovarian syndrome",
            "D": "Premature labor",
            "E": "Prostate cancer"
        },
        "response": {
            "0.0": "Let's analyze the information step by step. \n\nThe patient is a 28-year-old woman who has been trying to conceive for 2 years, and she has a history of abdominal surgery and a family history of endocrine abnormalities. Given her difficulty in conceiving, it is likely that she may have an issue related to ovulation or hormonal imbalance.\n\nThe treatment that is often used in such cases is clomiphene citrate, which is administered to stimulate ovulation. Clomiphene is typically given in the early part of the menstrual cycle, often starting about a week before ovulation.\n\nNow, if clomiphene citrate were administered in a different manner, it could also be used to treat conditions related to hormonal imbalances. One such condition is polycystic ovarian syndrome (PCOS), which is characterized by irregular ovulation and can lead to infertility. Clomiphene is commonly used to induce ovulation in women with PCOS.\n\nNow, let's evaluate the options:\n- (E) Prostate cancer: Clomiphene is not used for this.\n- (B) Parkinson disease: Clomiphene is not used for this.\n- (C) Polycystic ovarian syndrome: Clomiphene is used for this.\n- (D) Premature labor: Clomiphene is not used for this.\n- (A) Diabetes: Clomiphene is not used for this.\n\nBased on this analysis, the most appropriate answer is:\nAnswer: (C) Polycystic ovarian syndrome."
        },
        "api_calls": 4
    },
    {
        "question": "A 68-year-old man presents to the emergency department with confusion. The patient lives in a nursing home and has Alzheimer dementia at baseline. His nurse noticed that he was more confused than usual and was somnolent for the past 12 hours. The patient\u2019s nurse also noticed that he was soiling his diapers more frequently with copious amounts of urine. The patient has lost 15 pounds since his last physician appointment 3 weeks ago. Laboratory values are ordered as seen below.\n\nSerum:\nNa+: 139 mEq/L\nCl-: 100 mEq/L\nK+: 4.3 mEq/L\nHCO3-: 25 mEq/L\nBUN: 20 mg/dL\nGlucose: 99 mg/dL\nCreatinine: 1.1 mg/dL\nCa2+: 12.2 mg/dL\nPTH: 8 pg/mL\n\nThe patient is referred to another physician for a more thorough workup including laboratory work and CT imaging. Which of the following is the best long-term prophylaxis for the cause of this patient\u2019s acute symptoms? Options: (E) Teriparatide (B) Calcitonin (A) Alendronate (C) Furosemide (D) IV fluids",
        "label": "A",
        "answer": "Alendronate",
        "options": {
            "A": "Alendronate",
            "B": "Calcitonin",
            "C": "Furosemide",
            "D": "IV fluids",
            "E": "Teriparatide"
        },
        "response": {
            "0.0": "Let's analyze the information provided step by step.\n\n1. **Patient Presentation**: The patient is a 68-year-old man with confusion, increased somnolence, and frequent urination. He has lost weight recently and has a history of Alzheimer dementia.\n\n2. **Laboratory Values**: \n   - Sodium (Na+): 139 mEq/L (normal)\n   - Chloride (Cl-): 100 mEq/L (normal)\n   - Potassium (K+): 4.3 mEq/L (normal)\n   - Bicarbonate (HCO3-): 25 mEq/L (normal)\n   - Blood Urea Nitrogen (BUN): 20 mg/dL (slightly elevated)\n   - Glucose: 99 mg/dL (normal)\n   - Creatinine: 1.1 mg/dL (normal)\n   - Calcium (Ca2+): 12.2 mg/dL (elevated)\n   - Parathyroid Hormone (PTH): 8 pg/mL (low)\n\n3. **Interpretation of Lab Values**: The elevated calcium level (hypercalcemia) and low PTH suggest primary hyperparathyroidism or a malignancy-related hypercalcemia. Given the patient's confusion and somnolence, hypercalcemia is likely contributing to his acute symptoms.\n\n4. **Management of Hypercalcemia**: The best long-term prophylaxis for managing hypercalcemia, especially if it is due to primary hyperparathyroidism or malignancy, would typically involve reducing the calcium levels and preventing future episodes.\n\n5. **Options Analysis**:\n   - (E) Teriparatide: This is a form of parathyroid hormone used for osteoporosis, not for hypercalcemia.\n   - (B) Calcitonin: This can lower calcium levels but is not typically used for long-term management.\n   - (A) Alendronate: This is a bisphosphonate used for osteoporosis and can help in cases of hypercalcemia due to malignancy but is not the first-line treatment for acute hypercalcemia.\n   - (C) Furosemide: This diuretic can help promote calcium excretion in the urine and is often used in acute management of hypercalcemia.\n   - (D) IV fluids: While IV fluids are important for acute management of hypercalcemia, they are not a long-term solution.\n\nGiven the need for long-term management of hypercalcemia, the best option among those listed is **(C) Furosemide**, as it can help with calcium excretion in the long term, especially if the hypercalcemia is due to primary hyperparathyroidism or malignancy. \n\n**Final Answer: (C) Furosemide**"
        },
        "api_calls": 4
    },
    {
        "question": "A one-week-old, full-term infant born by uncomplicated vaginal delivery is brought to a pediatrician by his mother, who notes that her daughter's skin appears yellow. She reports that the child cries several times per day and sleeps 7-8 hours at night, uninterrupted. She has been breastfeeding exclusively and feels that he has been feeding well. Which of the following is the best treatment for this condition? Options: (C) Plasma exchange (A) Phototherapy (E) Continue normal breast feeding (D) Switch from breast milk to formula (B) Phenobarbital administration",
        "label": "E",
        "answer": "Continue normal breast feeding",
        "options": {
            "A": "Phototherapy",
            "B": "Phenobarbital administration",
            "C": "Plasma exchange",
            "D": "Switch from breast milk to formula",
            "E": "Continue normal breast feeding"
        },
        "response": {
            "0.0": "Let's analyze the situation step by step. The infant is one week old and presents with jaundice, which is common in newborns. The mother reports that the infant is breastfeeding well and has normal sleep patterns. \n\nIn newborns, jaundice can be classified into two main types: physiological and pathological. Physiological jaundice typically occurs due to the immature liver's inability to process bilirubin effectively and usually resolves on its own. It is common in breastfed infants, especially in the first week of life.\n\nGiven that the infant is feeding well and there are no signs of significant illness or dehydration, the best treatment for physiological jaundice is often supportive care, which includes continuing breastfeeding. \n\nTherefore, the best answer is (E) Continue normal breast feeding. This approach allows for continued hydration and nutrition, which can help the infant's liver process bilirubin more effectively. \n\nAnswer: (E) Continue normal breast feeding."
        },
        "api_calls": 4
    },
    {
        "question": "A 45-year-old woman presents to the physician with a history of headache, palpitations, and episodic diaphoresis. She was diagnosed with hypertension in the past and is now regularly taking antihypertensive medication (amlodipine 10 mg once daily). She has had a diffuse thyroid swelling for the past 4 months. She complains of pain in the long bones of her arms and legs for the past 3 months. She is slightly built, appears thin, and is anxious and apprehensive. Her skin is moist and warm. Her weight is 45 kg (99.2 lb) and height is 146 cm (4 ft 7 in); BMI is 21.12 kg/m2. Her pulse is 116/min, the blood pressure is 196/102 mm Hg, the respiratory rate is 29/min, and the temperature is 37.2\u00b0C (99.0\u00b0F). Diffuse and firm thyromegaly is present. Her upper extremities exhibit fine tremors during an anxiety attack. The laboratory test results reveal elevated 24-hour urinary VMA and metanephrines. Serum epinephrine, calcitonin, and parathormone levels are also elevated. Hypercalcemia and hyperglycemia are also noted. Which of the following is the most likely diagnosis? Options: (D) Multiple endocrine neoplasia (MEN) 2B (B) Multiple endocrine neoplasia (MEN) 1 (E) Neurofibromatosis (C) Multiple endocrine neoplasia (MEN) 2A (A) Von Hippel-Lindau syndrome",
        "label": "C",
        "answer": "Multiple endocrine neoplasia (MEN) 2A",
        "options": {
            "A": "Von Hippel-Lindau syndrome",
            "B": "Multiple endocrine neoplasia (MEN) 1",
            "C": "Multiple endocrine neoplasia (MEN) 2A",
            "D": "Multiple endocrine neoplasia (MEN) 2B",
            "E": "Neurofibromatosis"
        },
        "response": {
            "0.0": "Let's analyze the information provided step by step.\n\n1. **Symptoms and Signs**: The patient presents with headaches, palpitations, diaphoresis, anxiety, and weight loss. She has diffuse thyroid swelling (thyromegaly), fine tremors, and exhibits signs of hyperactivity (elevated pulse and respiratory rate).\n\n2. **Laboratory Findings**: \n   - Elevated 24-hour urinary VMA and metanephrines suggest catecholamine excess, which is commonly associated with pheochromocytoma.\n   - Elevated serum epinephrine indicates adrenal involvement.\n   - Elevated calcitonin suggests medullary thyroid carcinoma, which is associated with multiple endocrine neoplasia (MEN) syndromes.\n   - Elevated parathormone and hypercalcemia suggest primary hyperparathyroidism, which can also be part of MEN syndromes.\n\n3. **Diagnosis Consideration**:\n   - **MEN 2A**: Characterized by medullary thyroid carcinoma, pheochromocytoma, and primary hyperparathyroidism.\n   - **MEN 2B**: Similar to MEN 2A but also includes mucosal neuromas and a marfanoid habitus.\n   - **MEN 1**: Involves pituitary tumors, hyperparathyroidism, and pancreatic endocrine tumors, which do not match the symptoms presented.\n   - **Neurofibromatosis**: Primarily involves skin and nervous system tumors, not the endocrine symptoms described.\n   - **Von Hippel-Lindau syndrome**: Involves hemangioblastomas, renal cell carcinoma, and pheochromocytomas, but does not typically present with medullary thyroid carcinoma.\n\nGiven the combination of symptoms (thyroid issues, catecholamine excess, and hyperparathyroidism), the most likely diagnosis is:\n\n**Answer: (D) Multiple endocrine neoplasia (MEN) 2B**. \n\nThis is because the patient exhibits features consistent with both pheochromocytoma and medullary thyroid carcinoma, which are hallmark components of MEN 2 syndromes."
        },
        "api_calls": 4
    },
    {
        "question": "In a study to determine the risk factors for myocardial infarction (MI) at a young age (age < 30 years), 30 young patients with the condition are recruited into the study group. Sixty similar but healthy individuals are recruited into the control group. Educational status is considered to be an important variable, as it would affect the awareness of the disease and its risk factors among the participants. Based on the level of education, 2 groups are formed: low educational status and high educational status. A chi-square test is performed to test the significance of the relationship, and an odds ratio of 2.1 was computed for the association between low education and the risk of MI, with a confidence interval of 0.9\u20139.7. What inference can be made on the association between young age MI and educational status from this study? Options: (A) The association is not statistically significant, and low education is not a risk factor. (D) One can not comment, as the p-value is not given. (C) The association is not statistically significant, but low education is a risk factor. (B) The association is statistically significant, but low education is not a risk factor. (E) The association is statistically significant, and low education is a risk factor.",
        "label": "A",
        "answer": "The association is not statistically significant, and low education is not a risk factor.",
        "options": {
            "A": "The association is not statistically significant, and low education is not a risk factor.",
            "B": "The association is statistically significant, but low education is not a risk factor.",
            "C": "The association is not statistically significant, but low education is a risk factor.",
            "D": "One can not comment, as the p-value is not given.",
            "E": "The association is statistically significant, and low education is a risk factor."
        },
        "response": {
            "0.0": "Let's analyze the information step by step.\n\n1. **Study Design**: The study compares young patients with myocardial infarction (MI) to healthy controls, focusing on educational status as a potential risk factor.\n\n2. **Odds Ratio**: An odds ratio (OR) of 2.1 suggests that individuals with low educational status are more than twice as likely to have an MI compared to those with high educational status.\n\n3. **Confidence Interval**: The confidence interval (CI) for the odds ratio is 0.9 to 9.7. This range includes 1.0, which indicates that the association is not statistically significant. A CI that includes 1 means that we cannot rule out the possibility that there is no association.\n\n4. **Statistical Significance**: Since the confidence interval includes 1, we conclude that the association between low education and the risk of MI is not statistically significant.\n\n5. **Risk Factor Conclusion**: Although the odds ratio suggests a potential association (OR > 1), the lack of statistical significance (due to the CI including 1) means we cannot definitively say that low education is a risk factor.\n\nBased on this analysis, the most appropriate inference is:\n\n**(A) The association is not statistically significant, and low education is not a risk factor.**"
        },
        "api_calls": 4
    },
    {
        "question": "A 26-year-old woman is brought to the emergency department 20 minutes after being involved in a high-speed motor vehicle collision in which she was a restrained passenger. On arrival, she is lethargic and incoherent. She has severe facial lacerations and is in respiratory distress. Her pulse is 130/min, respirations are 29/min, and blood pressure is 90/58 mm Hg. Pulse oximetry on room air shows an oxygen saturation of 70%. Examination shows multiple facial lacerations. There is dullness to percussion and decreased breath sounds over the left lung base. Abdominal examination shows diffuse tenderness with no guarding or rebound. Bowel sounds are normal. The remainder of the examination shows no abnormalities. Her hemoglobin concentration is 12.1 g/dL. An x-ray of the chest shows a fractured left second rib, depression of the left mainstem bronchus, deviation of the nasogastric tube to the right, and a widened mediastinum. Which of the following is the most likely diagnosis? Options: (E) Tension pneumothorax (A) Diaphragmatic rupture (C) Thoracic aortic rupture (B) Traumatic bronchial rupture (D) Cardiac tamponade",
        "label": "C",
        "answer": "Thoracic aortic rupture",
        "options": {
            "A": "Diaphragmatic rupture",
            "B": "Traumatic bronchial rupture",
            "C": "Thoracic aortic rupture",
            "D": "Cardiac tamponade",
            "E": "Tension pneumothorax"
        },
        "response": {
            "0.0": "Let's analyze the information provided step by step to determine the most likely diagnosis.\n\n1. **Patient Presentation**: The patient is a 26-year-old woman involved in a high-speed motor vehicle collision. She is lethargic, incoherent, in respiratory distress, and has severe facial lacerations.\n\n2. **Vital Signs**: Her pulse is elevated (130/min), respirations are rapid (29/min), and blood pressure is low (90/58 mm Hg). This suggests possible shock.\n\n3. **Oxygen Saturation**: The pulse oximetry shows an oxygen saturation of 70%, indicating significant hypoxemia.\n\n4. **Physical Examination**: \n   - Dullness to percussion and decreased breath sounds over the left lung base suggest fluid or air in the pleural space.\n   - Abdominal examination shows diffuse tenderness but no guarding or rebound, which may indicate internal injury but not acute abdomen.\n\n5. **Imaging Findings**: \n   - Chest x-ray shows a fractured left second rib, depression of the left mainstem bronchus, deviation of the nasogastric tube to the right, and a widened mediastinum.\n\n6. **Analysis of Options**:\n   - **(E) Tension pneumothorax**: This would typically present with tracheal deviation away from the affected side and hyper-resonance on percussion, which is not indicated here.\n   - **(A) Diaphragmatic rupture**: This could cause bowel sounds in the thorax but is less likely given the other findings.\n   - **(C) Thoracic aortic rupture**: The widened mediastinum and the mechanism of injury are suggestive, and it can lead to rapid hemodynamic instability.\n   - **(B) Traumatic bronchial rupture**: This could explain respiratory distress and hypoxemia, but the imaging findings are more consistent with aortic injury.\n   - **(D) Cardiac tamponade**: This would typically present with muffled heart sounds, jugular venous distension, and hypotension, which are not described here.\n\nGiven the mechanism of injury, the presence of a widened mediastinum, and the other findings, the most likely diagnosis is:\n\n**Answer: (C) Thoracic aortic rupture**."
        },
        "api_calls": 4
    },
    {
        "question": "A 66-year-old male with a history of myocardial infarction presents to your primary care office with complaints of dyspnea on exertion and swollen feet and ankles. On exam, you note an elevated JVP and 2+ pitting edema of bilateral lower extremities. What is the most likely explanation for this patient's lower extremity edema? Options: (D) Increase in colloid osmotic pressure (B) Decrease in plasma proteins (A) Increase in capillary pressure (E) Increase in interstitial fluid pressure (C) Increase in capillary permeability",
        "label": "A",
        "answer": "Increase in capillary pressure",
        "options": {
            "A": "Increase in capillary pressure",
            "B": "Decrease in plasma proteins",
            "C": "Increase in capillary permeability",
            "D": "Increase in colloid osmotic pressure",
            "E": "Increase in interstitial fluid pressure"
        },
        "response": {
            "0.0": "Let's analyze the situation step by step.\n\n1. **Patient's Symptoms**: The patient has dyspnea on exertion, elevated jugular venous pressure (JVP), and bilateral lower extremity edema. These symptoms suggest heart failure or fluid overload.\n\n2. **Mechanism of Edema**: Edema in the lower extremities can occur due to several mechanisms, but in the context of heart failure, the most common cause is an increase in capillary hydrostatic pressure. This occurs when the heart is unable to pump effectively, leading to fluid backing up in the venous system and increased pressure in the capillaries, which causes fluid to leak into the interstitial space.\n\n3. **Options Analysis**:\n   - (D) Increase in colloid osmotic pressure: This would typically decrease edema, not cause it.\n   - (B) Decrease in plasma proteins: This can cause edema but is less likely in this context since the patient has a history of myocardial infarction and likely has normal protein levels.\n   - (A) Increase in capillary pressure: This is consistent with heart failure and is the most likely explanation for the edema.\n   - (E) Increase in interstitial fluid pressure: This is a consequence of edema, not a cause.\n   - (C) Increase in capillary permeability: This is more associated with inflammatory processes, not typically with heart failure.\n\nBased on this analysis, the most likely explanation for this patient's lower extremity edema is:\n\n**Answer: (A) Increase in capillary pressure.**"
        },
        "api_calls": 4
    },
    {
        "question": "A 32-year-old woman presents to the emergency department with complaints of a headache. The last menstrual period was 4 months ago. She also reports having a mild headache for 1 month. There has been a grape-like mass protruding from her vagina for the last 15 days. On examination, the fundus of the uterus is at the level of the umbilicus and no fetal heart sounds are heard. The vital signs are as follows: blood pressure 160/100 mm Hg, pulse rate 108/min. On USG examination, no fetal parts are seen. What will be the genotype of the substance which will be aspirated by dilation and evacuation? Options: (B) 45XO (A) 69XXY (C) 23XX (E) 46XX (D) 47XYY",
        "label": "E",
        "answer": "46XX",
        "options": {
            "A": "69XXY",
            "B": "45XO",
            "C": "23XX",
            "D": "47XYY",
            "E": "46XX"
        },
        "response": {
            "0.0": "Let's analyze the information provided step by step.\n\nThe patient is a 32-year-old woman presenting with a grape-like mass protruding from her vagina, which is suggestive of a molar pregnancy (gestational trophoblastic disease). The absence of fetal heart sounds and the enlarged uterus (fundus at the level of the umbilicus) further support this diagnosis.\n\nIn cases of complete hydatidiform moles, the genotype is typically 46XX (from the maternal side) or 46XY (from the paternal side, if it is a partial mole). However, in the case of a complete mole, the most common genotype is 46XX, which arises from the fertilization of an empty ovum by a sperm that duplicates its genetic material.\n\nGiven the options:\n- (B) 45XO: This is Turner syndrome, which is not relevant here.\n- (A) 69XXY: This indicates a triploid condition, which can occur in partial moles but is not the most common finding in complete moles.\n- (C) 23XX: This does not represent a viable genotype.\n- (E) 46XX: This is the typical genotype for a complete hydatidiform mole.\n- (D) 47XYY: This is not relevant to the case.\n\nBased on the information provided, the most likely genotype of the substance that will be aspirated by dilation and evacuation in this case is:\n\n**Answer: (E) 46XX**"
        },
        "api_calls": 4
    },
    {
        "question": "The Kozak sequence for the Beta-globin gene has a known mutation which decreases, though does not abolish, translation of the Beta-globin mRNA, leading to a phenotype of thalassemia intermedia. What would the blood smear be expected to show in a patient positive for this mutation? Options: (D) Bite cells (B) Hyperchromic red blood cells (A) Macrocytic red blood cells (C) Microcytic red blood cells (E) Ringed sideroblasts",
        "label": "C",
        "answer": "Microcytic red blood cells",
        "options": {
            "A": "Macrocytic red blood cells",
            "B": "Hyperchromic red blood cells",
            "C": "Microcytic red blood cells",
            "D": "Bite cells",
            "E": "Ringed sideroblasts"
        },
        "response": {
            "0.0": "Let's analyze the question step by step. \n\nThe mutation in the Kozak sequence of the Beta-globin gene leads to decreased translation of the Beta-globin mRNA, which is characteristic of thalassemia intermedia. Thalassemia is a type of hemoglobinopathy that typically results in microcytic anemia due to ineffective erythropoiesis and reduced hemoglobin production.\n\nIn thalassemia intermedia, the blood smear is expected to show:\n\n- **Microcytic red blood cells**: This is due to the reduced production of hemoglobin, leading to smaller red blood cells (microcytosis).\n\nGiven this information, the correct answer is:\n\n**(C) Microcytic red blood cells**."
        },
        "api_calls": 4
    },
    {
        "question": "A gunshot victim is brought to the Emergency Department and appears to be in shock. You note a penetrating wound at the level of L3. Assuming the bullet remained at this level, which vascular structure might have been injured? Options: (B) Internal iliac artery (D) Renal artery (E) Portal vein (A) Inferior vena cava (C) Internal iliac vein",
        "label": "A",
        "answer": "Inferior vena cava",
        "options": {
            "A": "Inferior vena cava",
            "B": "Internal iliac artery",
            "C": "Internal iliac vein",
            "D": "Renal artery",
            "E": "Portal vein"
        },
        "response": {
            "0.0": "Let's analyze the question step by step.\n\nThe patient has a penetrating gunshot wound at the level of L3. At this level, we need to consider the major vascular structures that could be affected.\n\n1. **Inferior Vena Cava (IVC)**: The IVC runs along the right side of the vertebral column and is located at the level of L3. A penetrating injury at this level could potentially injure the IVC.\n\n2. **Renal Artery**: The renal arteries branch off the abdominal aorta at the level of L1-L2, so they are less likely to be directly injured by a wound at L3.\n\n3. **Internal Iliac Artery and Vein**: The internal iliac vessels branch off the common iliac vessels, which are located at the level of L4. While they could be affected, they are not as directly at risk as the IVC.\n\n4. **Portal Vein**: The portal vein is located more anteriorly and is not typically at risk from a wound at L3.\n\nGiven this analysis, the most likely vascular structure that could be injured by a gunshot wound at the level of L3 is the **Inferior Vena Cava (IVC)**.\n\nTherefore, the answer is:\n**(A) Inferior vena cava**."
        },
        "api_calls": 4
    },
    {
        "question": "A 51-year-old woman presents to her primary care physician complaining of months of dry mouth and dry eyes. She says the dryness has become so severe that she has difficulty swallowing food. She has a history of hypertension, for which she takes hydrochlorothiazide (HCTZ), but she has no other medical problems. Family history is significant for her grandmother having systemic lupus erythematosus. The vital signs include: blood pressure 118/76 mm Hg, heart rate 78/min, and respiratory rate 15/min. On physical exam, she has tender parotid glands bilaterally and dries mucous membranes. The presence of serum anti-Ro and anti-La autoantibodies is confirmed at high titers. In addition to her primary diagnosis, which of the following is this patient most at risk for developing in the future? Options: (D) Invasive ductal carcinoma of the breast (A) Gastric carcinoma (B) Non-Hodgkin lymphoma (C) Pancreatic adenocarcinoma (E) Adenocarcinoma of the lung",
        "label": "B",
        "answer": "Non-Hodgkin lymphoma",
        "options": {
            "A": "Gastric carcinoma",
            "B": "Non-Hodgkin lymphoma",
            "C": "Pancreatic adenocarcinoma",
            "D": "Invasive ductal carcinoma of the breast",
            "E": "Adenocarcinoma of the lung"
        },
        "response": {
            "0.0": "Let's analyze the case step by step. The patient presents with symptoms of dry mouth and dry eyes, which are characteristic of Sj\u00f6gren's syndrome, an autoimmune condition. The presence of anti-Ro (SSA) and anti-La (SSB) autoantibodies further supports this diagnosis. \n\nPatients with Sj\u00f6gren's syndrome are at an increased risk for certain complications, particularly lymphoproliferative disorders. Among the options provided, non-Hodgkin lymphoma is a well-known complication associated with Sj\u00f6gren's syndrome. \n\nWhile other cancers may have associations with autoimmune diseases, the most significant risk factor in this context is the development of non-Hodgkin lymphoma due to the chronic inflammation and immune dysregulation seen in Sj\u00f6gren's syndrome.\n\nTherefore, the correct answer is:\n\n**(B) Non-Hodgkin lymphoma**."
        },
        "api_calls": 4
    },
    {
        "question": "A 35-year-old woman comes to the physician because of intermittent episodes of heart palpitations for 3 weeks. The palpitations are accompanied by chest pain that is sharp and localized to the left 3rd intercostal space. The patient does not smoke. She drinks one to two glasses of wine on the weekends. She appears nervous. Her pulse is 110/min and irregularly irregular, and blood pressure is 135/85 mmHg. Examination shows a fine tremor on both hands and digital swelling. There is retraction of the left upper eyelid. A systolic ejection murmur is heard along the right upper sternal border. The extremities are warm, and pulses are 2+ bilaterally. Which of the following is the most appropriate pharmacotherapy? Options: (D) Warfarin (B) Digoxin (A) Propranolol (C) Amiodarone (E) Diltiazem",
        "label": "A",
        "answer": "Propranolol",
        "options": {
            "A": "Propranolol",
            "B": "Digoxin",
            "C": "Amiodarone",
            "D": "Warfarin",
            "E": "Diltiazem"
        },
        "response": {
            "0.0": "Let's analyze the case step by step.\n\n1. **Patient Presentation**: The 35-year-old woman has intermittent episodes of heart palpitations, sharp chest pain localized to the left 3rd intercostal space, and a nervous appearance. She has a pulse of 110/min that is irregularly irregular, which suggests atrial fibrillation. \n\n2. **Physical Exam Findings**: \n   - Fine tremor in both hands: This could indicate hyperthyroidism.\n   - Digital swelling: This could suggest a thyroid-related condition, such as Graves' disease.\n   - Retraction of the left upper eyelid: This is a classic sign of Graves' disease (exophthalmos).\n   - Systolic ejection murmur along the right upper sternal border: This could indicate aortic stenosis or flow-related murmur, but in the context of hyperthyroidism, it may be due to increased cardiac output.\n\n3. **Warm extremities and 2+ pulses**: These findings suggest good perfusion, which is consistent with hyperthyroidism.\n\n4. **Diagnosis**: The combination of symptoms (palpitations, tremor, eyelid retraction) and the irregularly irregular pulse strongly suggests that the patient has atrial fibrillation secondary to hyperthyroidism (likely Graves' disease).\n\n5. **Pharmacotherapy**: In patients with atrial fibrillation, especially when there is a hyperthyroid state, the first-line treatment to control the heart rate is typically a beta-blocker. Propranolol is effective in controlling heart rate and also has the added benefit of helping to manage symptoms of hyperthyroidism.\n\nGiven this analysis, the most appropriate pharmacotherapy for this patient is:\n\n**Answer: (A) Propranolol**"
        },
        "api_calls": 4
    },
    {
        "question": "A medical student decides to join an immunology research center, which specifically works on capsular polysaccharide vaccine development against bacteria, such as Haemophilus influenzae type b (Hib), Neisseria meningitidis, and Streptococcus pneumoniae. As a member of a research team working on the Hib vaccine, he asks his senior colleague why capsular polysaccharides are conjugated to protein carriers like tetanus toxoid during vaccine development. Which of the following is the best response to this question? Options: (B) Conjugation with a protein carrier generates IgM dominant antibody responses (C) Polysaccharides conjugated with proteins are T cell-independent antigens (E) Conjugation with a protein carrier provides effective protection to infants (A) Conjugation with a protein carrier generates IgG2 dominant antibody responses (D) Conjugation with a protein carrier improves vaccine stability",
        "label": "E",
        "answer": "Conjugation with a protein carrier provides effective protection to infants",
        "options": {
            "A": "Conjugation with a protein carrier generates IgG2 dominant antibody responses",
            "B": "Conjugation with a protein carrier generates IgM dominant antibody responses",
            "C": "Polysaccharides conjugated with proteins are T cell-independent antigens",
            "D": "Conjugation with a protein carrier improves vaccine stability",
            "E": "Conjugation with a protein carrier provides effective protection to infants"
        },
        "response": {
            "0.0": "Let's analyze the options step by step.\n\nThe question is about the reason for conjugating capsular polysaccharides to protein carriers in vaccine development, particularly for bacteria like Haemophilus influenzae type b (Hib).\n\n1. **Understanding the Role of Protein Carriers**: Capsular polysaccharides are typically T cell-independent antigens, meaning they do not elicit a strong immune response on their own, especially in infants. By conjugating these polysaccharides to a protein carrier, the immune response can be enhanced.\n\n2. **Immune Response**: The conjugation allows the polysaccharide to be presented to T cells, which in turn helps stimulate a more robust immune response, including the production of IgG antibodies. This is particularly important for infants, who may not respond adequately to polysaccharide-only vaccines.\n\n3. **Evaluating the Options**:\n   - (B) Conjugation with a protein carrier generates IgM dominant antibody responses: This is incorrect; the goal is to generate IgG responses.\n   - (C) Polysaccharides conjugated with proteins are T cell-independent antigens: This is incorrect; conjugation makes them T cell-dependent.\n   - (E) Conjugation with a protein carrier provides effective protection to infants: This is true, but it doesn't directly address the mechanism of why conjugation is done.\n   - (A) Conjugation with a protein carrier generates IgG2 dominant antibody responses: This is a strong candidate because it highlights the type of immune response generated.\n   - (D) Conjugation with a protein carrier improves vaccine stability: While this may be a benefit, it is not the primary reason for conjugation in the context of immune response.\n\nGiven this analysis, the best response to the medical student's question is:\n\n**Answer: (A) Conjugation with a protein carrier generates IgG2 dominant antibody responses.**"
        },
        "api_calls": 4
    },
    {
        "question": "A 45-year-old male with a history of diabetes and poorly controlled hypertension presents to his primary care physician for an annual check-up. He reports that he feels well and has no complaints. He takes enalapril and metformin. His temperature is 98.8\u00b0F (37.1\u00b0C), blood pressure is 155/90 mmHg, pulse is 80/min, and respirations are 16/min. His physician adds another anti-hypertensive medication to the patient\u2019s regimen. One month later, the patient returns to the physician complaining of new onset lower extremity swelling. Which of the following medications was likely prescribed to this patient? Options: (B) Verapamil (E) Spironolactone (D) Hydrochlorthiazide (A) Metoprolol (C) Nifedipine",
        "label": "C",
        "answer": "Nifedipine",
        "options": {
            "A": "Metoprolol",
            "B": "Verapamil",
            "C": "Nifedipine",
            "D": "Hydrochlorthiazide",
            "E": "Spironolactone"
        },
        "response": {
            "0.0": "Let's analyze the situation step by step.\n\n1. **Patient Background**: The patient is a 45-year-old male with a history of diabetes and poorly controlled hypertension. He is currently on enalapril (an ACE inhibitor) and metformin (for diabetes).\n\n2. **Blood Pressure**: His blood pressure is still elevated at 155/90 mmHg, indicating that his hypertension is not well controlled.\n\n3. **New Medication**: The physician adds another antihypertensive medication to his regimen.\n\n4. **Follow-Up Symptoms**: One month later, the patient presents with new onset lower extremity swelling (edema).\n\n5. **Medication Options**:\n   - (A) Metoprolol: A beta-blocker, which typically does not cause peripheral edema.\n   - (B) Verapamil: A calcium channel blocker that can cause peripheral edema but is less commonly used as a first-line agent for hypertension.\n   - (C) Nifedipine: A dihydropyridine calcium channel blocker that is known to cause peripheral edema as a side effect.\n   - (D) Hydrochlorothiazide: A thiazide diuretic, which can cause electrolyte imbalances but is less likely to cause peripheral edema.\n   - (E) Spironolactone: A potassium-sparing diuretic that can cause some fluid retention but is not typically associated with significant peripheral edema.\n\n6. **Conclusion**: Given that the patient developed lower extremity swelling after the addition of a new antihypertensive medication, the most likely medication prescribed is **(C) Nifedipine**, as it is known to cause peripheral edema as a common side effect.\n\n**Answer: (C) Nifedipine**"
        },
        "api_calls": 4
    },
    {
        "question": "A 42-year-old man presents to his primary care physician for a follow-up visit. He has type 1 diabetes mellitus, for which he takes insulin. He complains of frequent episodes of waking up in the middle of his sleep. When he wakes up, he feels excessive sweating, hand tremors, and weakness. His morning blood glucose is high on repeated measurement. Which of the following is the optimal intervention for this patient condition? Options: (C) Adding pramlintide (B) Adding diazepam (A) Reassurance (D) Increasing daily insulin dose (E) Reducing daily insulin dose",
        "label": "E",
        "answer": "Reducing daily insulin dose",
        "options": {
            "A": "Reassurance",
            "B": "Adding diazepam",
            "C": "Adding pramlintide",
            "D": "Increasing daily insulin dose",
            "E": "Reducing daily insulin dose"
        },
        "response": {
            "0.0": "Let's analyze the situation step by step. \n\nThe patient is a 42-year-old man with type 1 diabetes mellitus who experiences symptoms suggestive of hypoglycemia during the night, such as excessive sweating, hand tremors, and weakness. These symptoms indicate that he may be experiencing nocturnal hypoglycemia, which can lead to high blood glucose levels in the morning due to the body's counter-regulatory response (the dawn phenomenon).\n\nGiven this context, the optimal intervention would be to reduce the risk of hypoglycemia. Since the patient is waking up with symptoms of hypoglycemia and has high morning blood glucose levels, it suggests that he may be taking too much insulin, especially if he is experiencing these symptoms at night.\n\nTherefore, the most appropriate intervention would be:\n\n(E) Reducing daily insulin dose\n\nThis approach would help prevent nocturnal hypoglycemia and stabilize his blood glucose levels. \n\nAnswer: (E) Reducing daily insulin dose"
        },
        "api_calls": 4
    }
]