[
    {
        "question": "A 21-year-old male presents to his primary care provider for fatigue. He reports that he graduated from college last month and returned 3 days ago from a 2 week vacation to Vietnam and Cambodia. For the past 2 days, he has developed a worsening headache, malaise, and pain in his hands and wrists. The patient has a past medical history of asthma managed with albuterol as needed. He is sexually active with both men and women, and he uses condoms \u201cmost of the time.\u201d On physical exam, the patient\u2019s temperature is 102.5\u00b0F (39.2\u00b0C), blood pressure is 112/66 mmHg, pulse is 105/min, respirations are 12/min, and oxygen saturation is 98% on room air. He has tenderness to palpation over his bilateral metacarpophalangeal joints and a maculopapular rash on his trunk and upper thighs. Tourniquet test is negative. Laboratory results are as follows:\n\nHemoglobin: 14 g/dL\nHematocrit: 44%\nLeukocyte count: 3,200/mm^3\nPlatelet count: 112,000/mm^3\n\nSerum:\nNa+: 142 mEq/L\nCl-: 104 mEq/L\nK+: 4.6 mEq/L\nHCO3-: 24 mEq/L\nBUN: 18 mg/dL\nGlucose: 87 mg/dL\nCreatinine: 0.9 mg/dL\nAST: 106 U/L\nALT: 112 U/L\nBilirubin (total): 0.8 mg/dL\nBilirubin (conjugated): 0.3 mg/dL\n\nWhich of the following is the most likely diagnosis in this patient? Options: (D) Hepatitis A (A) Chikungunya (C) Epstein-Barr virus (B) Dengue fever (E) Typhoid fever",
        "label": "A",
        "answer": "Chikungunya",
        "options": {
            "A": "Chikungunya",
            "B": "Dengue fever",
            "C": "Epstein-Barr virus",
            "D": "Hepatitis A",
            "E": "Typhoid fever"
        },
        "response": {
            "0.3": "Based on the multidisciplinary team discussion and the reasoning provided by the experts, the most likely diagnosis for the 21-year-old male patient is (B) Dengue fever. \n\nThe consensus among the experts highlights the following key points:\n\n1. **Travel History**: The patient recently traveled to Vietnam and Cambodia, areas where dengue fever is endemic.\n\n2. **Clinical Presentation**: The patient exhibits classic symptoms of dengue fever, including high fever, headache, malaise, joint pain (arthralgia), and a maculopapular rash.\n\n3. **Laboratory Findings**: The patient has leukopenia (3,200/mm\u00b3) and thrombocytopenia (112,000/mm\u00b3), which are characteristic of dengue fever. The mildly elevated liver enzymes (AST and ALT) further support this diagnosis.\n\n4. **Differential Diagnosis**: While chikungunya was considered due to the joint pain, the combination of symptoms and laboratory findings, particularly the significant thrombocytopenia and leukopenia, aligns more closely with dengue fever. Other options like Hepatitis A, Typhoid fever, and Epstein-Barr virus were deemed less likely based on the clinical presentation.\n\nGiven the strong reasoning and agreement among the experts, the final decision is:\n\n**Final Answer: (B) Dengue fever**."
        },
        "difficulty": "intermediate",
        "api_calls": 10
    },
    {
        "question": "A 56-year-old man with a history of hypertension presents to his physician with progressive fatigue and new onset muscle cramps. He has had no recent changes to his medication regimen, which includes hydrochlorothiazide, lisinopril, and amlodipine. His temperature is 98.0\u00b0F (36.7\u00b0C), blood pressure is 174/111 mmHg, pulse is 70/min, respirations are 12/min, and oxygen saturation is 98% on room air. The patient's cardiopulmonary and abdominal exams are unremarkable. Laboratory values are ordered as seen below.\n\nSerum:\nNa+: 138 mEq/L\nCl-: 100 mEq/L\nK+: 3.3 mEq/L\nHCO3-: 33 mEq/L\nBUN: 20 mg/dL\nGlucose: 129 mg/dL\n\nWhat is the most likely underlying etiology of this patient's hypertension? Options: (C) Cortisol excess (E) Increased peripheral vascular resistance (D) Impaired kidney perfusion (B) Catecholamine-secreting mass (A) Aldosterone excess",
        "label": "A",
        "answer": "Aldosterone excess",
        "options": {
            "A": "Aldosterone excess",
            "B": "Catecholamine-secreting mass",
            "C": "Cortisol excess",
            "D": "Impaired kidney perfusion",
            "E": "Increased peripheral vascular resistance"
        },
        "response": {
            "0.3": "Let's analyze the information step by step.\n\n1. **Patient Profile**: The patient is a 56-year-old man with a history of hypertension, presenting with fatigue and muscle cramps. He is on hydrochlorothiazide, which is a diuretic that can cause electrolyte imbalances.\n\n2. **Vital Signs**: His blood pressure is significantly elevated at 174/111 mmHg, indicating poorly controlled hypertension.\n\n3. **Laboratory Values**:\n   - Sodium (Na+): 138 mEq/L (normal)\n   - Chloride (Cl-): 100 mEq/L (normal)\n   - Potassium (K+): 3.3 mEq/L (low, indicating hypokalemia)\n   - Bicarbonate (HCO3-): 33 mEq/L (elevated, indicating metabolic alkalosis)\n   - BUN: 20 mg/dL (slightly elevated)\n   - Glucose: 129 mg/dL (elevated, indicating possible insulin resistance or diabetes)\n\n4. **Symptoms**: The patient has muscle cramps, which can be associated with low potassium levels (hypokalemia).\n\n5. **Medication Review**: The patient is taking hydrochlorothiazide, which can cause hypokalemia and metabolic alkalosis. However, the presence of both hypertension and hypokalemia suggests a secondary cause of hypertension.\n\n6. **Possible Causes of Secondary Hypertension**:\n   - **Aldosterone excess (primary hyperaldosteronism)**: This condition leads to sodium retention, potassium loss (hypokalemia), and hypertension. The low potassium level and hypertension in this patient are consistent with this condition.\n   - **Cortisol excess (Cushing's syndrome)**: Can also cause hypertension and hypokalemia, but the metabolic alkalosis is more characteristic of primary hyperaldosteronism.\n   - **Catecholamine-secreting mass (pheochromocytoma)**: Would typically present with episodic hypertension and other symptoms, but hypokalemia is not a common feature.\n   - **Increased peripheral vascular resistance**: This is a common cause of primary hypertension but does not explain the hypokalemia.\n   - **Impaired kidney perfusion**: This could lead to secondary hypertension but is less likely to cause hypokalemia.\n\nGiven the combination of hypertension, hypokalemia, and metabolic alkalosis, the most likely underlying etiology of this patient's hypertension is:\n\n**Answer: (A) Aldosterone excess**"
        },
        "difficulty": "basic",
        "api_calls": 5
    },
    {
        "question": "A 47-year-old woman seeks evaluation at your office because she has had postcoital vaginal bleeding for the past 8 months with occasional intermenstrual watery, blood-tinged vaginal discharge. Her family history is negative for malignancies and inherited disorders. She is the result of a pregnancy complicated by numerous miscarriages in the 1960s, for which her mother received diethylstilbestrol. During a pelvic examination, you notice a polypoid mass on the anterior wall of the vagina. The bimanual examination is negative for adnexal masses. You suspect the presence of carcinoma and, therefore, send tissue samples to pathology, which confirmed the presence of malignant cells. Which of the following is the most likely malignant tumor in this patient? Options: (D) Verrucous carcinoma (C) Botryoid sarcoma (E) Squamous cell carcinoma (SCC) (A) Clear cell adenocarcinoma (B) Melanoma",
        "label": "A",
        "answer": "Clear cell adenocarcinoma",
        "options": {
            "A": "Clear cell adenocarcinoma",
            "B": "Melanoma",
            "C": "Botryoid sarcoma",
            "D": "Verrucous carcinoma",
            "E": "Squamous cell carcinoma (SCC)"
        },
        "response": {
            "0.3": "Based on the comprehensive evaluation of the patient's history, clinical presentation, and pathological findings, the most likely malignant tumor in this patient is **(A) Clear cell adenocarcinoma**.\n\nThis conclusion is supported by the following key points:\n\n1. **History of DES Exposure:** The patient has a significant history of in utero exposure to diethylstilbestrol (DES), which is a well-established risk factor for developing clear cell adenocarcinoma, particularly in the vaginal and cervical regions.\n\n2. **Clinical Symptoms:** The patient's symptoms of postcoital vaginal bleeding and intermenstrual blood-tinged discharge are classic indicators of potential malignancy, specifically aligning with the presentation of clear cell adenocarcinoma.\n\n3. **Pathological Findings:** The confirmation of malignant cells in the tissue samples further corroborates the suspicion of clear cell adenocarcinoma, which is consistent with the clinical and historical context.\n\n4. **Differential Diagnosis:** While other malignancies such as squamous cell carcinoma, verrucous carcinoma, and botryoid sarcoma were considered, they are less frequently associated with DES exposure and do not align as closely with the clinical presentation observed in this patient.\n\nIn summary, the combination of the patient's age, clinical symptoms, significant history of DES exposure, and histological confirmation of malignant cells strongly indicates clear cell adenocarcinoma as the most likely diagnosis."
        },
        "difficulty": "advanced",
        "api_calls": 28
    },
    {
        "question": "A 36-year-old man undergoes open reduction and internal fixation of a left femur fracture sustained after a motor vehicle collision. Three days after the surgery, he develops fever and redness around the surgical site. His temperature is 39.5\u00b0C (103.1\u00b0F). Physical examination shows purulent discharge from the wound with erythema of the surrounding skin. Wound culture of the purulent discharge shows gram-positive cocci in clusters. Treatment with oral dicloxacillin is initiated. Four days later, the patient continues to have high-grade fever, pain, and purulent discharge. Which of the following characteristics of the infecting organism best explains the failure to improve with antibiotic therapy? Options: (E) Adaptation in binding proteins (B) Presence of an impenetrable outer membrane (A) Secretion of a pyrogenic toxin (C) Ability to cleave \u03b2-lactam rings (D) Development of efflux pumps",
        "label": "E",
        "answer": "Adaptation in binding proteins",
        "options": {
            "A": "Secretion of a pyrogenic toxin",
            "B": "Presence of an impenetrable outer membrane",
            "C": "Ability to cleave \u03b2-lactam rings",
            "D": "Development of efflux pumps",
            "E": "Adaptation in binding proteins"
        },
        "response": {
            "0.3": "The best explanation for the failure to improve with antibiotic therapy in this case is:\n\n**(C) Ability to cleave \u03b2-lactam rings.**\n\nThis is due to the identified organism, Staphylococcus aureus, producing \u03b2-lactamase enzymes that degrade the \u03b2-lactam ring structure of dicloxacillin, rendering the antibiotic ineffective. This mechanism directly correlates with the patient's lack of response to treatment, as indicated by the ongoing high-grade fever, pain, and purulent discharge despite the administration of an appropriate antibiotic."
        },
        "difficulty": "advanced",
        "api_calls": 28
    },
    {
        "question": "A 59-year-old man is brought to the emergency department with a history of black, tarry stools but denies vomiting of blood or abdominal pain. His family has noticed progressive confusion. History is significant for liver cirrhosis and alcoholism. His heart rate is 112/min, temperature is 37.1\u00b0C (98.7\u00b0F), and blood pressure is 110/70 mm Hg. On examination, he is jaundiced, lethargic, is oriented to person and place but not date, and has moderate ascites. Neurological examination reveals asterixis, and his stool is guaiac-positive. Liver function test are shown below:\nTotal albumin 2 g/dL\nProthrombin time 9 seconds\nTotal bilirubin 5 mg/dL\nAlanine aminotransferase (ALT) 100 U/L\nAspartate aminotransferase (AST) 220 U/L\nWhich of the following is a feature of this patient condition? Options: (A) It carries a good prognosis (D) It only occurs in patients with cirrhosis (E) Electroencephalography (EEG) usually shows focal localising abnormality (B) Ammonia level is the best initial test to confirm the diagnosis (C) It is a diagnosis of exclusion",
        "label": "C",
        "answer": "It is a diagnosis of exclusion",
        "options": {
            "A": "It carries a good prognosis",
            "B": "Ammonia level is the best initial test to confirm the diagnosis",
            "C": "It is a diagnosis of exclusion",
            "D": "It only occurs in patients with cirrhosis",
            "E": "Electroencephalography (EEG) usually shows focal localising abnormality"
        },
        "response": {
            "0.3": "Based on the comprehensive analysis and findings from the multidisciplinary team discussions regarding hepatic encephalopathy (HE), the most appropriate answer to the question regarding the features of this patient's condition is:\n\n**None of the options (A), (B), (C), (D), or (E) accurately describe the condition.**\n\nHowever, if we must select the least incorrect option from the provided choices, it would be:\n\n**(C) It is a diagnosis of exclusion.**\n\nThis option is the least incorrect because while HE is primarily diagnosed based on clinical criteria, it is important to rule out other potential causes of altered mental status. However, it is crucial to clarify that HE is not merely a diagnosis of exclusion; it requires a comprehensive clinical assessment.\n\nTo summarize:\n- **(A)** is incorrect because HE is associated with a poor prognosis, especially in patients with advanced liver disease.\n- **(B)** is incorrect as ammonia levels are not the best initial test for diagnosis; clinical assessment is more critical.\n- **(C)** is misleading as HE is not solely a diagnosis of exclusion but requires clinical criteria for diagnosis.\n- **(D)** is incorrect because HE can occur in patients without cirrhosis.\n- **(E)** is incorrect as EEG findings typically show diffuse slowing, not focal abnormalities.\n\nThus, while (C) is the least incorrect, it is essential to understand the nuances of HE diagnosis and management."
        },
        "difficulty": "advanced",
        "api_calls": 27
    },
    {
        "question": "A 30-year-old man presents to his primary care physician with complaints of excessive fatigue and weakness for the last several weeks. He also complains of abdominal pain and constipation for the same duration. On further questioning, he reports that he has lost 8 pounds in the last 2 weeks. Past medical history and family history are insignificant. His temperature is 37.3\u00b0 C (99.2\u00b0 F), respirations are 21/min, pulse is 63/min, and blood pressure is 99/70 mm Hg. On physical examination, he is a tired-appearing, thin male. He has a bronze discoloration to his skin, but he denies being outside in the sun or any history of laying in tanning beds. What is the next best step in the management of this patient? Options: (D) Start him on both hydrocortisone and fludrocortisone therapy (E) Order an ACTH stimulation test (C) Start him on androgen replacement treatment (B) Administer intravenous fludrocortisone (A) Administer intravenous hydrocortisone",
        "label": "D",
        "answer": "Start him on both hydrocortisone and fludrocortisone therapy",
        "options": {
            "A": "Administer intravenous hydrocortisone",
            "B": "Administer intravenous fludrocortisone",
            "C": "Start him on androgen replacement treatment",
            "D": "Start him on both hydrocortisone and fludrocortisone therapy",
            "E": "Order an ACTH stimulation test"
        },
        "response": {
            "0.3": "After reviewing the conversation history and the reasoning provided by the experts, it is clear that there are differing opinions on the next best step in the management of this patient with suspected primary adrenal insufficiency.\n\nThe endocrinologist emphasizes the urgency of the situation, particularly given the patient's hypotension and the potential risk of an adrenal crisis. They advocate for immediate treatment with intravenous hydrocortisone to stabilize the patient and manage any acute adrenal insufficiency.\n\nOn the other hand, both the gastroenterologist and the internal medicine physician argue for the necessity of confirming the diagnosis through an ACTH stimulation test before initiating treatment. They highlight the importance of accurately diagnosing the condition to ensure appropriate management.\n\nIn this case, while the immediate treatment with hydrocortisone is critical in the context of a potential adrenal crisis, the consensus among the gastroenterologist and internal medicine physician suggests that confirming the diagnosis with an ACTH stimulation test is also an essential step. However, the presence of hypotension and symptoms indicative of adrenal insufficiency may necessitate immediate intervention.\n\nConsidering the urgency of the clinical presentation, particularly the hypotension and the risk of an adrenal crisis, the final decision should prioritize immediate treatment. Therefore, the best course of action is to administer intravenous hydrocortisone to stabilize the patient while also planning to confirm the diagnosis with further testing.\n\nFinal Answer: (A) Administer intravenous hydrocortisone."
        },
        "difficulty": "intermediate",
        "api_calls": 10
    },
    {
        "question": "A 58-year-old white man with hypertension and type 2 diabetes mellitus comes to the physician because of a 3-month history of a painless lesion on his lower lip. He has smoked one pack of cigarettes daily for 20 years. He has worked as a fruit picker for the past 25 years. His current medications include captopril and metformin. Examination of the oral cavity shows a single ulcer near the vermillion border. Which of the following is the most likely diagnosis? Options: (A) Squamous cell carcinoma (C) Aphthous stomatitis (E) Traumatic ulcer (D) Actinic keratosis (B) Herpes labialis",
        "label": "A",
        "answer": "Squamous cell carcinoma",
        "options": {
            "A": "Squamous cell carcinoma",
            "B": "Herpes labialis",
            "C": "Aphthous stomatitis",
            "D": "Actinic keratosis",
            "E": "Traumatic ulcer"
        },
        "response": {
            "0.3": "The final decision, based on the consensus and reasoning provided by the multidisciplinary team, is:\n\n**Answer: (A) Squamous cell carcinoma.**\n\nThe reasoning is well-supported by the patient's risk factors, the characteristics of the lesion, and the duration of its presence. All experts agree that the painless ulcer on the lower lip, particularly near the vermillion border, aligns with the presentation of squamous cell carcinoma, especially given the patient's history of smoking and sun exposure. Other potential diagnoses have been effectively ruled out based on their clinical features. Therefore, further evaluation, including a biopsy, is warranted to confirm the diagnosis and guide management."
        },
        "difficulty": "intermediate",
        "api_calls": 10
    },
    {
        "question": "A 46-year-old woman comes to the physician because of severe muscle and joint pain for 5 months. The pain varies in location and intensity. She also has joint stiffness in the morning and reports fatigue throughout the day that she attributes to not sleeping well. She reports a tingling sensation in her lower limbs. Her bowel habits are unchanged but she often feels bloated. She has primary hypertension and occasional migraine headaches. She does not smoke or consume alcohol. Her medications include propranolol and sumatriptan. She appears healthy. Examination shows symmetric muscular tenderness at the base of the neck, over the shoulders, and in the lumbosacral area. Strength and deep tendon reflexes are normal. Laboratory studies show:\nHemoglobin 14.3 g/dL\nLeukocyte count 9300/mm3\nPlatelet count 230,000/mm3\nMean corpuscular volume 85 \u03bcm3\nErythrocyte sedimentation rate 12 mm/h\nSerum\nGlucose 92 mg/dL\nCreatinine 0.6 mg/dL\nTSH 3.1 \u03bcU/mL\nUrinalysis is within normal limits. Which of the following is the most appropriate therapy for this patient?\" Options: (A) Bupropion (D) Amitriptyline (C) Vitamin B12 (B) Temazepam (E) Methotrexate\n\"",
        "label": "D",
        "answer": "Amitriptyline",
        "options": {
            "A": "Bupropion",
            "B": "Temazepam",
            "C": "Vitamin B12",
            "D": "Amitriptyline",
            "E": "Methotrexate\n\""
        },
        "response": {
            "0.3": "The multidisciplinary team has reached a consensus on the diagnosis of fibromyalgia based on the patient's symptoms, examination findings, and laboratory results. All experts agree that the most appropriate therapy for this condition is Amitriptyline, a tricyclic antidepressant that is effective in managing chronic pain and sleep disturbances associated with fibromyalgia.\n\nThe reasoning provided by each expert highlights the inappropriateness of the other options in addressing the patient's primary symptoms. Bupropion, Temazepam, Vitamin B12, and Methotrexate do not align with the treatment goals for fibromyalgia or the specific symptoms presented by the patient.\n\nGiven the strong agreement among the experts and the quality of their reasoning, the final decision is:\n\n**D) Amitriptyline**."
        },
        "difficulty": "intermediate",
        "api_calls": 10
    },
    {
        "question": "A 40-year-old businessman who was previously well is brought into the emergency department by his assistant with a complaint of left-sided weakness after a chiropractic neck manipulation. He has never felt like this before. Past medical history is insignificant. His blood pressure is 125/75 mm Hg, pulse 86/min, respiratory rate 13/min, temperature 36.8\u00b0C (98.2\u00b0F). A T2-weighted MRI shows a left C5 hemicord lesion. The patient is treated with cervical immobilization, a course of steroids, and physical therapy. What other finding will most likely be seen in this patient? Options: (C) Contralateral corticospinal tract involvement (D) Right-sided analgesia (E) Contralateral loss of vibration and proprioception (B) Right-sided Horner's syndrome (A) Spastic paralysis at the level of lesion",
        "label": "D",
        "answer": "Right-sided analgesia",
        "options": {
            "A": "Spastic paralysis at the level of lesion",
            "B": "Right-sided Horner's syndrome",
            "C": "Contralateral corticospinal tract involvement",
            "D": "Right-sided analgesia",
            "E": "Contralateral loss of vibration and proprioception"
        },
        "response": {
            "0.3": "Based on the comprehensive analysis of the patient's condition, the most likely finding in this patient with a left C5 hemicord lesion indicative of Brown-S\u00e9quard syndrome is:\n\n**(D) Right-sided analgesia.**\n\nThis conclusion is drawn from the understanding that the left C5 hemicord lesion will result in:\n- **Ipsilateral effects** (left side): Motor weakness and loss of proprioception and vibration sense due to damage to the corticospinal tract and dorsal columns.\n- **Contralateral effects** (right side): Loss of pain and temperature sensation (analgesia) due to disruption of the spinothalamic tract.\n\nThe other options provided do not accurately reflect the expected neurological deficits associated with this condition:\n- **(C) Contralateral corticospinal tract involvement**: Incorrect; the effects are ipsilateral.\n- **(E) Contralateral loss of vibration and proprioception**: Incorrect; these sensations are lost on the same side as the lesion.\n- **(B) Right-sided Horner's syndrome**: Incorrect; this syndrome is not typical for a C5 lesion.\n- **(A) Spastic paralysis at the level of the lesion**: Incorrect; spasticity is not a prominent feature at the lesion level in Brown-S\u00e9quard syndrome.\n\nTherefore, the correct answer is (D) Right-sided analgesia."
        },
        "difficulty": "advanced",
        "api_calls": 28
    },
    {
        "question": "A 29-year-old man is brought to the emergency department by a concerned neighbor. The patient appears disheveled, has a flat affect, and appears to be having auditory hallucinations. He is alert and oriented to time, person, and place and has an intact long-term and short-term memory. His neighbor says that he never really knew the patient that well and that he mostly kept to himself. They have been neighbors for the past 3 years at an apartment close to the hospital. What worried the neighbor was a sudden change in the patient's behavior which started last week. He suddenly seemed interested in attending all the local council meetings and social gatherings. He is very talkative at these events and boasts highly of himself and starts suggesting changes that the committee could make with his help. He gets very agitated when they deny accepting his suggestions. Which of the following is a predictor of good prognosis for this patient's condition? Options: (B) Slow onset (E) Negative symptoms (A) Affective symptoms (C) Being single (D) Male sex",
        "label": "A",
        "answer": "Affective symptoms",
        "options": {
            "A": "Affective symptoms",
            "B": "Slow onset",
            "C": "Being single",
            "D": "Male sex",
            "E": "Negative symptoms"
        },
        "response": {
            "0.3": "To analyze the scenario step by step:\n\n1. The patient is exhibiting signs of a possible manic episode, characterized by increased talkativeness, grandiosity, and agitation when his suggestions are not accepted. This suggests a mood disorder, possibly bipolar disorder.\n\n2. In terms of prognosis for mood disorders, particularly bipolar disorder, certain factors can influence the outcome.\n\n3. Looking at the options provided:\n   - (B) Slow onset: Generally, a slower onset can be associated with a worse prognosis in mood disorders.\n   - (E) Negative symptoms: Negative symptoms (such as lack of motivation or flat affect) are typically associated with poorer outcomes, particularly in schizophrenia.\n   - (A) Affective symptoms: The presence of affective symptoms (mood-related symptoms) can indicate a more favorable prognosis, especially if they are prominent and episodic.\n   - (C) Being single: Being single is often associated with a poorer prognosis in mental health conditions due to potential lack of support.\n   - (D) Male sex: While sex can influence the prevalence of certain disorders, it is not a strong predictor of prognosis.\n\n4. Among these options, (A) Affective symptoms would be the most relevant predictor of a good prognosis, as the presence of clear mood symptoms (like those seen in bipolar disorder) often correlates with a better treatment response and overall prognosis.\n\nTherefore, the best answer is:\n**Answer: (A) Affective symptoms**"
        },
        "difficulty": "basic",
        "api_calls": 5
    },
    {
        "question": "A 26-year-old man with no significant past medical history presents to the ED following a motor vehicle accident. Vital signs on presentation are T 99.0 F, BP 100/60 mmHg, HR 125 bpm, RR 16/min, SpO2 98% on room air. He complains of extreme abdominal pain worse in the left upper quadrant which has worsened over the past 30 minutes. Exam demonstrates abdominal wall rigidity, involuntary guarding, and tenderness on light percussion. Bedside sonography shows evidence for hemoperitoneum. Despite administering more intravenous fluids, repeat vitals are T 98.9 F, BP 82/50 mm hg, HR 180 bpm, RR 20/min, SpO2 97% on room air. Which of the following is the best next step? Options: (D) Abdominal plain film (B) CT abdomen and pelvis (A) Normal saline bolus and re-evaluation of hemodynamics after infusion (C) Morphine (E) Exploratory laparotomy",
        "label": "E",
        "answer": "Exploratory laparotomy",
        "options": {
            "A": "Normal saline bolus and re-evaluation of hemodynamics after infusion",
            "B": "CT abdomen and pelvis",
            "C": "Morphine",
            "D": "Abdominal plain film",
            "E": "Exploratory laparotomy"
        },
        "response": {
            "0.3": "Given the critical condition of the patient, characterized by severe abdominal pain, signs of peritonitis, and significant hemodynamic instability (hypotension and tachycardia), along with the confirmed presence of hemoperitoneum from bedside ultrasound, the best next step in management is:\n\n**(E) Exploratory laparotomy.**\n\nThis surgical intervention is necessary to directly assess and address the source of bleeding or injury, which is crucial for stabilizing the patient's condition and preventing further deterioration. Other options, such as imaging or fluid resuscitation alone, would not adequately address the urgent need for surgical intervention in this scenario."
        },
        "difficulty": "advanced",
        "api_calls": 28
    },
    {
        "question": "A 56-year-old man presents to the clinic complaining of subacute back pain for the past month. The pain is described as a dull, constant ache that is worse at night. He could not recall any precipitating event except for an amateur weight-lifting competition that he participated in 2 months ago. Past medical history is significant for non-small cell lung cancer that was diagnosed and successfully treated. A PET scan 1 year ago demonstrated no recurrence. Physical exam was unremarkable except for some point tenderness along the lumbosacral area. What is the most likely imaging finding in this patient? Options: (C) Lytic lesions of the lumbar spine (B) Bulging disc impinging on lumbar spinal nerve (A) Blastic lesions of the lumbar spine (E) Sacroilitis and fusion of the lumbar spine (D) Narrowing of the lumbar disc space",
        "label": "C",
        "answer": "Lytic lesions of the lumbar spine",
        "options": {
            "A": "Blastic lesions of the lumbar spine",
            "B": "Bulging disc impinging on lumbar spinal nerve",
            "C": "Lytic lesions of the lumbar spine",
            "D": "Narrowing of the lumbar disc space",
            "E": "Sacroilitis and fusion of the lumbar spine"
        },
        "response": {
            "0.3": "Based on the provided clinical information and the comprehensive evaluations from the multidisciplinary teams, the most likely imaging finding in this patient is **(C) Lytic lesions of the lumbar spine**.\n\n### Rationale:\n1. **History of Non-Small Cell Lung Cancer (NSCLC)**: The patient's significant medical history of NSCLC raises a high suspicion for metastatic disease, particularly to the spine, as lung cancer is known to commonly metastasize to bony structures.\n\n2. **Pain Characteristics**: The patient's back pain is described as dull, constant, and worsening at night, which is indicative of malignancy-related pain rather than mechanical back pain. Mechanical pain typically improves with rest, while cancer-related pain does not.\n\n3. **Imaging Considerations**: Previous imaging (PET scan) indicated no recurrence a year ago, but the emergence of new symptoms necessitates further imaging to rule out late recurrence or metastatic disease. In the context of lung cancer metastasis, lytic lesions are the most common findings in the spine.\n\n4. **Differential Diagnosis**: Other options such as bulging discs, blastic lesions, sacroiliitis, or narrowing of the lumbar disc space do not adequately correlate with the patient's cancer history or the specific characteristics of their pain.\n\nGiven these points, the conclusion drawn by the multidisciplinary teams aligns with the established patterns of metastasis associated with NSCLC, confirming that lytic lesions of the lumbar spine are the most likely imaging finding in this patient. Therefore, the answer is **(C) Lytic lesions of the lumbar spine**."
        },
        "difficulty": "advanced",
        "api_calls": 28
    },
    {
        "question": "A 22-year-old female college student is treated with metronidazole after presenting to student health services with itching, discharge, and pain in her vagina. At a party shortly afterward she experiences facial flushing, nausea, tachycardia, dyspnea, headache, and abdominal cramps after consuming alcohol. Serum levels of which of the following are likely elevated in this patient following alcohol consumption: Options: (A) Acetaldehyde (D) Triglycerides (C) Cytochrome P-450 enzymes (E) Amylase (B) Uric acid",
        "label": "A",
        "answer": "Acetaldehyde",
        "options": {
            "A": "Acetaldehyde",
            "B": "Uric acid",
            "C": "Cytochrome P-450 enzymes",
            "D": "Triglycerides",
            "E": "Amylase"
        },
        "response": {
            "0.3": "Let's think step by step. The patient is experiencing a reaction after consuming alcohol shortly after taking metronidazole. This reaction is consistent with disulfiram-like effects, which occur when alcohol is consumed in conjunction with certain medications, including metronidazole. \n\nWhen alcohol is consumed, it is metabolized to acetaldehyde by the enzyme alcohol dehydrogenase. Normally, acetaldehyde is further metabolized to acetic acid by aldehyde dehydrogenase. However, metronidazole inhibits aldehyde dehydrogenase, leading to the accumulation of acetaldehyde when alcohol is consumed. \n\nThe symptoms of facial flushing, nausea, tachycardia, dyspnea, headache, and abdominal cramps are all indicative of this accumulation of acetaldehyde, which is responsible for the unpleasant effects experienced.\n\nTherefore, the serum levels of acetaldehyde are likely elevated in this patient following alcohol consumption.\n\nAnswer: (A) Acetaldehyde"
        },
        "difficulty": "basic",
        "api_calls": 5
    },
    {
        "question": "A stillborn infant is delivered at 38 weeks' gestation to a 32-year-old woman. The mother had no prenatal care. Examination of the stillborn shows a small pelvis, shallow intergluteal cleft, and club feet. An x-ray shows the absence of the sacrum and lumbar vertebrae. Which of the following is the strongest predisposing factor for this patient's condition? Options: (A) Maternal oligohydramnios (B) Intrauterine alcohol exposure (C) Chromosome 13 trisomy (D) Maternal diabetes (E) Chromosome 18 trisomy",
        "label": "D",
        "answer": "Maternal diabetes",
        "options": {
            "A": "Maternal oligohydramnios",
            "B": "Intrauterine alcohol exposure",
            "C": "Chromosome 13 trisomy",
            "D": "Maternal diabetes",
            "E": "Chromosome 18 trisomy"
        },
        "response": {
            "0.3": "The strongest predisposing factor for the stillborn infant's condition, given the findings of a small pelvis, shallow intergluteal cleft, club feet, and the absence of the sacrum and lumbar vertebrae, is (A) Maternal oligohydramnios. \n\nThe evidence from the multidisciplinary team assessments consistently points to oligohydramnios as the primary contributor to the observed congenital anomalies. Insufficient amniotic fluid is known to lead to significant developmental issues, including skeletal deformities, which align closely with the physical findings in this case. Other factors such as intrauterine alcohol exposure and chromosomal abnormalities were considered but found to have a weaker correlation with the specific anomalies observed. \n\nTherefore, the correct answer is:\n\n**(A) Maternal oligohydramnios**."
        },
        "difficulty": "advanced",
        "api_calls": 28
    },
    {
        "question": "A 52-year-old man is brought to the emergency department for recurrent vomiting that began 5 hours ago. He describes the vomitus as bloody and containing black specks. He drinks 10\u201312 beers daily and has not seen a physician in 15 years. He appears pale. His temperature is 36.7\u00b0C (98.1\u00b0F), pulse is 122/min, and blood pressure is 85/59 mm Hg. Physical examination shows decreased radial pulses, delayed capillary refill, multiple spider angiomata, and a distended abdomen. He is oriented to person but not to place or time. Which of the following is most likely decreased in this patient in response to his current condition compared to a healthy adult? Options: (E) Cardiac inotropy (D) Pulmonary vascular resistance (A) Systemic vascular resistance (B) Fractional tissue oxygen extraction (C) Carotid baroreceptor firing activity",
        "label": "C",
        "answer": "Carotid baroreceptor firing activity",
        "options": {
            "A": "Systemic vascular resistance",
            "B": "Fractional tissue oxygen extraction",
            "C": "Carotid baroreceptor firing activity",
            "D": "Pulmonary vascular resistance",
            "E": "Cardiac inotropy"
        },
        "response": {
            "0.3": "The most likely parameter that is decreased in this patient in response to his current condition, compared to a healthy adult, is **(C) Carotid baroreceptor firing activity**.\n\n### Rationale:\n1. **Carotid Baroreceptor Firing Activity**: The patient is experiencing hypotension (blood pressure of 85/59 mm Hg), which leads to decreased arterial wall tension. This results in a reduction in the firing activity of the carotid baroreceptors, which are responsible for sensing changes in arterial pressure. This decrease is significant in the context of shock and reflects the body's impaired ability to detect and respond to low blood pressure.\n\n2. **Other Options**:\n   - **Cardiac Inotropy (E)**: While there may be some decrease in cardiac contractility due to shock, compensatory mechanisms often maintain a level of inotropy, making this less significant in this context.\n   - **Pulmonary Vascular Resistance (D)**: This is likely to increase in response to hypoxia or acidosis, rather than decrease.\n   - **Systemic Vascular Resistance (A)**: In hypovolemic shock, systemic vascular resistance may not significantly decrease and can even increase as the body attempts to maintain perfusion to vital organs.\n   - **Fractional Tissue Oxygen Extraction (B)**: This parameter typically increases during shock states as the body strives to optimize oxygen delivery to tissues facing hypoperfusion.\n\n### Conclusion:\nGiven the patient's presentation and the physiological responses associated with his condition, the most critical change is the decrease in carotid baroreceptor firing activity, which is consistent with the state of hypotension and shock he is experiencing."
        },
        "difficulty": "advanced",
        "api_calls": 28
    },
    {
        "question": "A 14-year-old boy presents with right upper quadrant abdominal pain and is found on ultrasound to have a gallstone. Based on clinical suspicion, a CBC, a Coombs test, and a bilirubin panel are obtained to determine the etiology of the gallstone. These tests reveal a mild normocytic anemia with associated reticulocytosis as well as an increased RDW. In addition there is an indirect hyperbilirubinemia and the Coombs test results are negative. To confirm the diagnosis, an osmotic fragility test is performed which shows increased fragility in hypotonic solution. In this patient, what findings would most likely be anticipated if a blood smear were obtained? Options: (B) Schistocytes (C) Sideroblasts (D) Spherocytes (E) Dacrocytes (A) Hypersegmented neutrophils",
        "label": "D",
        "answer": "Spherocytes",
        "options": {
            "A": "Hypersegmented neutrophils",
            "B": "Schistocytes",
            "C": "Sideroblasts",
            "D": "Spherocytes",
            "E": "Dacrocytes"
        },
        "response": {
            "0.3": "Based on the consensus among the experts and the quality of their reasoning, the final answer to the question regarding the anticipated findings on a blood smear for the 14-year-old boy with suspected hereditary spherocytosis is:\n\n(D) Spherocytes. \n\nAll experts agree that the clinical findings and laboratory results point towards hereditary spherocytosis, which is characterized by the presence of spherocytes on a blood smear due to defects in the red blood cell membrane."
        },
        "difficulty": "intermediate",
        "api_calls": 10
    },
    {
        "question": "A 34-year-old woman presents to the plastic surgery office 3 months following a rhinoplasty procedure. The patient has been recovering well. However, she has noticed a small whistling noise when she respires through her nose, which you appreciate on physical exam. Which of the following is the most likely cause of this phenomenon? Options: (E) A fracture of the bony septum (A) Post-operative swelling (C) A deviated septum that is now straight, resulting in altered nasal airflow (D) Excessive columellar show resulting in increased nasal airflow (B) A septal hematoma causing a perforation",
        "label": "B",
        "answer": "A septal hematoma causing a perforation",
        "options": {
            "A": "Post-operative swelling",
            "B": "A septal hematoma causing a perforation",
            "C": "A deviated septum that is now straight, resulting in altered nasal airflow",
            "D": "Excessive columellar show resulting in increased nasal airflow",
            "E": "A fracture of the bony septum"
        },
        "response": {
            "0.3": "After reviewing the conversation history and the final answers provided by the multidisciplinary team, it is clear that there is a strong consensus among the experts regarding the cause of the whistling noise experienced by the patient following her rhinoplasty.\n\nThe plastic surgeon, otolaryngologist, and pulmonologist all agree that the most likely cause of the whistling noise is **(C) a deviated septum that is now straight, resulting in altered nasal airflow**. This conclusion is supported by their discussions on how surgical correction of a deviated septum can lead to changes in airflow dynamics, which may manifest as sounds during respiration.\n\nWhile the possibility of a septal hematoma causing a perforation was initially considered, the experts collectively deemed it less likely due to the patient's smooth recovery and the absence of acute symptoms typically associated with such complications.\n\nGiven the quality of reasoning and the consensus reached by the team, the final decision is:\n\n**(C) A deviated septum that is now straight, resulting in altered nasal airflow.**"
        },
        "difficulty": "intermediate",
        "api_calls": 21
    },
    {
        "question": "Background:\nSome patients with severe asthma have frequent exacerbations associated with persistent eosinophilic inflammation despite continuous treatment with high-dose inhaled glucocorticoids with or without oral glucocorticoids.\nMethods:\nIn this randomized, double-blind clinical trial we assigned 576 patients with recurrent asthma exacerbations and evidence of eosinophilic inflammation despite high doses of inhaled glucocorticoids to one of three study groups. Patients were assigned to receive mepolizumab, a humanized monoclonal antibody against interleukin-5, which was administered as either a 75-mg intravenous dose or a 100-mg subcutaneous dose or placebo every 4 weeks for 32 weeks. The primary outcome was the rate of exacerbations. Other outcomes included the forced expiratory volume in 1 second (FEV1) and scores on the St. George\u2019s Respiratory Questionnaire (SGRQ) and the 5-item Asthma Control Questionnaire (ACQ-5).\nResults:\nThe rate of exacerbations was reduced by 47% (95% confidence interval [CI], 29 to 61) among patients receiving intravenous mepolizumab and by 53% (95% CI, 37 to 65) among those receiving subcutaneous mepolizumab, as compared with those receiving placebo (p<0.001 for both comparisons). Exacerbations necessitating an emergency department visit or hospitalization were reduced by 32% in the group receiving intravenous mepolizumab and by 61% in the group receiving subcutaneous mepolizumab. At week 32, the mean increase from baseline in FEV1 was 100 ml greater in patients receiving intravenous mepolizumab than in those receiving placebo (p=0.02) and 98 ml greater in patients receiving subcutaneous mepolizumab than in those receiving placebo (p=0.03). The improvement from baseline in the SGRQ score was 6.4 points and 7.0 points greater in the intravenous and subcutaneous mepolizumab groups, respectively than in the placebo group, and the improvement in the ACQ-5 score was 0.42 points and 0.44 points greater in the two mepolizumab groups, respectively than in the placebo group (p<0.001 for all comparisons).\nConclusions:\nMepolizumab administered either intravenously or subcutaneously significantly reduced asthma exacerbations and was associated with improvements in markers of asthma control.\nGiven the original research abstract above, which of the following would be true if the authors had inadvertently encountered a type 1 error? Options: (A) A type 1 error means the study is not significantly powered to detect a true difference between study groups. (B) A type 1 error occurs when the null hypothesis is true but is rejected in error. (C) A type 1 error occurs when the null hypothesis is false, yet is accepted in error. (E) A type 1 error is dependent on the confidence interval of a study. (D) A type 1 error is a beta (\u03b2) error and is usually 0.1 or 0.2.",
        "label": "B",
        "answer": "A type 1 error occurs when the null hypothesis is true but is rejected in error.",
        "options": {
            "A": "A type 1 error means the study is not significantly powered to detect a true difference between study groups.",
            "B": "A type 1 error occurs when the null hypothesis is true but is rejected in error.",
            "C": "A type 1 error occurs when the null hypothesis is false, yet is accepted in error.",
            "D": "A type 1 error is a beta (\u03b2) error and is usually 0.1 or 0.2.",
            "E": "A type 1 error is dependent on the confidence interval of a study."
        },
        "response": {
            "0.3": "The final answer to the question regarding what would be true if the authors had inadvertently encountered a type 1 error is:\n\n(B) A type 1 error occurs when the null hypothesis is true but is rejected in error.\n\nThis conclusion is supported by the consensus among the experts, who all correctly identified that a type 1 error, or false positive, occurs when a study mistakenly concludes that there is a significant effect or difference when, in reality, there is none. The reasoning provided by the experts also effectively clarifies why the other options do not accurately describe a type 1 error."
        },
        "difficulty": "intermediate",
        "api_calls": 10
    },
    {
        "question": "A 61-year-old man with schizophrenia in a locked inpatient psychiatry unit was observed making an unusual smacking motion with his lips, pursing his mouth, and blinking excessively. These symptoms started slowly about 2 weeks ago and have become more pronounced, but they do not seem to bother the patient. He resides in an inpatient psychiatric facility where he has been successfully treated with haloperidol for the past several months. His physical exam and vitals are within normal limits. Which of the following accurately describes his symptoms? Options: (B) Tardive dyskinesia (A) Akathisia (D) Pseudoparkinsonism (C) Acute dystonia (E) Palsy",
        "label": "B",
        "answer": "Tardive dyskinesia",
        "options": {
            "A": "Akathisia",
            "B": "Tardive dyskinesia",
            "C": "Acute dystonia",
            "D": "Pseudoparkinsonism",
            "E": "Palsy"
        },
        "response": {
            "0.3": "Based on the conversation history and the consensus among the experts, the final decision is:\n\n**(B) Tardive dyskinesia.**\n\nAll experts \u2014 the psychiatrist, neurologist, and pharmacologist \u2014 agree that the symptoms described are characteristic of tardive dyskinesia, particularly given the patient's history of treatment with haloperidol. They have provided clear reasoning that aligns with the clinical presentation, including the slow onset of symptoms and their non-distressing nature to the patient. Therefore, the diagnosis of tardive dyskinesia is supported by the collective expertise and reasoning presented in the discussion."
        },
        "difficulty": "intermediate",
        "api_calls": 10
    },
    {
        "question": "A 21-month-old boy is brought to the physician for a well-child examination. His mother noticed deformities in both of his legs since he started walking independently. He has been healthy apart from an upper respiratory tract infection 6 months ago. He was delivered at 38 weeks' gestation. His 6-year-old sister was treated for developmental dysplasia of the hip. He can kick a ball and say a 2-word phrase. He plays well with other children at his day care. His immunizations are up-to-date. He is at the 40th percentile for height and 50th percentile for weight. Vital signs are within normal limits. Examination shows closed anterior and posterior fontanelles. The knees do not stay together when both the feet and ankles are placed together. The gait is unremarkable. The mother is concerned that he has a growth disorder. Which of the following is the most appropriate next step in management? Options: (E) Tibial osteotomy (B) Reassurance and follow-up (D) Bracing of the lower extremities (C) X-ray of the lower extremities (A) Vitamin D supplementation",
        "label": "B",
        "answer": "Reassurance and follow-up",
        "options": {
            "A": "Vitamin D supplementation",
            "B": "Reassurance and follow-up",
            "C": "X-ray of the lower extremities",
            "D": "Bracing of the lower extremities",
            "E": "Tibial osteotomy"
        },
        "response": {
            "0.3": "Let's think step by step. The child is a 21-month-old boy who has deformities in both legs that have been noticed since he started walking. The examination reveals that the knees do not stay together when the feet and ankles are placed together, which suggests a possible condition like genu varum (bowleggedness), which is common in toddlers and often resolves on its own as they grow.\n\nGiven that the child is otherwise healthy, has normal developmental milestones, and is within normal growth percentiles, the most appropriate next step in management would be reassurance and follow-up. In many cases, bowleggedness in toddlers is a normal variant and does not require immediate intervention unless there are significant concerns or associated symptoms.\n\nTherefore, the most appropriate next step in management is:\n(B) Reassurance and follow-up."
        },
        "difficulty": "basic",
        "api_calls": 5
    },
    {
        "question": "A 60-year-old female patient with a history of hypertension presents to an outpatient office for regular check-up and is found to have hypertriglyceridemia. Her physician prescribes high-dose niacin and recommends taking the medication along with aspirin. The side effect the physician is trying to avoid is thought to be mediated by what mechanism? Options: (C) Release of prostaglandins (A) Bile deposition in the dermis (B) Immune complex formation (D) Mast cell degranulation (E) T cell activation",
        "label": "C",
        "answer": "Release of prostaglandins",
        "options": {
            "A": "Bile deposition in the dermis",
            "B": "Immune complex formation",
            "C": "Release of prostaglandins",
            "D": "Mast cell degranulation",
            "E": "T cell activation"
        },
        "response": {
            "0.3": "The consensus among the experts is clear, with all three specialists (cardiologist, pharmacologist, and dermatologist) agreeing that the side effect the physician is trying to avoid by recommending aspirin alongside high-dose niacin is related to the release of prostaglandins. They all provided similar reasoning, explaining that niacin can cause flushing due to vasodilation mediated by prostaglandins, and that aspirin helps mitigate this effect by inhibiting the production of prostaglandins.\n\nGiven the strong agreement and the quality of reasoning provided by the experts, the final answer to the question is:\n\n(C) Release of prostaglandins."
        },
        "difficulty": "intermediate",
        "api_calls": 10
    },
    {
        "question": "A 58-year-old male presents with an acutely elevated blood pressure of 220/140 mmHg. The patient complains of a headache and chest pain, and he has been vomiting for the last several hours. Physical exam demonstrates papilledema and a depressed level of consciousness. To treat this patient's hypertensive emergency, he is started on an IV medication commonly used in this situation. The agent exerts its effect by releasing nitric oxide as a metabolite, which subsequently activates guanylate cyclase and increases production of cGMP in vascular smooth muscle. Which of the following clinical effects would be expected from administration of this medication? Options: (E) Increased systemic vascular resistance (C) Decreased stroke volume (B) Increased left ventricular end-diastolic pressure (D) Decreased pulmonary capillary wedge pressure (A) Decreased cardiac contractility",
        "label": "D",
        "answer": "Decreased pulmonary capillary wedge pressure",
        "options": {
            "A": "Decreased cardiac contractility",
            "B": "Increased left ventricular end-diastolic pressure",
            "C": "Decreased stroke volume",
            "D": "Decreased pulmonary capillary wedge pressure",
            "E": "Increased systemic vascular resistance"
        },
        "response": {
            "0.3": "Based on the multidisciplinary team discussion, there is a clear consensus among the experts regarding the expected clinical effects of the medication used in this hypertensive emergency scenario. The medication in question, which acts by releasing nitric oxide and increasing cGMP in vascular smooth muscle, is expected to induce vasodilation. \n\nThe experts have reasoned that this vasodilation leads to:\n\n1. **Decreased systemic vascular resistance (SVR)** - This is a direct effect of vasodilation.\n2. **Decreased left ventricular end-diastolic pressure (LVEDP)** - This is expected as a result of reduced preload due to the decrease in systemic vascular resistance.\n3. **Decreased pulmonary capillary wedge pressure (PCWP)** - This is also anticipated due to the reduction in pressures across the pulmonary circulation from the vasodilatory effect.\n\nThe options provided were evaluated, and the consensus among the experts is that the most appropriate expected clinical effect from the administration of the medication is:\n\n(D) Decreased pulmonary capillary wedge pressure.\n\nThis reflects the understanding that the medication's vasodilatory effects will lead to a reduction in pressures in the heart and pulmonary vessels, which is crucial in managing the patient's hypertensive emergency and associated symptoms. \n\nFinal Decision:\n(D) Decreased pulmonary capillary wedge pressure."
        },
        "difficulty": "intermediate",
        "api_calls": 10
    },
    {
        "question": "A 63-year-old man is aiming to improve his health by eating a well balanced diet, walking daily, and quitting smoking following a 45-year smoking history. While on his daily walks he notices a strong cramping pain in his calves that consistently appears after a mile of walking. He sees his physician and a diagnosis of peripheral artery disease with intermittent claudication is made. To improve his symptoms, cilostazol is prescribed. What is the mechanism of action of this medication? Options: (A) Irreversible cyclooxygenase inhibitor (E) Phosphodiesterase inhibitor (C) Thromboxane synthase inhibitor (D) Adenosine diphosphate receptor inhibitor (B) Glycoprotein IIB/IIIA inhibitor",
        "label": "E",
        "answer": "Phosphodiesterase inhibitor",
        "options": {
            "A": "Irreversible cyclooxygenase inhibitor",
            "B": "Glycoprotein IIB/IIIA inhibitor",
            "C": "Thromboxane synthase inhibitor",
            "D": "Adenosine diphosphate receptor inhibitor",
            "E": "Phosphodiesterase inhibitor"
        },
        "response": {
            "0.3": "Let's analyze the question step by step. The patient has been diagnosed with peripheral artery disease (PAD) and is experiencing intermittent claudication, which is characterized by pain in the muscles due to inadequate blood flow during exercise. Cilostazol is a medication commonly used to treat this condition.\n\nCilostazol works primarily as a phosphodiesterase inhibitor. By inhibiting phosphodiesterase type 3 (PDE3), cilostazol increases the levels of cyclic adenosine monophosphate (cAMP) in platelets and vascular smooth muscle cells. This leads to vasodilation and reduced platelet aggregation, which can improve blood flow and alleviate symptoms of claudication.\n\nGiven this mechanism of action, the correct answer is:\n\nAnswer: (E) Phosphodiesterase inhibitor"
        },
        "difficulty": "basic",
        "api_calls": 5
    },
    {
        "question": "A 69-year-old man presents to his primary care physician with hip and back pain. The patient states that this weekend he had a barbecue. When he was lifting a heavy object he suddenly felt pain in his lower back. He describes the pain as in his buttocks but states that at times it travels down his leg. The patient states that it feels, \"electrical.\" The patient has a past medical history of obesity, diabetes, depression, anxiety, diverticulosis, constipation, and a surgical repair of his anterior cruciate ligament. His current medications include metformin, insulin, lisinopril, fluoxetine, and sodium docusate. Which of the following is most likely to help confirm the diagnosis? Options: (B) Flexion, abduction, and external rotation of the thigh (E) Radiography (A) Palpating the paraspinus muscle (C) Straight leg raise (D) Internal rotation of the extended hip",
        "label": "C",
        "answer": "Straight leg raise",
        "options": {
            "A": "Palpating the paraspinus muscle",
            "B": "Flexion, abduction, and external rotation of the thigh",
            "C": "Straight leg raise",
            "D": "Internal rotation of the extended hip",
            "E": "Radiography"
        },
        "response": {
            "0.3": "Based on the multidisciplinary team discussion, there is a clear consensus among the experts regarding the patient's symptoms and the most appropriate diagnostic test. All three specialists\u2014orthopedic surgeon, physical therapist, and neurologist\u2014agree that the patient's presentation of lower back pain radiating to the buttocks and down the leg, along with the description of \"electrical\" pain, is indicative of lumbar radiculopathy or possible nerve root involvement.\n\nThe \"Straight leg raise\" (C) test is specifically designed to assess for nerve root irritation, particularly in cases of lumbar disc herniation, which aligns with the patient's symptoms. Each expert provided a rationale supporting the use of this test to confirm the diagnosis, emphasizing its relevance in evaluating nerve root involvement.\n\nGiven the strong agreement and reasoning quality among the experts, the final answer to the question is:\n\n**(C) Straight leg raise.**"
        },
        "difficulty": "intermediate",
        "api_calls": 10
    },
    {
        "question": "A 35-year-old woman comes to the physician for genetic counseling prior to conception. Her younger brother has mild developmental delay, pale complexion, and has to limit his dietary intake of phenylalanine. She has no similar symptoms and is in good health. Her parents are healthy. Which of the following is the most appropriate assessment of her carrier status for the disease affecting her brother? Options: (C) 100% (E) 50% (B) 33% (A) 67% (D) 75%",
        "label": "A",
        "answer": "67%",
        "options": {
            "A": "67%",
            "B": "33%",
            "C": "100%",
            "D": "75%",
            "E": "50%"
        },
        "response": {
            "0.3": "Let's analyze the situation step by step.\n\nThe brother's symptoms (mild developmental delay, pale complexion, and dietary restriction of phenylalanine) are suggestive of phenylketonuria (PKU), which is an autosomal recessive disorder. In autosomal recessive inheritance, both parents must be carriers of the gene mutation for a child to be affected.\n\n1. Since the brother has PKU, he must have inherited one mutated allele from each parent.\n2. The parents are healthy, which suggests they are likely carriers of the PKU gene mutation (each carrying one normal allele and one mutated allele).\n3. The woman in question is the sister of the affected brother. For her to be a carrier, she must have inherited one of the alleles from one of her parents.\n\nNow, we can assess the probabilities:\n- Each parent has a 50% chance of passing on the mutated allele to their children.\n- Since the brother has PKU (and thus has two mutated alleles), the woman has a 2/3 chance of being a carrier because she could inherit either a normal allele or a mutated allele from each parent.\n\nThus, the most appropriate assessment of her carrier status for the disease affecting her brother is 67%.\n\nAnswer: (A) 67%"
        },
        "difficulty": "basic",
        "api_calls": 5
    },
    {
        "question": "A 25-year-old man is brought to the emergency department after being found unconscious. He was at a college party exhibiting belligerent behavior when he suddenly passed out and fell to the ground. His past medical history is not known. His temperature is 100\u00b0F (37.8\u00b0C), blood pressure is 107/48 mmHg, pulse is 125/min, respirations are 19/min, and oxygen saturation is 99% on room air. The patient is covered with emesis and responds incoherently to questions. As the patient begins to wake up he continues vomiting. The patient is started on IV fluids, analgesics, and anti-emetics and begins to feel better. Thirty minutes later the patient presents with muscle rigidity and is no longer responding coherently to questions. His temperature is 103\u00b0F (39.4\u00b0C), blood pressure is 127/68 mmHg, pulse is 125/min, respirations are 18/min, and oxygen saturation is 98% on room air. The patient's basic laboratory studies are drawn and he is started on IV fluids, given lorazepam, and placed under a cooling blanket. Despite these initial measures, his symptoms persist. Which of the following is the best next step in management? Options: (D) Intubation (B) Dantrolene (E) Supportive therapy (C) Diazepam (A) Acetaminophen",
        "label": "B",
        "answer": "Dantrolene",
        "options": {
            "A": "Acetaminophen",
            "B": "Dantrolene",
            "C": "Diazepam",
            "D": "Intubation",
            "E": "Supportive therapy"
        },
        "response": {
            "0.3": "Let's analyze the case step by step. The patient is a 25-year-old man who was found unconscious after exhibiting belligerent behavior at a party. He has a history of vomiting, altered mental status, muscle rigidity, and hyperthermia (temperature of 103\u00b0F). These symptoms, especially the muscle rigidity and hyperthermia, raise suspicion for a serious condition such as neuroleptic malignant syndrome (NMS) or serotonin syndrome, particularly given the context of potential substance use at a party.\n\nGiven that the patient is experiencing muscle rigidity and hyperthermia, the best next step in management is to administer dantrolene, which is effective in treating hyperthermia and muscle rigidity associated with NMS. While supportive therapy is important, the presence of severe muscle rigidity and hyperthermia indicates that more specific treatment is warranted.\n\nTherefore, the best next step in management is:\n**Answer: (B) Dantrolene**"
        },
        "difficulty": "basic",
        "api_calls": 5
    },
    {
        "question": "A 47-year-old executive schedules an appointment his physician for a routine medical check-up. He currently has no complaints and claims to be \u201cas fit as a fiddle.\u201d The physical examination findings are unremarkable, except for a mid-systolic murmur heard in the 2nd left intercostal space that radiates to the carotids on auscultation. The physician instructs the patient to stand from a supine position with the stethoscope still placed on his chest. Which of the following changes would occur with this maneuver? Options: (E) A reduction in diastolic filling time (C) An increase in pulmonary capillary wedge pressure (A) An increase in right atrial pressure (D) A reduction in the slope of the pacemaker potential (B) An increase in left ventricular end-diastolic pressure",
        "label": "E",
        "answer": "A reduction in diastolic filling time",
        "options": {
            "A": "An increase in right atrial pressure",
            "B": "An increase in left ventricular end-diastolic pressure",
            "C": "An increase in pulmonary capillary wedge pressure",
            "D": "A reduction in the slope of the pacemaker potential",
            "E": "A reduction in diastolic filling time"
        },
        "response": {
            "0.3": "The correct answer to the question regarding the physiological changes that occur when the patient transitions from a supine to a standing position is:\n\n**(E) A reduction in diastolic filling time.**\n\n### Rationale:\n1. **Physiological Changes Upon Standing**: When a patient stands up, gravity causes a decrease in venous return to the heart. This results in decreased preload, which is the volume of blood in the ventricles at the end of diastole.\n\n2. **Impact on Cardiac Function**: The reduction in preload leads to a decrease in left ventricular end-diastolic volume (LVEDV) and pressure (LVEDP). Consequently, this affects the heart's ability to fill adequately during diastole, resulting in a reduction in diastolic filling time.\n\n3. **Dismissal of Incorrect Options**:\n   - **(C) An increase in pulmonary capillary wedge pressure**: This would indicate heart failure or volume overload, which is not consistent with the physiological response to decreased venous return.\n   - **(A) An increase in right atrial pressure**: This is unlikely, as decreased preload typically leads to a decrease or stable right atrial pressure.\n   - **(D) A reduction in the slope of the pacemaker potential**: This parameter relates to electrical conduction and is not directly influenced by changes in body position.\n   - **(B) An increase in left ventricular end-diastolic pressure**: This contradicts the expected physiological response to decreased preload.\n\n### Conclusion:\nThe transition from a supine to a standing position primarily results in a reduction in diastolic filling time due to decreased preload and LVEDV. This understanding is crucial for evaluating cardiac function and managing patients, particularly those who may be susceptible to hemodynamic instability during postural changes."
        },
        "difficulty": "advanced",
        "api_calls": 28
    },
    {
        "question": "A 39-year-old African-American woman presents to the emergency room with hip pain. She has a past medical history significant for sarcoidosis which was recently diagnosed 6 months ago and is currently being treated. She reports that the pain started 2 weeks ago and is localized to the left hip and groin. The pain has been getting progressively more intense. Her temperature is 98.1\u00b0F (36.7\u00b0C), blood pressure is 122/78 mm Hg, pulse is 80/min, respirations are 13/min, and oxygen saturation is 98% on room air. Physical exam is notable for pain with manipulation without restriction of range of motion of the hip. Which of the following is the most sensitive test for this condition? Options: (A) CT of the hip (E) Ultrasound of the hip (D) Radionuclide scan of the hip (C) Radiograph of the hip (B) MRI of the hip",
        "label": "B",
        "answer": "MRI of the hip",
        "options": {
            "A": "CT of the hip",
            "B": "MRI of the hip",
            "C": "Radiograph of the hip",
            "D": "Radionuclide scan of the hip",
            "E": "Ultrasound of the hip"
        },
        "response": {
            "0.3": "Let's analyze the situation step by step.\n\nThe patient is a 39-year-old African-American woman with hip pain and a history of sarcoidosis. The pain is localized to the left hip and groin, has been progressively worsening, and there is no restriction of range of motion, which suggests that the hip joint itself may not be the primary issue. \n\nGiven her history of sarcoidosis, one possible concern is avascular necrosis (AVN) of the hip, which can occur due to corticosteroid use or other factors associated with sarcoidosis. The symptoms of hip pain, especially in the absence of significant physical findings, raise suspicion for this condition.\n\nNow, let's evaluate the imaging options provided:\n\n- (A) CT of the hip: Good for assessing bony structures but not the most sensitive for early detection of AVN.\n- (B) MRI of the hip: This is the most sensitive test for detecting early changes of avascular necrosis, including bone marrow edema and other subtle changes that are not visible on X-rays.\n- (C) Radiograph of the hip: This is often the first imaging study done but may miss early AVN changes.\n- (D) Radionuclide scan of the hip: Can be used to assess bone metabolism but is not as sensitive as MRI for AVN.\n- (E) Ultrasound of the hip: Useful for soft tissue evaluation but not the best for detecting AVN.\n\nConsidering all of this, the most sensitive test for detecting avascular necrosis in this patient would be:\n\n**Answer: (B) MRI of the hip**"
        },
        "difficulty": "basic",
        "api_calls": 5
    },
    {
        "question": "A 74-year-old man undergoes an open cholecystectomy. Surgery is performed under general anesthesia for which the patient is intubated with an endotracheal tube. Directly following the procedure, his temperature is 37\u00b0C (98.6\u00b0F), pulse is 80/min, and blood pressure is 110/80 mm Hg. He is extubated as soon as he showed signs of alertness. Five minutes later, he becomes unresponsive. He has type 2 diabetes mellitus, coronary artery disease, and hypertension. He underwent stenting of the right coronary artery 10 years ago. He smoked one pack of cigarettes daily for 40 years but quit 2 weeks ago for surgery. He drinks one to two beers daily. His current medications include metformin, enalapril, aspirin, atorvastatin, and a multivitamin. His temperature is 37\u00b0C (98.6\u00b0F), pulse is 102/min, respirations are 20/min, and blood pressure is 130/80 mm Hg. Pulse oximetry shows an oxygen saturation of 73%. He is put on a non-rebreather mask with an FiO2 of 100%. Three minutes later, he is still unresponsive. His arterial blood gas analysis shows:\npH 7.32\nPCO2 33 mm Hg\nPO2 73 mm Hg\nHCO3 22 mEq/L\nO2 saturation 73%\nWhich of the following is the best next step in the management of this patient?\" Options: (A) Perform tracheostomy (D) Close observation only (E) Start BiPAP (B) Continue using the non-rebreather mask (C) Reintubate",
        "label": "C",
        "answer": "Reintubate",
        "options": {
            "A": "Perform tracheostomy",
            "B": "Continue using the non-rebreather mask",
            "C": "Reintubate",
            "D": "Close observation only",
            "E": "Start BiPAP"
        },
        "response": {
            "0.3": "The best next step in the management of this patient is **(C) Reintubate**.\n\nGiven the patient's critical condition characterized by unresponsiveness and severe hypoxemia (oxygen saturation of 73% despite 100% oxygen via a non-rebreather mask), reintubation is necessary to secure the airway and ensure adequate ventilation. The arterial blood gas analysis indicates acidosis and significant respiratory distress, further justifying the need for immediate intervention.\n\nOther options, such as performing a tracheostomy, continuing with the non-rebreather mask, starting BiPAP, or close observation, are not appropriate given the severity of the patient's condition and the need for urgent airway management. Therefore, reintubation is the most suitable and immediate action to stabilize the patient."
        },
        "difficulty": "advanced",
        "api_calls": 28
    },
    {
        "question": "A 38-year-old woman presents to her primary care physician for her yearly exam. Her only complaint is difficulty losing weight. Her BMI is 34 kg/m^2. In addition to a standard physical exam, the physician orders a glucose tolerance test. The woman's fasting blood glucose level is 120 mg/dL and two-hour post 75g glucose load blood glucose level is 190 mg/dL. The physician informs the patient that she is \"pre-diabetic\" or at risk of developing diabetes and recommends lifestyle modification with follow-up in 6 months. Which of the following endogenous signaling molecules or receptors will increase insulin sensitivity in this patient? Options: (B) Glucagon (D) Peroxisome proliferator-activated receptor gamma (E) TNF-alpha (A) Catecholamines (C) Glucocorticoids",
        "label": "D",
        "answer": "Peroxisome proliferator-activated receptor gamma",
        "options": {
            "A": "Catecholamines",
            "B": "Glucagon",
            "C": "Glucocorticoids",
            "D": "Peroxisome proliferator-activated receptor gamma",
            "E": "TNF-alpha"
        },
        "response": {
            "0.3": "Let's analyze the options step by step in relation to increasing insulin sensitivity.\n\n1. **Glucagon (B)**: Glucagon primarily raises blood glucose levels by promoting gluconeogenesis and glycogenolysis in the liver. It does not increase insulin sensitivity; in fact, it can have the opposite effect.\n\n2. **Peroxisome proliferator-activated receptor gamma (D)**: PPAR-gamma is a nuclear receptor that plays a significant role in the regulation of glucose and lipid metabolism. It is involved in adipocyte differentiation and has been shown to improve insulin sensitivity, particularly in the context of thiazolidinedione medications (which are PPAR-gamma agonists). This option is likely to increase insulin sensitivity.\n\n3. **TNF-alpha (E)**: Tumor necrosis factor-alpha is a pro-inflammatory cytokine that is associated with insulin resistance. High levels of TNF-alpha are linked to decreased insulin sensitivity, so this option would not be correct.\n\n4. **Catecholamines (A)**: Catecholamines (like epinephrine and norepinephrine) can increase blood glucose levels and promote insulin resistance, especially during stress responses. They do not increase insulin sensitivity.\n\n5. **Glucocorticoids (C)**: Glucocorticoids (like cortisol) promote gluconeogenesis and can lead to insulin resistance, so they do not increase insulin sensitivity.\n\nBased on this analysis, the correct answer is:\n\n**Answer: (D) Peroxisome proliferator-activated receptor gamma**"
        },
        "difficulty": "basic",
        "api_calls": 5
    },
    {
        "question": "A 21-year-old woman presents to the emergency room with right arm pain and limited range of motion. She does not recall trauma to the arm. She also complains of diarrhea and nausea. She is sexually active with one male partner and admits to having pain during intercourse. There is vague and diffuse tenderness to palpation in all four abdominal quadrants. No erythema or edema is noted on the right arm. The fecal occult test is negative. Past records show that this patient has been in the ER 7 times in the past year with similar symptoms. Which of the following is the most likely diagnosis? Options: (B) Illness anxiety disorder (D) Somatoform pain disorder (C) Somatization disorder (A) Ulcerative colitis (E) Conversion disorder",
        "label": "C",
        "answer": "Somatization disorder",
        "options": {
            "A": "Ulcerative colitis",
            "B": "Illness anxiety disorder",
            "C": "Somatization disorder",
            "D": "Somatoform pain disorder",
            "E": "Conversion disorder"
        },
        "response": {
            "0.3": "Based on the comprehensive analysis of the patient's symptoms, medical history, and the findings from the multidisciplinary team discussions, the most likely diagnosis for this 21-year-old woman is **(C) Somatization disorder**.\n\nThis conclusion is supported by the following key points:\n\n1. **Symptomatology**: The patient presents with multiple physical complaints, including right arm pain, gastrointestinal symptoms (diarrhea and nausea), and pain during intercourse, which do not correlate with any identifiable medical conditions.\n\n2. **Chronicity**: The patient's history of recurrent emergency room visits for similar symptoms without a definitive organic diagnosis indicates a chronic pattern of somatic complaints.\n\n3. **Exclusion of Other Diagnoses**: Other potential diagnoses, such as ulcerative colitis, illness anxiety disorder, somatoform pain disorder, and conversion disorder, have been systematically ruled out based on the patient's clinical presentation and the absence of identifiable medical causes.\n\n4. **Psychosomatic Connection**: The symptoms appear to reflect underlying psychological distress, which aligns with the characteristics of somatization disorder, where psychological issues manifest as physical symptoms.\n\nIn conclusion, the diagnosis of **Somatization disorder** is the most fitting and aligns with the comprehensive assessment conducted by the multidisciplinary team."
        },
        "difficulty": "advanced",
        "api_calls": 28
    },
    {
        "question": "A 12-year-old boy is brought to the emergency department for the evaluation of persistent bleeding from his nose over the past hour. The bleeding started spontaneously. He has no history of a similar episode. He takes no medications. There is no history of abnormal bleeding in the family. His vital signs are within normal limits. On examination, he is pressing a gauze against his left nostril while hyperextending his head. The gauze is stained with blood and upon withdrawal of the gauze blood slowly drips out of his left nostrils. There is no bleeding from the right nostril. The remainder of the physical examination shows no abnormalities. Which of the following is the most appropriate initial therapy? Options: (A) Anterior packing and topical antibiotics (B) Oxymetazoline nasal spray (C) Placement of an epinephrine gauze in the left nostril (D) Silver nitrate cauterization of the bleeding vessel and surrounding vessels (E) Squeezing the nostrils manually for 10 minutes with the head elevated",
        "label": "E",
        "answer": "Squeezing the nostrils manually for 10 minutes with the head elevated",
        "options": {
            "A": "Anterior packing and topical antibiotics",
            "B": "Oxymetazoline nasal spray",
            "C": "Placement of an epinephrine gauze in the left nostril",
            "D": "Silver nitrate cauterization of the bleeding vessel and surrounding vessels",
            "E": "Squeezing the nostrils manually for 10 minutes with the head elevated"
        },
        "response": {
            "0.3": "Let's analyze the situation step by step. The patient is a 12-year-old boy with spontaneous unilateral nasal bleeding (epistaxis) from the left nostril. He is currently applying pressure to the area, which is a common first step in managing epistaxis. \n\nIn cases of anterior epistaxis, which is the most common type, initial management typically involves:\n\n1. **Manual compression**: Squeezing the nostrils together for about 10 minutes while keeping the head elevated can help to control the bleeding by applying direct pressure to the bleeding site.\n\n2. **Topical vasoconstrictors**: If manual pressure does not resolve the bleeding, topical agents like oxymetazoline can be used to help constrict blood vessels.\n\nGiven that the boy is already applying pressure and the question asks for the most appropriate initial therapy, the best answer is:\n\n**(E) Squeezing the nostrils manually for 10 minutes with the head elevated.**\n\nThis method is the first-line treatment for managing epistaxis and should be attempted before considering other interventions."
        },
        "difficulty": "basic",
        "api_calls": 5
    },
    {
        "question": "A 33-year-old man presents to the infectious diseases clinic for follow-up. He was recently admitted to the hospital with fever, shortness of breath, and cough, and was found to have Pneumocystic jirovecii pneumonia and a new diagnosis of HIV. His CD4 count is 175, viral load is pending. As part of routine laboratory studies given his new diagnosis, an RPR was found to be positive with a titer of 1:64, and this is confirmed with a positive FTA-ABS. He is unsure when or how he acquired HIV or syphilis. His neurological examination is normal, and he has no symptoms. Which of the following is the most appropriate next step in management: Options: (B) Treat with three weekly injections of penicillin, obtain titers in 3 months (E) Treat with a single injection of penicillin, obtain titers in 6 months (A) Perform lumbar puncture, treat based on presence or absence of CNS disease (D) Treat with a single injection of penicillin, obtain titers in 3 months (C) Treat with three weekly injections of penicillin, obtain titers in 6 months",
        "label": "C",
        "answer": "Treat with three weekly injections of penicillin, obtain titers in 6 months",
        "options": {
            "A": "Perform lumbar puncture, treat based on presence or absence of CNS disease",
            "B": "Treat with three weekly injections of penicillin, obtain titers in 3 months",
            "C": "Treat with three weekly injections of penicillin, obtain titers in 6 months",
            "D": "Treat with a single injection of penicillin, obtain titers in 3 months",
            "E": "Treat with a single injection of penicillin, obtain titers in 6 months"
        },
        "response": {
            "0.3": "The most appropriate next step in the management of this patient, who has been diagnosed with early-stage syphilis and is also living with HIV, is to **(D) Treat with a single injection of penicillin, obtain titers in 3 months**.\n\n### Rationale:\n1. **Diagnosis Confirmation**: The positive RPR titer of 1:64 and positive FTA-ABS confirm early syphilis.\n2. **Neurological Assessment**: The patient exhibits no neurological symptoms, and the neurological examination is normal, indicating no need for a lumbar puncture.\n3. **Treatment Guidelines**: Current clinical guidelines recommend treating early syphilis with a single intramuscular injection of Benzathine Penicillin G, which is effective even in immunocompromised patients such as those with HIV.\n4. **Follow-Up Protocol**: It is standard practice to obtain RPR titers at 3 months post-treatment to monitor the effectiveness of the intervention, especially in immunocompromised individuals.\n\n### Conclusion:\nGiven the patient's clinical status and the guidelines for managing early syphilis in the context of HIV, the correct management step is to administer a single injection of penicillin and schedule follow-up RPR titers in 3 months. Therefore, the answer is **(D)**."
        },
        "difficulty": "advanced",
        "api_calls": 28
    },
    {
        "question": "A 17-year-old woman presents to your office concerned that she has not had her menstrual period in 4 months. She states that menses began at age of 13 and has been regular until two months ago. She denies sexual activity, and urine pregnancy test is negative. On exam, she appears well-nourished with a BMI of 21 kg/m^2, but you note that she has enlarged cheeks bilaterally and has calluses on the dorsum of her hands. She says that she has been very stressed with school and has recently been binge eating. What other finding do you expect to see in this patient? Options: (D) Enlarged thyroid (B) Increased blood glucose level (E) Elevated estrogen levels (A) Malar rash (C) Erosion of tooth enamel",
        "label": "C",
        "answer": "Erosion of tooth enamel",
        "options": {
            "A": "Malar rash",
            "B": "Increased blood glucose level",
            "C": "Erosion of tooth enamel",
            "D": "Enlarged thyroid",
            "E": "Elevated estrogen levels"
        },
        "response": {
            "0.3": "Based on the consensus among the experts and their reasoning, the final answer to the question regarding the expected finding in the 17-year-old woman presenting with signs suggestive of binge eating disorder or bulimia nervosa is:\n\n(C) Erosion of tooth enamel.\n\nAll experts agree that the presence of calluses on the hands and enlarged cheeks indicates behaviors associated with bulimia nervosa, and erosion of tooth enamel is a common consequence of repeated vomiting due to exposure to gastric acid. This finding aligns well with the clinical presentation and the expert opinions provided."
        },
        "difficulty": "intermediate",
        "api_calls": 10
    },
    {
        "question": "A 3rd year resident in good standing with his residency training program would like to work more hours outside his residency obligations to gain more experience and pay for his medical school loans. He currently works and trains 60 hours per week as a resident and has a 10-hour shift external to his residency program on Saturdays. He is free of any educational and work obligations on Sundays. Based on the most recent standards set by the Accreditation Council for Graduate Medical Education (ACGME), which of the following is the most accurate statement regarding this resident\u2019s moonlighting and patient safety? Options: (B) He is not allowed to work outside the scope of his residency training (C) He may work longer shifts (E) He may work up to 20 more hours (D) He may work more hours on Sundays (A) He is already overcommitting and must reduce the number of hours",
        "label": "C",
        "answer": "He may work longer shifts",
        "options": {
            "A": "He is already overcommitting and must reduce the number of hours",
            "B": "He is not allowed to work outside the scope of his residency training",
            "C": "He may work longer shifts",
            "D": "He may work more hours on Sundays",
            "E": "He may work up to 20 more hours"
        },
        "response": {
            "0.3": "Based on the comprehensive analysis of the resident's current workload and the recommendations from multiple expert teams, the most accurate statement regarding the resident\u2019s moonlighting and patient safety is:\n\n(A) He is already overcommitting and must reduce the number of hours.\n\nThis conclusion is supported by the fact that while the resident is technically within the ACGME's maximum allowable hours, the cumulative workload of 70 hours per week raises significant concerns about fatigue and its implications for both the resident's health and patient safety. The consensus among the assessment teams emphasizes the importance of prioritizing resident well-being and ensuring high-quality patient care, which suggests that the resident should not increase his hours further."
        },
        "difficulty": "advanced",
        "api_calls": 28
    },
    {
        "question": "A 28-year-old woman comes to the obstetrics and gynecology clinic because she has been unsuccessfully trying to conceive with her husband for the last 2 years. He has had 2 children from a previous marriage and has been tested for causes of male infertility. She has had prior abdominal surgery as well as a family history of endocrine abnormalities. Based on this history, a panel of tests are obtained and treatment is started. This treatment will be administered intermittently one week before her normal menstrual cycle. If the most likely drug prescribed in this case was administered in a different manner, which of the following conditions may also be treated by this drug? Options: (B) Parkinson disease (D) Premature labor (E) Prostate cancer (C) Polycystic ovarian syndrome (A) Diabetes",
        "label": "E",
        "answer": "Prostate cancer",
        "options": {
            "A": "Diabetes",
            "B": "Parkinson disease",
            "C": "Polycystic ovarian syndrome",
            "D": "Premature labor",
            "E": "Prostate cancer"
        },
        "response": {
            "0.3": "Let's analyze the question step by step. The scenario describes a 28-year-old woman who has been trying to conceive and has a history that suggests possible issues related to ovulation or hormonal regulation. Given that she is being treated with a medication administered one week before her normal menstrual cycle, it is likely that she is being prescribed a medication to induce ovulation or regulate her menstrual cycle.\n\nThe most common medication used for this purpose is Clomiphene citrate, which is often used in cases of anovulation or irregular ovulation, such as in polycystic ovarian syndrome (PCOS). \n\nNow, the question asks what other condition could be treated if the drug was administered differently. Clomiphene citrate is not typically used for treating Parkinson's disease, premature labor, prostate cancer, or diabetes. However, if we consider other hormonal treatments, medications like estrogen or progesterone can be used for various conditions.\n\nAmong the options provided, (C) Polycystic ovarian syndrome is the most directly related to the treatment being administered (Clomiphene citrate). \n\nHowever, if we consider the possibility of using a different hormonal treatment, (A) Diabetes could be relevant in the context of using insulin or other hormonal therapies related to metabolic control.\n\nGiven this reasoning, the most appropriate answer based on the context of the question is:\n\n**Answer: (C) Polycystic ovarian syndrome.** \n\nThis is the condition that is most likely treated with the same drug (Clomiphene citrate) in a different manner."
        },
        "difficulty": "basic",
        "api_calls": 5
    },
    {
        "question": "A 68-year-old man presents to the emergency department with confusion. The patient lives in a nursing home and has Alzheimer dementia at baseline. His nurse noticed that he was more confused than usual and was somnolent for the past 12 hours. The patient\u2019s nurse also noticed that he was soiling his diapers more frequently with copious amounts of urine. The patient has lost 15 pounds since his last physician appointment 3 weeks ago. Laboratory values are ordered as seen below.\n\nSerum:\nNa+: 139 mEq/L\nCl-: 100 mEq/L\nK+: 4.3 mEq/L\nHCO3-: 25 mEq/L\nBUN: 20 mg/dL\nGlucose: 99 mg/dL\nCreatinine: 1.1 mg/dL\nCa2+: 12.2 mg/dL\nPTH: 8 pg/mL\n\nThe patient is referred to another physician for a more thorough workup including laboratory work and CT imaging. Which of the following is the best long-term prophylaxis for the cause of this patient\u2019s acute symptoms? Options: (C) Furosemide (B) Calcitonin (D) IV fluids (A) Alendronate (E) Teriparatide",
        "label": "A",
        "answer": "Alendronate",
        "options": {
            "A": "Alendronate",
            "B": "Calcitonin",
            "C": "Furosemide",
            "D": "IV fluids",
            "E": "Teriparatide"
        },
        "response": {
            "0.3": "After reviewing the conversation history and the reasoning provided by the multidisciplinary team, it is clear that all experts converged on the same conclusion regarding the best long-term prophylaxis for this patient's acute symptoms of hypercalcemia.\n\nThe patient presents with confusion and somnolence, alongside laboratory findings of hypercalcemia (Ca2+ of 12.2 mg/dL) and low parathyroid hormone (PTH) levels (PTH of 8 pg/mL). This indicates a non-PTH mediated cause of hypercalcemia, likely due to malignancy or another underlying condition.\n\nThe experts discussed various treatment options:\n- **Furosemide** and **IV fluids** were acknowledged as acute management strategies but not suitable for long-term prophylaxis.\n- **Calcitonin** was noted to provide temporary relief but not a long-term solution.\n- **Teriparatide** was ruled out as inappropriate due to the patient's hypercalcemia.\n\nThe consensus among the experts was that **Alendronate** (option A) is the most appropriate long-term management strategy. Alendronate is a bisphosphonate that inhibits bone resorption and can effectively manage hypercalcemia due to conditions such as malignancy or primary hyperparathyroidism over the long term.\n\nTherefore, the final answer to the question regarding the best long-term prophylaxis for the cause of this patient\u2019s acute symptoms is:\n\n**(A) Alendronate.**"
        },
        "difficulty": "intermediate",
        "api_calls": 10
    },
    {
        "question": "A one-week-old, full-term infant born by uncomplicated vaginal delivery is brought to a pediatrician by his mother, who notes that her daughter's skin appears yellow. She reports that the child cries several times per day and sleeps 7-8 hours at night, uninterrupted. She has been breastfeeding exclusively and feels that he has been feeding well. Which of the following is the best treatment for this condition? Options: (A) Phototherapy (D) Switch from breast milk to formula (E) Continue normal breast feeding (B) Phenobarbital administration (C) Plasma exchange",
        "label": "E",
        "answer": "Continue normal breast feeding",
        "options": {
            "A": "Phototherapy",
            "B": "Phenobarbital administration",
            "C": "Plasma exchange",
            "D": "Switch from breast milk to formula",
            "E": "Continue normal breast feeding"
        },
        "response": {
            "0.3": "Let's think step by step. \n\nThe infant is one week old and has jaundice, which is common in newborns. The key points in the scenario are that the infant is full-term, has been breastfeeding well, and the mother reports that the infant sleeps well and cries several times a day. \n\nIn newborns, jaundice can be physiological, especially if it appears after the first 24 hours of life and resolves within the first two weeks. Breastfeeding jaundice can occur due to inadequate intake, but the mother reports that the infant is feeding well. \n\nGiven that the infant is breastfeeding well and the jaundice is likely physiological, the best approach is to continue normal breastfeeding. Phototherapy is typically reserved for more severe cases of jaundice, particularly if bilirubin levels are high or rising rapidly. \n\nTherefore, the best treatment for this condition is:\n\nAnswer: (E) Continue normal breast feeding."
        },
        "difficulty": "basic",
        "api_calls": 5
    },
    {
        "question": "A 45-year-old woman presents to the physician with a history of headache, palpitations, and episodic diaphoresis. She was diagnosed with hypertension in the past and is now regularly taking antihypertensive medication (amlodipine 10 mg once daily). She has had a diffuse thyroid swelling for the past 4 months. She complains of pain in the long bones of her arms and legs for the past 3 months. She is slightly built, appears thin, and is anxious and apprehensive. Her skin is moist and warm. Her weight is 45 kg (99.2 lb) and height is 146 cm (4 ft 7 in); BMI is 21.12 kg/m2. Her pulse is 116/min, the blood pressure is 196/102 mm Hg, the respiratory rate is 29/min, and the temperature is 37.2\u00b0C (99.0\u00b0F). Diffuse and firm thyromegaly is present. Her upper extremities exhibit fine tremors during an anxiety attack. The laboratory test results reveal elevated 24-hour urinary VMA and metanephrines. Serum epinephrine, calcitonin, and parathormone levels are also elevated. Hypercalcemia and hyperglycemia are also noted. Which of the following is the most likely diagnosis? Options: (E) Neurofibromatosis (C) Multiple endocrine neoplasia (MEN) 2A (B) Multiple endocrine neoplasia (MEN) 1 (A) Von Hippel-Lindau syndrome (D) Multiple endocrine neoplasia (MEN) 2B",
        "label": "C",
        "answer": "Multiple endocrine neoplasia (MEN) 2A",
        "options": {
            "A": "Von Hippel-Lindau syndrome",
            "B": "Multiple endocrine neoplasia (MEN) 1",
            "C": "Multiple endocrine neoplasia (MEN) 2A",
            "D": "Multiple endocrine neoplasia (MEN) 2B",
            "E": "Neurofibromatosis"
        },
        "response": {
            "0.3": "Based on the comprehensive analysis of the patient's clinical presentation, laboratory findings, and the exclusion of other potential diagnoses, the most likely diagnosis is **Multiple Endocrine Neoplasia Type 2A (MEN 2A)** (Option C).\n\n### Rationale:\n\n1. **Clinical Symptoms:**\n   - The patient exhibits symptoms consistent with **pheochromocytoma**, including headaches, palpitations, diaphoresis, and hypertension. The elevated pulse rate and blood pressure further support this.\n   - The presence of **thyromegaly** and elevated calcitonin levels suggest **medullary thyroid carcinoma**, which is a hallmark of MEN 2A.\n   - The long bone pain, along with elevated parathormone and hypercalcemia, indicates **primary hyperparathyroidism**, completing the classic triad associated with MEN 2A.\n\n2. **Laboratory Findings:**\n   - Elevated 24-hour urinary VMA and metanephrines confirm the diagnosis of pheochromocytoma.\n   - Increased calcitonin levels are indicative of medullary thyroid carcinoma.\n   - Elevated parathormone levels and hypercalcemia confirm primary hyperparathyroidism.\n\n3. **Differential Diagnosis Exclusions:**\n   - **MEN 1** does not include medullary thyroid carcinoma.\n   - **MEN 2B** is characterized by mucosal neuromas and other features not present in this case.\n   - **Neurofibromatosis** and **Von Hippel-Lindau syndrome** do not align with the specific endocrine symptoms observed.\n\n### Conclusion:\nThe combination of pheochromocytoma, medullary thyroid carcinoma, and primary hyperparathyroidism strongly supports the diagnosis of **Multiple Endocrine Neoplasia Type 2A (MEN 2A)**. Therefore, the correct answer is **(C) Multiple endocrine neoplasia (MEN) 2A**."
        },
        "difficulty": "advanced",
        "api_calls": 28
    },
    {
        "question": "In a study to determine the risk factors for myocardial infarction (MI) at a young age (age < 30 years), 30 young patients with the condition are recruited into the study group. Sixty similar but healthy individuals are recruited into the control group. Educational status is considered to be an important variable, as it would affect the awareness of the disease and its risk factors among the participants. Based on the level of education, 2 groups are formed: low educational status and high educational status. A chi-square test is performed to test the significance of the relationship, and an odds ratio of 2.1 was computed for the association between low education and the risk of MI, with a confidence interval of 0.9\u20139.7. What inference can be made on the association between young age MI and educational status from this study? Options: (C) The association is not statistically significant, but low education is a risk factor. (B) The association is statistically significant, but low education is not a risk factor. (A) The association is not statistically significant, and low education is not a risk factor. (E) The association is statistically significant, and low education is a risk factor. (D) One can not comment, as the p-value is not given.",
        "label": "A",
        "answer": "The association is not statistically significant, and low education is not a risk factor.",
        "options": {
            "A": "The association is not statistically significant, and low education is not a risk factor.",
            "B": "The association is statistically significant, but low education is not a risk factor.",
            "C": "The association is not statistically significant, but low education is a risk factor.",
            "D": "One can not comment, as the p-value is not given.",
            "E": "The association is statistically significant, and low education is a risk factor."
        },
        "response": {
            "0.3": "Based on the conversation history and the reasoning provided by the experts, there is a clear consensus on the interpretation of the study results. \n\n1. The odds ratio of 2.1 indicates a potential association between low educational status and an increased risk of myocardial infarction (MI) in young individuals.\n2. However, the confidence interval of 0.9\u20139.7 includes the value of 1.0, which suggests that the association is not statistically significant.\n\nThe experts agree that while low educational status may be associated with increased odds of MI, the lack of statistical significance means we cannot definitively conclude that low education is a risk factor based on this study.\n\nGiven this reasoning, the most appropriate inference from the options provided is:\n\n(C) The association is not statistically significant, but low education is a risk factor.\n\nThus, the final decision is:\n\n**Answer: (C) The association is not statistically significant, but low education is a risk factor.**"
        },
        "difficulty": "intermediate",
        "api_calls": 10
    },
    {
        "question": "A 26-year-old woman is brought to the emergency department 20 minutes after being involved in a high-speed motor vehicle collision in which she was a restrained passenger. On arrival, she is lethargic and incoherent. She has severe facial lacerations and is in respiratory distress. Her pulse is 130/min, respirations are 29/min, and blood pressure is 90/58 mm Hg. Pulse oximetry on room air shows an oxygen saturation of 70%. Examination shows multiple facial lacerations. There is dullness to percussion and decreased breath sounds over the left lung base. Abdominal examination shows diffuse tenderness with no guarding or rebound. Bowel sounds are normal. The remainder of the examination shows no abnormalities. Her hemoglobin concentration is 12.1 g/dL. An x-ray of the chest shows a fractured left second rib, depression of the left mainstem bronchus, deviation of the nasogastric tube to the right, and a widened mediastinum. Which of the following is the most likely diagnosis? Options: (D) Cardiac tamponade (E) Tension pneumothorax (C) Thoracic aortic rupture (A) Diaphragmatic rupture (B) Traumatic bronchial rupture",
        "label": "C",
        "answer": "Thoracic aortic rupture",
        "options": {
            "A": "Diaphragmatic rupture",
            "B": "Traumatic bronchial rupture",
            "C": "Thoracic aortic rupture",
            "D": "Cardiac tamponade",
            "E": "Tension pneumothorax"
        },
        "response": {
            "0.3": "Let's analyze the scenario step by step.\n\n1. **Patient Presentation**: The patient is a 26-year-old woman involved in a high-speed motor vehicle collision. She presents with lethargy, incoherence, respiratory distress, and severe facial lacerations. Vital signs indicate tachycardia (pulse of 130/min), tachypnea (respirations of 29/min), and hypotension (blood pressure of 90/58 mm Hg). \n\n2. **Physical Examination Findings**: \n   - Dullness to percussion and decreased breath sounds over the left lung base suggest possible fluid accumulation (e.g., hemothorax or pleural effusion).\n   - The abdominal examination shows diffuse tenderness but no guarding or rebound, which may indicate intra-abdominal injury but is not definitive.\n   - The chest x-ray findings include a fractured left second rib, depression of the left mainstem bronchus, deviation of the nasogastric tube to the right, and a widened mediastinum.\n\n3. **Key Findings**:\n   - The widened mediastinum on chest x-ray is particularly concerning for a significant vascular injury, such as a thoracic aortic rupture.\n   - The depressed left mainstem bronchus could indicate significant trauma to the airway, but the combination of the rib fracture, mediastinal widening, and the mechanism of injury strongly suggests a thoracic aortic injury.\n\n4. **Differential Diagnosis**:\n   - **Cardiac Tamponade**: Typically presents with hypotension, muffled heart sounds, and distended neck veins, which are not described here.\n   - **Tension Pneumothorax**: Would likely present with tracheal deviation and respiratory distress but typically does not cause a widened mediastinum.\n   - **Thoracic Aortic Rupture**: Fits the presentation of mediastinal widening, rib fractures, and the mechanism of injury.\n   - **Diaphragmatic Rupture**: Would likely present with bowel sounds in the thorax, which is not indicated here.\n   - **Traumatic Bronchial Rupture**: Could cause respiratory distress, but the mediastinal widening is more suggestive of aortic injury.\n\nGiven the mechanism of injury, the vital signs, and the chest x-ray findings, the most likely diagnosis is:\n\n**Answer: (C) Thoracic aortic rupture**."
        },
        "difficulty": "basic",
        "api_calls": 5
    },
    {
        "question": "A 66-year-old male with a history of myocardial infarction presents to your primary care office with complaints of dyspnea on exertion and swollen feet and ankles. On exam, you note an elevated JVP and 2+ pitting edema of bilateral lower extremities. What is the most likely explanation for this patient's lower extremity edema? Options: (B) Decrease in plasma proteins (C) Increase in capillary permeability (E) Increase in interstitial fluid pressure (A) Increase in capillary pressure (D) Increase in colloid osmotic pressure",
        "label": "A",
        "answer": "Increase in capillary pressure",
        "options": {
            "A": "Increase in capillary pressure",
            "B": "Decrease in plasma proteins",
            "C": "Increase in capillary permeability",
            "D": "Increase in colloid osmotic pressure",
            "E": "Increase in interstitial fluid pressure"
        },
        "response": {
            "0.3": "Based on the conversation history and the consensus among the experts, the final answer to the question regarding the most likely explanation for the patient's lower extremity edema is:\n\n(A) Increase in capillary pressure.\n\nAll three experts (cardiologist, nephrologist, and internist) agree that the patient's clinical presentation is consistent with heart failure due to his history of myocardial infarction. They all highlight that the impaired pumping ability of the heart leads to increased venous pressure, which subsequently raises capillary pressure and causes fluid to leak into the interstitial spaces, resulting in edema. The reasoning provided by each expert is coherent and aligns with established medical understanding of heart failure and its effects on fluid dynamics. Therefore, the decision is clear and supported by the collective expertise of the team."
        },
        "difficulty": "intermediate",
        "api_calls": 10
    },
    {
        "question": "A 32-year-old woman presents to the emergency department with complaints of a headache. The last menstrual period was 4 months ago. She also reports having a mild headache for 1 month. There has been a grape-like mass protruding from her vagina for the last 15 days. On examination, the fundus of the uterus is at the level of the umbilicus and no fetal heart sounds are heard. The vital signs are as follows: blood pressure 160/100 mm Hg, pulse rate 108/min. On USG examination, no fetal parts are seen. What will be the genotype of the substance which will be aspirated by dilation and evacuation? Options: (C) 23XX (E) 46XX (B) 45XO (D) 47XYY (A) 69XXY",
        "label": "E",
        "answer": "46XX",
        "options": {
            "A": "69XXY",
            "B": "45XO",
            "C": "23XX",
            "D": "47XYY",
            "E": "46XX"
        },
        "response": {
            "0.3": "The clinical presentation and findings from the case strongly indicate a complete molar pregnancy. In complete molar pregnancies, the most common genetic abnormality is a triploid karyotype, specifically **69XXY**. This indicates that the tissue contains two maternal chromosomes and one paternal chromosome, which is characteristic of complete hydatidiform moles.\n\nGiven the options provided, the correct genotype of the substance that will be aspirated by dilation and evacuation is:\n\n**(A) 69XXY**."
        },
        "difficulty": "advanced",
        "api_calls": 28
    },
    {
        "question": "The Kozak sequence for the Beta-globin gene has a known mutation which decreases, though does not abolish, translation of the Beta-globin mRNA, leading to a phenotype of thalassemia intermedia. What would the blood smear be expected to show in a patient positive for this mutation? Options: (C) Microcytic red blood cells (A) Macrocytic red blood cells (D) Bite cells (B) Hyperchromic red blood cells (E) Ringed sideroblasts",
        "label": "C",
        "answer": "Microcytic red blood cells",
        "options": {
            "A": "Macrocytic red blood cells",
            "B": "Hyperchromic red blood cells",
            "C": "Microcytic red blood cells",
            "D": "Bite cells",
            "E": "Ringed sideroblasts"
        },
        "response": {
            "0.3": "Based on the consensus among the experts, all three specialists\u2014hematologist, medical geneticist, and pathologist\u2014agree that the expected blood smear in a patient with a mutation in the Kozak sequence of the Beta-globin gene leading to thalassemia intermedia would show (C) microcytic red blood cells. Their reasoning consistently highlights that thalassemia is characterized by reduced hemoglobin synthesis, resulting in smaller and often hypochromic red blood cells.\n\nGiven the unanimous agreement and the quality of reasoning provided by the experts, the final answer to the question is:\n\nAnswer: (C) Microcytic red blood cells."
        },
        "difficulty": "intermediate",
        "api_calls": 10
    },
    {
        "question": "A gunshot victim is brought to the Emergency Department and appears to be in shock. You note a penetrating wound at the level of L3. Assuming the bullet remained at this level, which vascular structure might have been injured? Options: (E) Portal vein (A) Inferior vena cava (B) Internal iliac artery (D) Renal artery (C) Internal iliac vein",
        "label": "A",
        "answer": "Inferior vena cava",
        "options": {
            "A": "Inferior vena cava",
            "B": "Internal iliac artery",
            "C": "Internal iliac vein",
            "D": "Renal artery",
            "E": "Portal vein"
        },
        "response": {
            "0.3": "The final answer to the question regarding which vascular structure might have been injured in a gunshot victim with a penetrating wound at the level of L3 is:\n\n**(A) Inferior vena cava.**\n\nThis conclusion is supported by a strong consensus among the multidisciplinary team, including a trauma surgeon, a vascular surgeon, and an emergency medicine physician. All experts emphasized the anatomical proximity of the inferior vena cava to the lumbar spine at the L3 level, making it the most likely structure to sustain injury from a penetrating wound in this scenario. Other vascular structures, such as the renal artery and internal iliac artery, were deemed less likely to be affected due to their anatomical locations relative to L3. Thus, prioritizing the assessment and management of potential IVC injury is critical for stabilizing the patient's condition."
        },
        "difficulty": "intermediate",
        "api_calls": 23
    },
    {
        "question": "A 51-year-old woman presents to her primary care physician complaining of months of dry mouth and dry eyes. She says the dryness has become so severe that she has difficulty swallowing food. She has a history of hypertension, for which she takes hydrochlorothiazide (HCTZ), but she has no other medical problems. Family history is significant for her grandmother having systemic lupus erythematosus. The vital signs include: blood pressure 118/76 mm Hg, heart rate 78/min, and respiratory rate 15/min. On physical exam, she has tender parotid glands bilaterally and dries mucous membranes. The presence of serum anti-Ro and anti-La autoantibodies is confirmed at high titers. In addition to her primary diagnosis, which of the following is this patient most at risk for developing in the future? Options: (E) Adenocarcinoma of the lung (C) Pancreatic adenocarcinoma (D) Invasive ductal carcinoma of the breast (A) Gastric carcinoma (B) Non-Hodgkin lymphoma",
        "label": "B",
        "answer": "Non-Hodgkin lymphoma",
        "options": {
            "A": "Gastric carcinoma",
            "B": "Non-Hodgkin lymphoma",
            "C": "Pancreatic adenocarcinoma",
            "D": "Invasive ductal carcinoma of the breast",
            "E": "Adenocarcinoma of the lung"
        },
        "response": {
            "0.3": "Let's analyze the information step by step.\n\nThe patient is presenting with symptoms of dry mouth (xerostomia) and dry eyes (xerophthalmia), which are characteristic of Sj\u00f6gren's syndrome. This autoimmune condition is associated with the presence of autoantibodies such as anti-Ro (SSA) and anti-La (SSB). \n\nIn addition to the primary symptoms of Sj\u00f6gren's syndrome, patients with this condition are at an increased risk for several complications, including lymphoproliferative disorders. Specifically, they have a significantly increased risk of developing non-Hodgkin lymphoma, particularly mucosa-associated lymphoid tissue (MALT) lymphoma.\n\nGiven the options provided, the most appropriate answer regarding what this patient is most at risk for developing in the future, in addition to her primary diagnosis of Sj\u00f6gren's syndrome, is:\n\n(B) Non-Hodgkin lymphoma."
        },
        "difficulty": "basic",
        "api_calls": 5
    },
    {
        "question": "A 35-year-old woman comes to the physician because of intermittent episodes of heart palpitations for 3 weeks. The palpitations are accompanied by chest pain that is sharp and localized to the left 3rd intercostal space. The patient does not smoke. She drinks one to two glasses of wine on the weekends. She appears nervous. Her pulse is 110/min and irregularly irregular, and blood pressure is 135/85 mmHg. Examination shows a fine tremor on both hands and digital swelling. There is retraction of the left upper eyelid. A systolic ejection murmur is heard along the right upper sternal border. The extremities are warm, and pulses are 2+ bilaterally. Which of the following is the most appropriate pharmacotherapy? Options: (A) Propranolol (B) Digoxin (C) Amiodarone (E) Diltiazem (D) Warfarin",
        "label": "A",
        "answer": "Propranolol",
        "options": {
            "A": "Propranolol",
            "B": "Digoxin",
            "C": "Amiodarone",
            "D": "Warfarin",
            "E": "Diltiazem"
        },
        "response": {
            "0.3": "The consensus among the experts is clear, with all three specialists (the cardiologist, endocrinologist, and pharmacologist) agreeing on the diagnosis of hyperthyroidism, likely due to Graves' disease, and the associated symptoms of palpitations, tremors, and atrial fibrillation. They all emphasize the importance of controlling the heart rate and addressing the symptoms of hyperthyroidism.\n\nPropranolol is unanimously recommended as the most appropriate pharmacotherapy because it effectively manages both the heart rate and the adrenergic symptoms associated with hyperthyroidism. The other options, such as digoxin, amiodarone, diltiazem, and warfarin, do not provide the same level of symptom control or are not first-line treatments in this context.\n\nGiven the strong agreement and reasoning provided by the experts, the final decision is:\n\n**(A) Propranolol**."
        },
        "difficulty": "intermediate",
        "api_calls": 10
    },
    {
        "question": "A medical student decides to join an immunology research center, which specifically works on capsular polysaccharide vaccine development against bacteria, such as Haemophilus influenzae type b (Hib), Neisseria meningitidis, and Streptococcus pneumoniae. As a member of a research team working on the Hib vaccine, he asks his senior colleague why capsular polysaccharides are conjugated to protein carriers like tetanus toxoid during vaccine development. Which of the following is the best response to this question? Options: (B) Conjugation with a protein carrier generates IgM dominant antibody responses (C) Polysaccharides conjugated with proteins are T cell-independent antigens (E) Conjugation with a protein carrier provides effective protection to infants (D) Conjugation with a protein carrier improves vaccine stability (A) Conjugation with a protein carrier generates IgG2 dominant antibody responses",
        "label": "E",
        "answer": "Conjugation with a protein carrier provides effective protection to infants",
        "options": {
            "A": "Conjugation with a protein carrier generates IgG2 dominant antibody responses",
            "B": "Conjugation with a protein carrier generates IgM dominant antibody responses",
            "C": "Polysaccharides conjugated with proteins are T cell-independent antigens",
            "D": "Conjugation with a protein carrier improves vaccine stability",
            "E": "Conjugation with a protein carrier provides effective protection to infants"
        },
        "response": {
            "0.3": "The best response to the medical student's question about why capsular polysaccharides are conjugated to protein carriers like tetanus toxoid during vaccine development is:\n\n**(E) Conjugation with a protein carrier provides effective protection to infants.**\n\nThis response is supported by the consensus among the experts, who highlighted that polysaccharide vaccines typically elicit a T cell-independent immune response, which is less effective, especially in infants. By conjugating the polysaccharide to a protein carrier, the immune response shifts to a T cell-dependent response, leading to improved immunogenicity, class switching to IgG, and enhanced immunological memory. This is particularly crucial for providing effective protection against encapsulated bacteria in vulnerable populations like infants."
        },
        "difficulty": "intermediate",
        "api_calls": 10
    },
    {
        "question": "A 45-year-old male with a history of diabetes and poorly controlled hypertension presents to his primary care physician for an annual check-up. He reports that he feels well and has no complaints. He takes enalapril and metformin. His temperature is 98.8\u00b0F (37.1\u00b0C), blood pressure is 155/90 mmHg, pulse is 80/min, and respirations are 16/min. His physician adds another anti-hypertensive medication to the patient\u2019s regimen. One month later, the patient returns to the physician complaining of new onset lower extremity swelling. Which of the following medications was likely prescribed to this patient? Options: (D) Hydrochlorthiazide (E) Spironolactone (A) Metoprolol (B) Verapamil (C) Nifedipine",
        "label": "C",
        "answer": "Nifedipine",
        "options": {
            "A": "Metoprolol",
            "B": "Verapamil",
            "C": "Nifedipine",
            "D": "Hydrochlorthiazide",
            "E": "Spironolactone"
        },
        "response": {
            "0.3": "Based on the consensus among the experts and the quality of their reasoning, the final decision is:\n\n**(C) Nifedipine**\n\nAll experts agreed that nifedipine, a dihydropyridine calcium channel blocker, is the most likely medication prescribed to the patient, as it is well-known to cause peripheral edema as a side effect. The other options were evaluated and found to be less likely to cause the new onset lower extremity swelling observed in the patient. Therefore, the addition of nifedipine explains the patient's symptoms effectively."
        },
        "difficulty": "intermediate",
        "api_calls": 10
    },
    {
        "question": "A 42-year-old man presents to his primary care physician for a follow-up visit. He has type 1 diabetes mellitus, for which he takes insulin. He complains of frequent episodes of waking up in the middle of his sleep. When he wakes up, he feels excessive sweating, hand tremors, and weakness. His morning blood glucose is high on repeated measurement. Which of the following is the optimal intervention for this patient condition? Options: (A) Reassurance (C) Adding pramlintide (E) Reducing daily insulin dose (D) Increasing daily insulin dose (B) Adding diazepam",
        "label": "E",
        "answer": "Reducing daily insulin dose",
        "options": {
            "A": "Reassurance",
            "B": "Adding diazepam",
            "C": "Adding pramlintide",
            "D": "Increasing daily insulin dose",
            "E": "Reducing daily insulin dose"
        },
        "response": {
            "0.3": "Let's analyze the situation step by step. The patient has type 1 diabetes and is experiencing symptoms consistent with hypoglycemia during the night, such as sweating, tremors, and weakness. These symptoms suggest that he may be having nocturnal hypoglycemic episodes, which can lead to increased blood glucose levels in the morning as a result of the body's counter-regulatory response.\n\nGiven that he is waking up with these symptoms and has high morning blood glucose levels, the most appropriate intervention would be to adjust his insulin regimen. Specifically, reducing the daily insulin dose may help prevent these nocturnal hypoglycemic episodes, thereby improving his overall blood glucose control and reducing the risk of hypoglycemia.\n\nTherefore, the optimal intervention for this patient's condition is:\n\nAnswer: (E) Reducing daily insulin dose"
        },
        "difficulty": "basic",
        "api_calls": 5
    }
]